ID,Type,ParaNo,ParaFormat,mqar,mqur,status,TypeNo
23,1,,1,,½بسم اللہ الرحمٰن الرحیم¼,,0
24,1,,5,,پیش گفتار,,0
25,1,,3,,½اَلْحَمْدُ لِلّٰہِ رَبِّ الْعَالَمِیْنَ وَ الصَّلٰوۃُ وَ السَّلَامُ عَلٰی سَیِّدِ الْاَنْبِیَآءِ وَ الْمُرْسَلِیْنَ وَ اٰلِہِ الطَّیِّبِیْنَ الطَّاهِرِیْنَ الْمَعْصُوْمِیْنَ. ¼,,0
26,1,,4,,اللہ سبحانہ و تعالیٰ نے انسان کو خلق کیا اور اس کی ہدایت کیلئے جہاں معصوم راہنما معین کئے وہاں اپنی طرف سے لا ریب کتابیں بھی نازل فرمائیں۔ چنانچہ وہ الٰہی نمائندے قول و عمل سے اپنا فریضہ انجام دیتے رہے اور اللہ کی کتاب کی تشریح فرماتے رہے۔ اللہ سبحانہ نے جہاں ان ہادیانِ حق کی عظمت مختلف طریقوں سے بیان فرمائی وہاں قلم و کتاب کی قسمیں کھا کر تحریر کی اہمیت سے بھی مطلع فرمایا۔ اللہ کے ان نمائندوں کی گفتگو ”حدیث“ کے نام سے محفوظ ہوتی رہی اور ہدایت کا سر چشمہ قرار پاتی رہی۔,,0
27,1,,1,,یہ سلسلہ یونہی چلتا رہا یہاں تک کہ حضرت محمد مصطفیٰ ﷺ پر نبوت ختم ہوئی اور آپؐ پر نازل ہونے والی کتاب پہلی تمام کتابوں کی ناسخ بن کر قیامت تک کی راہنمائی کی ضامن بنی۔ آپؐ نے اپنی زندگی کے آخری ایام میں جب دین کی تکمیل کا اعلان کیا تبھی اپنے بعد کے قیامت تک کے ہادیوں کو قرآن کریم کا ہم پلہ قرار دیا اور مشہور و متواتر حدیث ثقلین کے ذریعے اُمت کو ان کی عظمت سے آگاہ کیا اور ان سے تمسک اور وابستگی کو نجات و سعادت کا ضامن قرار دیا۔ چنانچہ آپ ﷺ فرمایا:,,0
28,1,,3,,½اِنِّیْ تَارِكٌ فِيْكُمُ الثَّقَلَيْنِ مَاۤ اِنْ تَمَسَّكْتُمْ بِهِمَا لَنْ تَضِلُّوْا: كِتَابَ اللهِ وَ عِتْرَتِیْ اَهْلَ بَيْتِیْ، وَ اِنَّهُمَا لَنْ يَّفْتَرِقَا حَتّٰى يَرِدَا عَلَىَّ الْحَوْضِ.¼,,0
29,1,,4,,تحقیق! میں تمہارے درمیان دو گرانقدر چیزیں چھوڑے جا رہا ہوں، جب تک تم ان سے متمسک رہے ہر گز گمراہ نہ ہو گے، وہ اللہ کی کتاب اور میری عترت، میرے اہل بیت(ع) ہیں اور یہ ہر گز ایک دوسرے سے جدا نہ ہوں گے، یہاں تک کہ میرے پاس حوض(کوثر)تک جائیں گے۔{ FR 4008},,0
30,1,,1,,اسی کے ساتھ آپ ﷺ نے بے شمار مقامات اور مناسبات پر اپنے ارشادات جلیلہ کے ذریعے اپنے ابن عم حضرت امیر المومنین علی(ع)کی قدسی شخصیت اور ان کی عظیم علمی منزلت کو بیان فرمایا۔ جیسا کہ آپ ﷺ کا ارشاد گرامی ہے:,,0
31,1,,3,,½اَنَا مَدِينَةُ الْعِلْمِ وَعَلِیٌّ بَابُهَا، فَمَنْ اَرَادَ الْعِلْمَ فَلْيَاْتِهٖ مِنْ بَابِهٖ.¼,,0
32,1,,4,,میں علم کا شہر اور علیؑ اس کا دراوزہ ہیں۔ پس جو علم کا ارادہ رکھتا ہے اسے اس دروازہ سے آنا ہو گا۔{ FR 4009 },,0
33,1,,1,,اور اپنے بعد علی (ع) کے قرآن مجید کے حقیقی ترجمان و مفسر ہونے پر اپنےاس فرمانِ ذیشان کے ذریعے مہر تصدیق ثبت فرمائی کہ:,,0
34,1,,3,,½عَلِیٌّ مَّعَ الْقُرْاٰنِ وَ الْقُرْاٰنُ مَعَ عَلِیٍّ، لَا يَفْتَرِقَانِ حَتّٰى يَرِدَا عَلَیَّ الْحَوْضَ. ¼,,0
35,1,,4,,علیؑ قرآن کے ساتھ ہے اور قرآن علیؑ کے ساتھ ہے۔ یہ جدا نہ ہوں گے،یہاں تک کہ میرے پاس حوض پر آ پہنچیں گے۔ {FR 4010},,0
36,1,,1,,پیغمبر اکرم ﷺ کے بعد اللہ کی کتاب کی تفسیر اور رسول اللہ ﷺ کی سیرت کی تشریح امیرالمومنین (ع) نے بیان کی۔ امام (ع) کبھی خطبوں اور کلام کی صورت میں ارشاد فرماتے رہے اور چاہنے والے اسے ہدایت کا خزانہ سمجھ کر جمع کرتے رہے، اور کبھی کتابت کی اہمیت کو مدنظر رکھتے ہوئے خود لکھواتے رہے اور یوں ہدایت کی راہ کو روشنی بخشتے رہے۔ اسی کے ساتھ خود آپؑ نے اپنے فرمان کے ذریعے ان ہدایت کے لازوال چشموں سے جناب حسنین شریفین (ع)، اپنے اہل و اصحاب اور محبان و موالیان کے ساتھ تمام عالم انسانیت کو فیضیاب ہونے کی تاکید فرمائی۔ چنانچہ ارشاد فرمایا:,,0
37,1,,3,,½اُوْصِیْكُمَا وَ جَمِیْعَ وَلَدِیْ وَ اَهْلِیْ وَ مَنْ بَلَغَهٗ كِتَابِیْ... ¼,,0
38,1,,4,,میں تم دونوں، اپنی تمام اولاد، اپنے کنبہ کو اور جن تک میری یہ تحریر پہنچے، سب کو وصیت کرتا ہوں۔{ FR 4011 },,0
39,1,,1,,ابتدا میں امام (ع) کے کلام کو اصبغ بن نباتہ جیسے آپؑ کے جلیل القدر اصحاب تحریرکرتے رہے اور ایک بہت بڑا سرمایہ اکٹھا ہو گیا۔ زمانہ کے گزرنے کے ساتھ ساتھ یہ سرمایہ بکھرتا رہا اور چوتھی صدی کے اواخر میں علامہ سیّد رضی کی کتاب ”خصائص الائمہ“ میں امام کے چند فرامین کو پڑھ کر لوگوں نے سیّد رضیؒ سے امیرالمومنین (ع) کے فرامین کو الگ سے جمع کرنے کی خواہش کی تو سیّد نے ان کی درخوست کو قبول کرتے ہوئے ان فرامین کی جمع آوری کا آغاز کیا اور ۴۰۰ ہجری میں اس سے فارغ ہوئے اور اس مجموعہ کا نام ”نہج البلاغہ“ رکھا۔,,0
40,1,,1,,نہج البلاغہ کو جو شہرت ملی وہ بعد از کتابِ خدا شاید ہی کسی کتاب کو ملی ہو۔اب اس بے پناہ شہرت کا سبب امام کا علم ہے، یا آپؑ کے کلام کی جامعیت، یا سیّد رضیؒ کا خلوص؟ تو یقیناً اگر کہا جائے کہ سب وجوہ شامل ہیں تو زیادہ مناسب ہو گا۔,,0
41,1,,1,,سیّد رضیؒ نے اس کلام کے بارے کیا خوب جملہ فرمایا:,,0
42,1,,3,,½لِاَنَّ كَلَامَهٗ ؑ الْكَلَامُ الَّذِیْ عَلَیْهِ مَسْحَةٌ مِّنَ الْعِلْمِ الْاِلٰهِیْ، وَ فِیْهِ عَبْقَةٌ مِّنَ الْكَلَامِ النَّبَوِیِّ. ¼,,0
43,1,,4,,اس لئے کہ آپؑ کا کلام وہ ہے جس میں علم الٰہی کی جھلک اور کلام نبویؐ کی خوشبو ہے۔{ FR 4012 },,0
44,1,,1,,نہج البلاغہ کے تعارف، اس کی جامعیت اور اس کی تالیف و جمع آوری کے بارے میں سینکڑوں کتابیں لکھی گئیں اور اس ترجمہ میں سیّد العلماء علامہ علی نقی نقن اعلی اللہ مقامہ کا علمی مقدمہ ایک شاہکار کی حیثیت رکھتا ہے۔,,0
45,1,,1,,اہل سنت کے مشہور عالم اور بیس جلدوں پر مشتمل شرح نہج البلاغہ کے مصنف جناب ابن ابی الحدید متوفی ۶۵۵ ہجری، نہج البلاغہ کے بارے میں لکھتے ہیں:,,0
46,1,,3,,½اِنَّ كَثِيْرًا مِّنْ فُصُوْلِهٖ دَاخِلٌ فِیْ بَابِ الْمُعْجِزَاتِ الْمُحَمَّدِيَّةِ لِاشْتِمَالِهَا عَلَى‏الْاَخْبَارِ الْغَيْبِيَّةِ وَ خُرُوْجِهَا عَنْ وُّسْعِ الطَّبِيْعَةِ الْبَشَرِيَّةِ. ¼,,0
47,1,,4,,اس کتاب کے اکثر حصے معجزاتِ محمدیہؐ میں داخل ہیں، کیونکہ ان میں وہ غیبی خبریں شامل ہیں جو عام فرد بشر کی طاقت سے باہر ہیں۔{ FR 4013 },,0
48,1,,1,,نہج البلاغہ کو قرآن مجید کی تفسیر کے طور پر پیش کرتے ہوئے علامہ ابن ابی الحدید خطبہ ۲۱۸ کی شرح میں لکھتے ہیں:,,0
49,1,,3,,½وَ اُقْسِمُ بِمَنْ تُقْسِمُ الْاُمَمُ كُلُّهَا بِهٖ! لَقَدْ قَرَاْتُ هٰذِهِ الْخُطْبَةَ مُنْذُ خَمْسِيْنَ سَنَةً وَّ اِلَى الْاٰنَ اَكْثَرَ مِنْ اَلْفِ مَرَّةً، مَا قَرَاْتُهَا قَطُّ اِلَّا وَ اَحْدَثَتْ عِنْدِیْ رَوْعَةً وَّ خَوْفًا وَّ عِظَةً، وَ اَثَرَتْ فِیْ قَلْبِیْ وَجِيْبًا وَّ فِیْۤ اَعْضَآئِیْ رَعْدَةً، وَ لَا تَاَمَّلْتُهَا اِلَّا وَ ذَكَرْتُ الْمَوْتٰى مِنْ اَهْلِیْ وَ اَقَارِبِیْ وَ اَرْبَابِ وُدِّیْ، وَ خَيَّلْتُ فِیْ نَفْسِیْ اَنِّیْۤ اَنَا ذٰلِكَ الشَّخْصُ الَّذِیْ وَصَفَ ؑ حَالَهٗ.¼,,0
50,1,,4,,میں اس خدا کی قسم اٹھا کر کہ جس کی ذات کی تمام امتیں قسم کھاتی ہیں! اس حقیقت کا اعتراف کرتا ہوں کہ میں گزشتہ پچاس سال سے اس خطبہ کو ہزار مرتبہ سے زیادہ پڑھ چکا ہوں۔ یہ حقیقت ہے کہ میں نے جب بھی اسے پڑھا اس نے مجھ میں خوفِ خدا، قیامت کی یاد اور وعظ و نصیحت کی حالت کو زندہ کیا، اس کے ہر بار مطالعے سےمیرے دل کی دھڑکنیں تیز ہو گئیں اور اعضائے بدن پر لرزہ طاری ہو گیا۔ میں نے جب بھی اسے پڑھا میرے رشتہ داروں، عزیزوں اور پیاروں کی موت میرے سامنے مجسم ہو گئی اور ہر بار مجھے یہی احساس ہوا کہ جیسے میں ہی وہ شخص ہوں جس کی حالت کو امیر المومنین(ع)نے اس خطبہ میں بیان کیا ہے۔{ FR 4014 },,0
51,1,,1,,نہج البلاغہ میں توحید کے بیان کے بارے میں ابن ابی الحدید رقمطراز ہیں:,,0
52,1,,3,,½وَ اعْلَمْ اَنَّ التَّوْحِيْدَ وَ الْعَدْلَ وَ الْمَبَاحِثَ الشَّرِيْفَةَ الْاِلٰهيَّةَ مَا عُرِفَتْ اِلَّا مِنْ كَلَامِ هٰذَا الرَّجُلِ، وَ اَنَّ كَلَامَ غَيْرِهٖ مِنْ اَكَابِرِ الصَّحَابَةِ لَمْ يَتَضَمَّنْ شَيْئًا مِّنْ ذٰلِكَ اَصْلًا وَّ لَا كَانُوْا يَتَصَوَّرُوْنَهٗ، وَ لَوْ تَصَوَّرُوْهُ لَذَكَرُوْهُ، وَ هٰذِهِ الْفَضِيْلَةُ عِنْدِیْ اَعْظَمُ فَضَآئِلِهٖ ؑ.‏¼,,0
53,1,,4,,جان لیجئے! توحید و عدل اور دوسری عظیم الٰہی ابحاث کی معرفت اس ہستی کے علاوہ کسی سے حاصل نہیں ہوئی۔ کسی اور بزرگ صحابی کا کلام ان مطالب کو حاوی نہیں، بلکہ یہ مطالب ان کی فکر میں بھی نہیں تھے۔ اگر وہ ان موضوعات کا تصور رکھتے ہوتے تو اسے بیان کرتے اور علی(ع)کی یہ فضیلت میرے نزدیک سب سے بڑی فضیلت ہے۔{ FR 4015 },,0
54,1,,1,,مصر کےمشہور مفتی جناب علامہ شیخ محمد عبدہ متوفی ۱۳۲۳ ہجری اپنی شرح نہج البلاغہ کے مقدمہ میں تحریر فرماتے ہیں:,,0
55,1,,3,,½وَ اَحْيَانًا كُنْتُ اَشْهَدُ اَنَّ عَقْلًا نُوْرَانِيًّا لَّا يَشْبَهُ خَلْقًا جَسَدَانِيًّا، فَصَلَ عَنِ الْمَوْكِبِ الْاِلٰهِیِّ وَ اتَّصَلَ بِالرُّوْحِ الْاِنْسَانِیِّ، فَخَلَعَهٗ عَنْ غَاشِيَاتِ الطَّبِيْعَةِ، وَ سَمَا بِهٖ اِلَی الْمَلَكُوْتِ الْاَعْلٰی، وَ نَمَا بِهٖ اِلٰی مَشْهَدِ النُّوْرِ الْاَجْلٰی، وَ سَكَنَ بِهٖ اِلٰی عَمَارِ جَانِبِ التَّقْدِيْسِ، بَعْدَ اسْتِخَلَاصِهٖ مِنْ شَوَآئِبِ التَّلْبِيْسِ. ¼,,0
56,1,,4,,(کتاب نہج البلاغہ کے مطالعے کے دوران (بعض اوقات میں ایسے مشاہدہ کرتا تھا کہ ایک نورانی عقل جو جسمانی مخلوق سے کسی حیثیت سے بھی مشابہ نہیں ہے، بارگاہِ خداوندی سے الگ ہوئی اور انسانی روح سے متصل ہوکر اسے طبیعت کے پردوں اورمادیت کے حجابوں سے نکال کر اسے عالم ملکوت تک پہنچادیا اورتجلیات ربانی کے مرکز تک بلند کردیا اور لے جاکر عالم قدسی کا ساکن بنا دیا۔{ FR 4016 },,0
57,1,,1,,نہج البلاغہ کے بارے میں آیت اللہ خمینی(رہ) فرماتے ہیں:,,0
58,1,,4,,یہ ایک شفا بخش معجون اور فردی و اجتماعی دردوں کی دوا ہے۔{ FR 4017 },,0
59,1,,1,,آیت اللہ خامنہ ای فرماتے ہیں:,,0
60,1,,4,,نہج البلاغہ حقیقت میں علی بن ابی طالب(ع)کے تعارف اور پہچان کی کتاب ہے۔ نہج البلاغہ ایک مجسم انسانِ کامل ہے۔ نہج البلاغہ، اسلام کی بے نظیر میراث ہے جسے زندہ رکھنا فقط شیعہ نہیں، بلکہ تمام مسلمانوں کا اولین فریضہ ہے۔{ FR 4018 },,0
61,1,,1,,نہج البلاغہ سے علی(ع)کی صدائیں سنائی دیتی ہیں۔ گویا آپؑ آج صدا دے رہے ہیں:,,0
62,1,,3,,½﴿فَاَیْنَ تَذْهَبُوْنَ﴾! وَ ﴿اَنّٰی تُؤْفَكُوْنَ﴾! وَ الْاَعْلَامُ قَآئِمَةٌ، وَ الْاٰیَاتُ وَاضِحَةٌ، وَ الْمَنَارُ مَنْصُوْبَةٌ. ¼,,0
63,1,,4,,تم کہاں جا رہے ہو اور تمہیں کدھر موڑا جا رہا ہے؟ حالانکہ ہدایت کے پرچم بلند ہیں، نشانیاں ظاہر و روشن ہیں اور حق کے مینار نصب ہیں۔{ FR 4019 },,0
64,1,,1,,نہج البلاغہ میں حضرت امیر المومنین علی(ع)ہماری نجات کا حقیقی نسخہ بیان کرتے ہوں ارشاد فرماتے ہیں:,,0
65,1,,3,,½فَاتَّقُوا اللهَ عِبَادَ اللهِ، وَ فِرُّوْا اِلَى اللهِ مِنَ اللهِ وَ امْضُوْا فِیْ الَّذِیْ نَهَجَهٗ لَكُمْ، وَ قُوْمُوْا بِمَا عَصَبَهٗ بِكُمْ، فَعَلِیٌّ ضَامِنٌ لِّفَلْجِكُمْ اٰجِلًا، اِنْ لَمْ تُمْنَحُوْهُ عَاجِلًا. ¼,,0
66,1,,4,,اللہ کے بندو! اللہ سے ڈرو اور اس کے غضب سے بھاگ کر اُس کے دامنِ رحمت میں پناہ لو، اللہ کی دکھائی ہوئی راہ پر چلو اور اس کے عائد کردہ احکام بجا لاؤ۔ اگر یہ روش اپناؤ تو علیؑ تمہاری نجات اُخروی کا ضامن ہے، اگرچہ اس دنیا میں کامیابی و کامرانی تمہیں نصیب نہ ہو۔{ FR 4020 },,0
67,1,,1,,نہج البلاغہ سے ایسے اقتباسات نقل کئے جائیں تو یہ خود ایک ضخیم کتاب بنتی ہے اور ان اقتباسات پر مشتمل کئی کتابیں لکھی جا چکی ہیں، اس لئے ہم اسے قارئین کے مطالعہ پر چھوڑتے ہیں۔,,0
68,1,,1,,المختصر یہ کہ نہج البلاغہ اللہ کے ولی کا، اللہ کے بندوں کو، اللہ کی طرف بلانے کا دعوت نامہ ہے۔ نیز یہ اللہ کے بندوں کو اللہ کا تعارف کرانے کا جامع و کامل ذریعہ اور اللہ کی کتاب کی بہترین تفسیر ہے۔,,0
69,1,,1,,علامہ مفتی جعفر حسین(رہ)نے اردو دان طبقہ پر احسان کیا کہ نہج البلاغہ کا اردو میں ترجمہ کیا اور نہج البلاغہ کےعربی ادب کے معیار کو سامنے رکھتے ہوئے اردو ادب کی تمام باریکیاں ترجمہ میں ملحوظ خاطر رکھیں۔ مفتی صاحب نے ۱۸ رجب ۱۳۷۵ ہجری کو یہ ترجمہ مکمل کیا۔ اگرچہ اس سے پہلے اور بعد میں نہج البلاغہ کے اردو میں کئی ترجمے ہوئے مگر علم دوست حلقوں میں جو مقبولیت اسے ملی وہ کسی اور ترجمہ کو نہیں ملی۔ اس وقت جب اردو اور فارسی میں درجنوں ترجمے موجود ہیں ان کو سامنے رکھتے ہوئے مفتی صاحب کے ترجمہ کو دقت سے دیکھا جائے تو مفتی صاحب کے کمال علمی کا اندازہ ہوتا ہے۔,,0
70,1,,1,,علامہ مفتی جعفر حسین اعلی اللہ مقامہ کی زندگی میں پہلی بار نہج البلاغہ تین جلدوں میں ”ادارۂ علمیہ پاکستان لاہور“کی طرف سے شائع ہوا۔ مفتی صاحب کی زندگی میں ہی دوسری بار چند نئے حواشی اور کچھ تصحیح کے ساتھ ”اضافہ شدہ ایڈیشن“ امامیہ کتب خانہ لاہور کی طرف سے شائع ہوا۔,,0
71,1,,1,,دوسرے ایڈیشن میں جو اضافات شامل کئے گئے ان کی چند مثالیں پیش خدمت ہیں:,,0
72,1,,1,,مثلا خطبہ ۱۵۳ میں ادارۂ علمیہ والے ایڈیشن میں حاشیہ نہیں ہے اور امامیہ کتب خانہ والے میں چمگادڑ سے متعلق حاشیہ کا اضافہ کیا گیا ہے۔,,0
73,1,,1,,یا خطبہ ۱۶۳ میں پہلے ایڈیشن میں حاشیہ نہیں ہے اور دوسرے ایڈیشن میں حاشیہ موجود ہے۔,,0
74,1,,1,,یا خطبہ ۱۹ میں علامہ سیّد رضیؒ کی تشریح کی عربی عبارت نہیں ہے، جبکہ دوسرے ایڈیشن میں درج ہے۔,,0
75,1,,1,,عربی اور اردو عبارات میں بھی کئی مقامات پر دوسرے ایڈیشن میں تصحیح کی گئی ہے۔,,0
76,1,,1,,پہلے ایڈیشن کی تیسری جلد کے آخر میں اٹھاون (۵۸) اغلاط کی نشاندہی کی گئی جن کی دوسرے ایڈیشن میں تصحیح کر دی گئی۔,,0
77,1,,1,,البتہ دوسرے ایڈیشن میں تصحیح کے بعد جو اغلاط رہ گئیں وہ پھر مسلسل اسی انداز سے چھپتی رہیں۔ ایک کوشش امامیہ پبلیکیشنز لاہور والوں نے کی جو قابل قدر ہے مگر اس میں بھی درجنوں غلطیاں موجود ہیں اور پیراگراف بھی نہیں بنائے گئے۔,,0
78,1,,5,,موجودہ ایڈیشن کی انفرادیت,,0
79,1,,1,,الحمدللہ نہج البلاغہ کی مقبولیت روز بروز بڑ ھ رہی ہے اور متعدد ادارے اچھے سے اچھے انداز میں نہج البلاغہ کو طبع کرانے میں مشغول ہیں اور درجنوں قسم کے ایڈیشن بازار میں موجود ہیں۔ مرکزِ افکار اسلامی بھی ایک مدت سے کلام امیر المومنینؑ کو محبان امیر المومنینؑ تک پہنچانے کیلئے کوشاں ہے اور اس کیلئے متعدد قدم اٹھائے جن کے یہاں بیان کی ضرورت نہیں۔ طباعت کے حوالے سے ہمیشہ جن عمومی یا خصوصی کمزوریوں کا سامنا ہوتا تھا ان کو مدنظر رکھتے ہوئے مرکز افکار اسلامی نے مکمل طور پر نئے سرے سے نہج البلاغہ کے زیر نظر ایڈیشن کو شائع کرانے کا ارادہ کیا۔ اس اشاعت میں جن امور کو مدنظر رکھا گیا ان میں سے کچھ درج ذیل ہیں:,,0
80,1,,1,,[1] سب سے پہلے عربی متن کی تصحیح کیلئے کام شروع کیا گیا تو اس نسخے کی تلاش شروع ہوئی جس سے مفتی صاحب نے استفادہ کیا تھا۔ چونکہ عربی میں کئی نسخے ہیں اور مفتی صاحب نے کہیں تحریر نہیں فرمایا کہ ان کے سامنے کونسا نسخہ تھا، تاکہ اس کے مطابق عربی کو دیکھاجائے۔ چنانچہ چند ماہ کی مسلسل کوشش اور ایران و عراق اور دیگر اسلامی ممالک میں دستیاب نہج البلاغہ کے درجن بھر نسخوں سے مفتی صاحب والے نسخہ کی تطبیق کے بعد واضح ہوا کہ مفتی صاحب نے عربی کتابت کیلئے شیخ محمد عبدہ مصری کا ”مطبعۃ الاستقامة مصر“ والا تین جلدی نسخہ استعمال کیا۔,,0
81,1,,1,,چنانچہ اس نسخہ کو سامنے رکھتے ہوئے عربی عبارات کو مفتی صاحب کے نسخہ سے تطبیق دی اور اگر کہیں مفتی صاحب کا نسخہ شیخ محمد عبدہ والے نسخہ سے الگ تھا تو درج ذیل نسخوں کو دیکھا گیا جس میں اس بات کو ملحوظ رکھا گیا کہ اگر کوئی ایک نسخہ مفتی صاحب والے نسخہ سے مطابقت رکھتا ہے تو مفتی صاحب والی عربی عبارت کو باقی رکھا گیا اور اگر مفتی صاحب والا نسخہ کسی سے مطابقت نہیں رکھتا تو مفتی صاحب کے ترجمہ کو دیکھا گیا کہ جس عربی عبارت سے مفتی صاحب کا ترجمہ ملتا ہے اس عربی عبارت کو درج کیا گیا اوراگر ترجمہ میں کوئی فرق واضح نہیں ہوتا تھا تو جو عبارت اکثر نسخوں میں تھی اس کے مطابق عبارت کو رکھا گیا۔ اس مرحلہ پر جن نسخوں کو مدنظر رکھا گیا ان میں:,,0
82,1,,1,,شیخ محمد عبدہ کا مصری نسخہ,,0
83,1,,1,,حرم امیر المؤمنینؑ سے طبع شدہ الشیخ قیس بہجت العطار کا تحقیق شدہ نسخہ,,0
84,1,,1,,حرم امیر المؤمنینؑ ہی سے طبع شدہ السید ہاشم میلانی کا تحقیق شدہ نسخہ,,0
85,1,,1,,بنیاد نہج البلاغہ کا نسخہ,,0
86,1,,1,,صبحی صالح کا نسخہ,,0
87,1,,1,,منہاج البراعہ شرح نہج البلاغہ کا نسخہ,,0
88,1,,1,,ابن میثم بحرانی کی شرح والا نسخہ,,0
89,1,,1,,مصادر نہج البلاغہ، سیّد عبدالزہرا والا نسخہ,,0
90,1,,1,,شیخ محمد عبدہ کا موسسۃ التاریخ العربی، بیروت لبنان والا نسخہ,,0
91,1,,1,,آقائے دشتی کا نسخہ,,0
92,1,,1,,پیام امام آقای مکارم والا نسخہ,,0
93,1,,1,,اور چند موارد میں آقای مرعشی نجفی کے مکتبہ سے شائع ہونے والے پانچویں صدی کے مخطوطہ سے استفادہ کیا گیا۔,,0
94,1,,1,,[2] اردو نہج البلاغہ کے پہلے شائع ہونے والے نسخوں میں عربی عبارت اور اردو ترجمہ ایک دوسرے کے مقابل نہیں تھا، بلکہ طولانی خطبات میں ایسا بھی تھا کہ عربی ایک صفحہ پر ہے تو اردو اس سے اگلے صفحہ پر۔ جبکہ اس نسخہ میں عربی کے سامنے اس کا اردو ترجمہ لایا گیا۔,,0
95,1,,1,,[3] عربی اور اردو عبارتوں میں پیراگراف کا کوئی خیال نہیں رکھا گیا تھا۔ بعض عبارتیں مسلسل تین صفحات پر جاری تھیں۔ اس نسخہ میں انہیں بڑی محنت سے چھوٹے پیرا گرافوں میں تقسیم کیا گیا جس کیلئے متعدد فارسی تراجم اور عربی میں چھپنے والے نسخوں کو مدنظر رکھا گیا۔,,0
96,1,,1,,[4] عربی رسم الخط کیلئے اردو دان طبقہ کے ہاں رائج قرآنی رسم الخط کو استعمال کیا گیا۔,,0
97,1,,1,,[5] اردو عبارت کیلئے بہترین فونٹ کو استعمال کیا گیا۔,,0
