ID,Type,ParaNo,ParaFormat,mqar,mqur,status,TypeNo
407,4,,4,,اس میں کوئی کلام نہیں ہوسکتا کہ سیدنا حضرت علی امیر المومنین(ع)فصیحوں کے امام اور بلیغوں کے استاد اور عربی زبان میں خطابت اور کتابت کرنے والوں میں سب سے زیادہ عظیم المرتبت ہیں اور یہ وہ کلام ہے جس کے بارے میں بالکل صحیح کہا گیا ہے کہ: یہ کلام خلق سے بالا اور خالقِ کلام سے نیچے ہے۔ یہ ہر اس شخص کا قول ہوگا، جس نے انشاء پردازی کے فنون سے واقفیت حاصل کی ہو اور تحریر کا مشغلہ رکھا ہو،بلکہ آپؑ بلاشبہ تمام عرب انشاء پردازوں کے استاد اور معلم ہیں۔ کوئی ادیب ایسا نہیں ہے جو تحریر کے فن میں کمال حاصل کرنا چاہے، مگر یہ کہ اس کے سامنے قرآن ہوگا اور نہج البلاغہ کہ ایک خالق کا کلام ہے اور دوسرا اشر ف المخلوقین کا اور انہی پر اعتماد کرے گا ہر وہ شخص جو چاہے گا کہ اچھے لکھنے والوں میں اس کا شمار ہو۔غالباً زبان عربی کی خدمت کرنے والوں میں سب سے بڑا درجہ شریف رضیؒ کا ہے جنہوں نے امیرالمومنینؑ کے یہ خطبے اور اقوال اور حکیمانہ ارشادات اور خطوط لوگوں کے محفوظات اور مخطوطات سے یکجا کئے ہیں اور انہوں نے اس کا نام ”نہج البلاغہ“ بھی بہت ٹھیک رکھا۔ بلاشبہ یہ بلاغت کا صراط مستقیم ہے ہر اس شخص کیلئے جو اس منزل تک پہنچنا چاہے۔{ FR 4060 },,0
408,4,,1,,اس کے بعد انہوں نے شیخ محمد عبدہ کی رائے بیان کی ہے اور اس کے بعد لکھا ہے کہ:,,0
409,4,,4,,ایک مرتبہ شیخ ابراہیم یازجی نے جو اس آخری دور میں متفقہ طور پر عربی کے کامل انشاء پرداز اور امام اساتذۂ لغت مانے گئے ہیں، مجھ سے فرمایا کہ: مجھے اس فن میں جو مہارت حاصل ہوئی ہے، وہ صرف قرآن مجید اور نہج البلاغہ کے مطالعہ سے۔ یہ دونوں عربی زبان کے وہ خزانۂ عامرہ ہیں جو کبھی ختم نہیں ہو سکتے۔,,0
410,4,,1,,۲) فواد افرام البستانی، استاذ الآداب العربیہ فی کلیۃ القدیس یوسف (بیروت)۔ انہوں نے ایک سلسلہ تعلیمی کتابوں کا روائع کے نام سے شروع کیا ہے، جس میں مختلف جلیل المرتبہ مصنفین کے آثار قلمی اور تصانیف سے مختصر انتخابات، مصنف کے حالات، کمالات، کتاب کی تاریخی تحقیقات وغیرہ کے ساتھ چھوٹے چھوٹے مجموعوں کی صورت میں ترتیب دیئے ہیں اور وہ کیتھولک عیسائی پریس (بیروت)میں شائع ہوئے ہیں۔ اس سلسلہ کا پہلا مجموعہ امیرالمومنینؑ اورنہج البلاغہ سے متعلق ہے جس کے بارے میں موٴلف نے اپنے مقدمہ میں تحریر کیا ہے:,,0
411,4,,3,,½اِنَّنَا نَبْدَاُ الُیَوْمَ بِنَشْرِ مُنَتَخَبَاتٍ مِّنْ نَھْجِ الْبَلَاغَۃِ لِلْاِمَامِ عَلِیِّ ابْنِ اَبِیْ طَالِبٍ اَوَّلِ مُفَکِّرِی الْاِسْلَامِ.¼,,0
412,4,,4,,ہم سب سے پہلے اس سلسلہ کی ابتدا کرتے ہیں کچھ انتخابات کے ساتھ نہج البلاغہ کے جو اسلام کے سب سے پہلے مفکر امام علیؑ ابن ابی طالبؑ کی کتاب ہے۔,,0
413,4,,1,,اس کے بعد وہ سلسلہ شروع ہوا ہے جوسلسلہٴ روائع کی پہلی قسط ہے۔ اس کا پہلا عنوان ہے:“علی ابن ابی طالبؑ ” جس کے مختلف عناوین کے تحت میں امیر المومنینؑ کی سیرت اور حضرتؑ کی خصوصیات زندگی پر روشنی ڈالی گئی ہے جو ایک عیسائی کی تحریر ہوتے ہوئے پورے طور سے شیعی نقطۂ نظر کے موافق نہ سہی لیکن پھر بھی حقیقت و انصاف کے بہت سے جوہر اپنے دامن میں رکھتی ہے۔ دوسرا عنوان ہے: “نہج البلاغہ“ اورا س کے ذیلی عناوین میں ایک عنوان ہے “جَمْعُہٗ” اور دوسرا عنوان ہے “صِحَّۃُ نِسْبَتِہٖ”، اس کے تحت میں لکھا ہے “نہج البلاغہ” کے جمع و تالیف کو بہت زمانہ نہیں گزرا تھا کہ بعض اہل نظر اور مؤرّخین نے اس کی صحت میں شک کرنا شروع کیا،ان کا پیشرو ابن خلکان ہے، جس نے اس کتاب کو اس کے جامع کی طرف منسوب کیا ہے اور پھر صفدی وغیرہ نے اس کی پیروی کی اور پھر شریف رضیؒ کے بسا اوقات اپنے دادا مرتضیٰؒ کے لقب سے یا د کئے جانے کی وجہ سے بعض لوگوں کو دھوکہ ہوگیااور وہ ان میں اور ان کے بھائی علی بن طاہر معروف بہ ”سیّد مرتضیٰ“ متولد ۹۶۶ء متوفیٰ ۱۰۴۴ء میں فرق کو نہ سمجھ سکے اور انہوں نے نہج البلاغہ کے جمع کو ثانی الذکر کی طرف منسوب کردیا جیسا کہ جرجی زیدان نے کیا ہے اور بعض لوگوں نے جیسے مستشرق کلیمان نے یہ طرہ کیا کہ اصل مصنف کتاب کا سیّد مرتضیٰ ہی کو قرار دے دیا۔ ہم جب اس شک کے وجوہ و اسباب پر غور کرتے ہیں تووہ ہر پھر کے پانچ امر ہوتے ہیں۔,,0
414,4,,1,,اس کے بعدانہوں نے شک کے وہی اسباب تقریباً تحریر کئے ہیں جو اس کے پہلے محی الدین عبد الحمید شارح نہج البلاغہ کے بیان میں گزر چکے ہیں اور پھر انہوں نے ان وجوہ کو ردکیا ہے۔,,0
415,4,,1,,۳)بیروت کے شہرہٴ آفاق مسیحی ادیب اورشاعر پولس سلامہ اپنی کتاب “اول ملحمۃ عربیۃ عید الغدیر” میں جو مطبعۃ النسر بیروت میں شائع ہوئی ہے، صفحہ ۷۱، ۷۲پر لکھتے ہیں:,,0
416,4,,4,,نہج البلاغہ” مشہور ترین کتا ب ہے ، جس سے امام علی(ع)کی معرفت حاصل ہوتی ہے اور اس کتاب سے بالاتر سوا قرآن کے اور کسی کتاب کی بلاغت نظر نہیں آتی۔,,0
417,4,,1,,اس کے بعد حسب ذیل اشعار نہج البلاغہ کی مدح میں درج کئے ہیں:,,0
418,4,,6,,هٰذِهِ الْکَفُّ لِلْمَعَارِفِ بَابٌ مُشْرِعٌ مِّنْ مَّدِيْنَةِ الْاَسْرَارِ,,0
419,4,,6,,تَنْثُرُ الدُّرُّ فِیْ كِتَابٍ مُّبِيْنٍ سِفْرِ نَهْجِ الْبَلَاغَةِ الْمُخْتَارِ,,0
420,4,,6,,هَوَ رَوْضٌ مِّنْ كُلِّ زَهْرٍ جَنِیٍّ اَطْلَعَتْهُ السَّمَآءُ فِیْ نُوَّارِ,,0
421,4,,6,,فِيْهِ مِنْ نَّضْرَةِ الْوَرْدِ الْعَذَارٰى وَ الْخَزَامٰى وَ الْفُلِّ وَ الْجُلَّنَارِ,,0
422,4,,6,,فِیْ صَفَآءِ الْيَن ْبُوْعِ يَجْرِیْ زُلَالًا كَوْثَرًا رَآئِقًا بَعِيْدِ الْقَرَارِ,,0
423,4,,6,,تَلْمَحُ الشَطُّ وَ الضِفَافُ وَ لٰكِنْ يَا لِعَجْزِ الْعُيُوْنِ فِی الْاَغْوَارِ,,0
424,4,,8,,یہ معارف و علوم کا مرکز اوراسرار و رموز کاکھلا ہوا دروازہ ہے۔,,0
425,4,,8,,یہ نہج البلاغہ کیا ہے ، ایک روشن کتاب میں بکھرے ہوئے موتی۔,,0
426,4,,8,,یہ چنے ہوئے پھولوں کا ایک باغ ہے، جس میں پھولوں کی لطافت،,,0
427,4,,8,,چشموں کی صفائی اور آبِ کوثر کی شیرینی ۔,,0
428,4,,8,,جس نہر کی وسعت اور کنارے توآنکھوں سے نظر آتے ہیں,,0
429,4,,8,,مگر تہہ تک نظر یں پہنچنے سے قاصر ہیں۔,,0
430,4,,1,,مذکورہ بالاا دباء اور محدثین کے کلام سے ”نہج البلاغہ“ کی لفظی اور معنوی اہمیت بھی ضمناً ثابت ہو گئی ہے۔ اب اس کے متعلق مزید کچھ لکھنے کی ضرورت نہیں۔,,0
431,4,,1,,اب رہ گیا ہمارے فنی اصول سے اس کتاب کا وہ درجہ جس اعتبارسے ہم اس سے استدلال کر سکتے ہیں تو مجموعی طور پر ہمارے نزدیک اس کتاب کے مندرجات کی نسبت امیر المومنین(ع)کی جانب اسی حد تک ثابت ہے جیسے صحیفہ کاملہ کی نسبت امام زین العابدین(ع)کی جانب یاکتب اربعہ کی نسبت ان کے مصنفین کی طرف یامعلقات سبعہ کی نسبت ان کے نظم کرنے والوں کی جانب۔ رہ گیا خصوصی عبارات اورالفاظ میں سے ہر ایک کی نسبت اطمینان، وہ اسلوب کلام اور انداز بیان سے وابستہ ہے اور ان مندرجات کی مطابقت کے ا عتبار سے ہے، ان ماخذوں کے ساتھ جو صحیح طورپر ہمارے یہاں مسلّم الثبوت ہیں۔,,0
432,4,,1,,اصطلاحی حیثیت سے قدماء کی تعریف کے مطابق جو صحت خبر کیلئے وثوق بالصدور کو کافی سمجھتے ہیں ان شرائط کے بعد اس کا ہر جز صحیح کی تعریف میں داخل ہے اور متاخرین کی اصطلاح کے مطابق جوصحت کو باعتبار صفات راوی قراردیتے ہیں، نہج البلاغہ کے مندرجات کو مرسلات کی حیثیت حاصل ہے۔ مرسلات کی اہمیت ارسال کرنے والے کی شخصیت کے اعتبار سے ہوتی ہے۔ یہاں تک کہ ابن ابی عمیر اور بعض جلیل القدر اصحاب کے بارے میں علماء نے یہ رائے قائم کر لی ہے کہ ان تک جب خبر کی صحت ثابت ہوجائے تو پھر ان کے آگے دیکھنے کی ضرورت نہیں ہے کہ کون راوی ہے۔ اس لئے کہ ان کا نقل کرنا خود اس کے اعتبار کی دلیل ہے اور اسی لئے کہا گیا ہے کہ مرسلات ابن ابی عمیر حکم مسند میں ہیں۔ اس بناپرخود جناب سیّد رضی اعلی اللہ مقامہ کی جلالت قدر ضرور اسے عام مرسلات سے ممتاز کردیتی ہے۔ پھر بھی مواعظ وتواریخ وغیرہ کا ذکر نہیں جس میں عقیدہ و عمل ایسی اہمیت نہیں ہے، لیکن مقام اعتقاد و عمل میں ہم نہج البلاغہ کے مندرجات کو اور ادلہ کے ساتھ جو اس باب میں موجود ہوں، اصول تعادل و تراجیح کے معیار پرجانچیں گے اور بعض موقعوں پر ممکن ہے جو مسند حدیث اس موضوع میں موجود ہو اس پر نہج البلاغہ کی روایت کوترجیح ہوجائے اور بعض مقامات پر ممکن ہے تکافوٴ ہوجائے اوربعض جگہ شاید ان دوسرے ادلہ کو ترجیح ہوجائے، لیکن اس سے نہج البلاغہ کی مجموعی حیثیت پرکوئی اثر نہیں پڑتا۔ اس کاوزن اسی طرح برقرار رہتا ہے جس طرح کافی کی بعض حدیثوں کو کسی وجہ سے نظر انداز کرنے کے بعدبھی کافی کا وزن مسلم ہے۔,,0
433,4,,1,,بہر صورت نہج البلاغہ کی علمی و ادبی و مذہبی اہمیت اور اس کے حقائق آگیں مضامین اور اخلاقی مواعظ کا وزن ناقابل انکار ہے، مگر ظاہر ہے کہ نہج البلاغہ سے صحیح فائدہ وہی افراد اٹھا سکتے ہیں کہ جو عربی زبان میں مہارت رکھتے ہوں۔ غیر عربی داں اس خزینۂ عامرہ سے فیض حاصل کرنے سے قاصر ہیں۔ اسی لئے ایرانی فضلاء و علماء کو اس کی ضرورت محسوس ہوئی کہ وہ اس کے فارسی ترجمے شائع کریں۔ چنانچہ متعدد ترجمے ایران میں اس کے شائع ہوتے رہے اور اب تک یہ سلسلہ جاری ہے۔ اردو زبان میں ابھی تک نہج البلاغہ کا کوئی قابل اطمینان ترجمہ نہیں ہوا ہے۔ بعض ترجمے جو شائع ہوئے، ان میں سے کسی میں اغلاط بہت زیادہ تھے اور کسی میں عبارت آرائی نے ترجمہ کے حدود کو باقی نہیں رکھا، نیزحواشی میں کبھی خالص مناظرانہ انداز کی بہتات ہو گئی اور کبھی اختصار کی شدت نے ضروری مطالب نظر انداز کر دیئے۔,,0
434,4,,1,,جناب مولانا مفتی جعفر حسین صاحب جو ہندوستان و پاکستان میں کسی تعارف کے محتاج نہیں اور اپنے علمی کمالات کے ساتھ بلندی سیرت اور سادگی معاشرت میں جن کی ذات ہندوستان و پاکستان میں ایک مثالی حیثیت رکھتی ہے ان کی یہ کوشش نہایت قابل قدر ہے کہ انہوں نے اس کتاب کے مکمل ترجمہ اور شارحانہ حواشی کے تحریر کا بیڑا اٹھایا اور کافی محنت و عرق ریزی سے اس کام کی تکمیل فرمائی۔ بغیر کسی شک و شبہ کے یہ کہا جا سکتا ہے کہ اب تک ہماری زبان میں جتنے ترجمے اس کتاب کے اور حواشی شائع ہوئے ہیں، ان سب میں اس ترجمہ کا مرتبہ اپنی صحت، سلاست اور حسن اُسلوب میں یقیناً بلند ہے اور حواشی میں بھی ضروری مطالب کے بیان میں کمی نہیں کی گئی اور زوائد کے درج کرنے سے احتراز کیا گیا ہے۔,,0
435,4,,1,,بلا شبہ نہج البلاغہ کے ضروری مندرجات اور اہم نکات پر مطلع کرنے کیلئے اس تالیف نے ایک اہم ضرورت کو پورا کیا ہے جس پر مصنف ممدوح قابل مبارکباد ہیں۔ مجھے یقین ہے کہ صاحبانِ ذوق ہر طبقہ کے اس کتاب کا ویسا ہی خیر مقدم کریں گے جس کی وہ مستحق ہے۔,,0
436,4,,1,,½جَزَی ا للّٰہُ مُؤَلِّفَہٗ فِی الدَّارَیْنِ خَیْرًا!¼,,0
437,4,,1,,علی نقی النقوی,,0
438,4,,1,,)۴جمادی الثانی ۱۳۷۵ھ (,,0
440,5,,2,,جامع نہج البلاغہ,,0
441,5,,2,,علامہ شریف رضی علیہ الرحمہ کے مختصر سوانح حیات,,0
442,5,,1,,سیّد علیہ الرحمہ کی زندگی کا ہر پہلو ان کے آباؤ اجداد کے کردارکا آئینہ دار اور ان کی سیرت کا ہر رخ آئمہ اطہار(ع) کی پاکیزہ زندگیوں کا نمونہ تھا۔ وہ اپنے علمی تبحر، عملی کمال، پاکیزگی اخلاق اور حسن سیرت و استغناء نفس کی دل آویز اداؤں میں اتنی کشش رکھتے تھے کہ نگاہیں ان کی خوبی و زیبائی پر جم کر رہ جاتیں تھیں اور دل اس ورثہ دار عظمت ورفعت کے آگے جھکنے پر مجبور ہو جاتے تھے۔,,0
443,5,,1,,آپ کا نام ”محمد“، لقب ”رضی“ اور کنیت ”ابو الحسن“ تھی۔ ۳۵۹ھ میں سر زمین بغداد میں پیدا ہوئے اور ایک ایسے گھرانے میں آنکھ کھولی جو علم وہدایت کا مرکز اور عزت و شوکت کا محور تھا۔,,0
444,5,,1,,اُن کے والد بزرگوار ابو احمد حسین تھے، جو پانچ مرتبہ نقابت آل ابی طالبؑ کے منصب پر فائز ہوئے اور بنی عباس اور بنی بویہ کے دور حکومت میں یکساں عظمت و بزرگی کی نظروں سے دیکھے گئے۔ چنانچہ ابو نصر بہاء الدولہ ابن بویہ نے انہیں ”الطاہر الاوحد“ کا لقب دیا اور ان کی جلالتِ علمی و شرافت نسبی کا ہمیشہ پاس و لحاظ رکھا۔ ان کا خاندانی سلسلہ صرف چار واسطوں سے امامت کے سلسلہ زرّیں سے مل جاتا ہے، جو اس شجرۂ نسب سے ظاہر ہے:,,0
445,5,,1,,ابو احمد حسین ابن موسیٰ ابن محمد ابن موسیٰ ابن ابراہیم ابن امام موسیٰ کاظم علیہ السلام۔,,0
446,5,,1,,۲۵ جمادی الاولیٰ ۴۰۰ھ میں ستانوے (۹۷) برس کی عمرمیں انتقال فرمایا اور حائر حسینی میں دفن ہوئے۔ ابو العلاء معریٰ نے ان کا مرثیہ کہا ہے، جس کا ایک شعر یہ ہے:,,0
447,5,,6,,اَنْتُمْ ذُوُو النَّسَبِ الْقَصِيْرِ فَطَوْلُكُمبادٍ عَلَى الْكُبَرَآءِ وَ الْاَشْرَافِ,,0
448,5,,8,,”تمہارے اور امامؑ کے درمیان بہت تھوڑے سے وسائط حائل ہیں اور تمہاری بلندیاں اکابر و اشراف پر نمایاں ہیں“۔,,0
449,5,,1,,آپ کی والدہ معظّمہ کی شرافت وبلندیِ مرتبت کی طرف آگے اشارہ ہو گا، یہاں پر صرف ان کا شجرۂ نسب درج کیا جاتا ہے:,,0
450,5,,1,,فاطمہ بنت الحسین بن حسن الناصر ابن علی ابن حسن ابن عمر ابن علیؑ ابن حسینؑ ابن علی ابن ابی طالب(ع)۔,,0
451,5,,1,,ایسےنجیب و بلند مرتبت ماں باپ کی اخلاقی نگہداشت و حُسنِ تربیت کے ساتھ آپ کو استاد و مربی بھی ایسے نصیب ہوئے جو اپنے وقت کے ماہرین باکمال اور ائمۂ فن مانے جاتے تھے، جن میں سے چند کا یہاں پر ذکر کیا جاتا ہے:,,0
452,5,,2,,حسن ابن عبداللہ سیرافی:,,0
453,5,,1,,نحو ولغت وعروض و قوافی میں استادِ کامل تھے۔کتاب سیبویہ کی شرح اور متعدد کتابیں لکھی ہیں۔ سیّد نے بچپن میں ان سے قواعد نحو پڑھے اور انہی کے متعلّق آپ کا مشہور نحوی لطیفہ ہے کہ ایک دن حلقۂ درس میں نحوی اعراب کی مشق کراتے ہوئے سیّد رضیؒ سے پوچھا کہ: ½اِذَا قُلْنَا: رَاَیْتُ عُمَرَ، فَمَا عَلَامَۃُ نَصْبِ عُمَرَ:¼ ”جب ہم ½رَاَیْتُ عُمَرَ¼ کہیں تو اس میں علامت نصب{ FR 4047 } کیا ہو گی“؟ آپ نے برجستہ جواب دیا: ½ ”بُغْضُ عَلِیٍّ“¼۔ اس جواب پر سیرافی اور دوسرے لوگ ان کی ذہانت و طباعی پر دنگ رہ گئے۔ حالانکہ ابھی آپ کا سن دس برس کا بھی نہ تھا۔,,0
454,5,,7,,سالی کہ نکو است از بہارش پیداست,,0
455,5,,2,,ابواسحاق ابراہیم احمد ابن محمد طبری:,,0
456,5,,1,,بڑے پایہ کے فقیہ و محدّث اور علم پرور و جوہر شناس تھے۔ سیّد نے ان سے بچپن میں قرآن مجید کا درس لیا۔,,0
457,5,,2,,علی ابن عیسیٰ ربعی:,,0
458,5,,1,,انہوں نے بیس برس ابو علی فارسی سے استفادہ کیا اور نحو میں چند کتابیں لکھی ہیں۔ سیّد نے ان سے ”ایضاح“ ابو علی اور عروض و قوافی کی چند کتابیں پڑھیں۔,,0
459,5,,2,,ابو الفتوح عثمان ابن جنی:,,0
482,6,,2,﷽, ,,0
483,6,,5,[مُقَدِّمَةُ السَّيِّدِ الشَّرِيْفِ الرَّضِیْ], ,,0
484,6,,5,دیباچہ, ,,0
485,6,,5,مؤلف نہج البلاغہ علامہ شریف رضی علیہ الرحمہ, ,,0
486,6,,1,اَمَّا بَعْدَ حَمْدِ اللهِ الَّذِیْ جَعَلَ الْحَمْدَ ثَمَنًا لِّنَعْمَآئِهٖ، وَ مَعَاذًا مِّنْ بَلَآئِهٖ، وَ سَبِیْلًا اِلٰی جِنَانِهٖ، وَ سَبَبًا لِّزِیَادَةِ اِحْسَانِهٖ.,حمد و ستائش اس اللہ کیلئے ہے جس نے حمد کو اپنی نعمتوں کی قیمت، ابتلاؤں سے بچنے کا ذریعہ، جنت کا وسیلہ اور اپنے احسانات کے بڑھانے کا سبب قرار دیا ہے۔,,0
487,6,,1,وَالصَّلٰوةِ عَلٰى رَسُوْلِهٖ نَبِیِّ الرَّحْمَةِ، وَ اِمَامِ الْاَئِمَّةِ، وَ سِرَاجِ الْاُمَّةِ، الْمُنْتَخَبِ مِنْ طِیْنَةِ الْكَرَمِ، وَ سُلَالَةِ الْمَجْدِ الْاَقْدَمِ، وَ مَغْرِسِ الْفَخَارِ الْمُعْرِقِ، وَ فَرْعِ الْعَلَآءِ الْمُثْمِرِ الْمُوْرِقِ.,درود ہو اس کے رسول ﷺ پر جو نبی رحمت، پیشواؤں کا پیشوا، اُمت کا چراغ، دودمانِ شرافت کا انتخاب، قدیم ترین بزرگیوں کا نچوڑ، رگ و پے میں سمائے ہوئے فخر کی کھیتی، رفعت و بلندی کی برگ پوش و ثمردار شاخ ہے۔,,0
488,6,,1,وَ عَلٰۤى اَهْلِ بَیْتِهٖ مَصَابِیْحِ الظُّلَمِ، وَ عِصَمِ الْاُمَمِ، وَ مَنَارِ الدِّیْنِ الْوَاضِحَةِ، وَ مَثَاقِیْلِ الْفَضْلِ الرَّاجِحَةِ صَلَّى اللهُ عَلَیْهِمْ اَجْمَعِیْنَ، صَلَاةً تَكُوْنُ اِزَآءً لِّفَضْلِهِمْ، وَ مُكَافَاَةً لِّعَمَلِهِمْ، وَ كِفَآءً لِّطِیْبِ فَرْعِهِمْ وَ اَصْلِهِمْ،  مَاۤ اَنَارَ فَجْرٌ سَاطِعٌ، وَ خَوٰى نَجْمٌ طَالِعٌ.,اور آپؐ کے اہلبیتؑ پر رحمت ہو جو تاریکیوں کے چراغ، اُمت کیلئے سامانِ حفاظت، دین کے روشن مینار اور فضل و کمال کا بلند معیار ہیں۔ اللہ ان سب پر رحمت نازل کرے، ایسی رحمت جو ان کے فضل و کمال کے شایان، ان کے عمل و کردار کی جزا اور ان کی ذاتی و خاندانی پاکیزگی کے ہم پلہ ہو، جب تک صبح درخشاں لو دیتی رہے اور جگمگاتے ستارے اُبھر کر ڈوبتے رہیں۔,,0
