ID,CATEGORY_ID,TRANS_ID,ENGLISH
327,38,32,"AL-LAAHUM-MA YAA D'AAL-
MUL-KIL-MUTAAB-BIDI BIL-KHULOOD
WAS-SUL-T'AANIL-MUM-TANII' BIGHAY-RI JUNOODIW-WA LAAA AA'-WAAN
WAL-I'Z-ZIL-BAAQEE A'LAA MAR-RID-DUHOORI WA KHAWAALEEL-AA'-WAAMI WAMAWAAZ''EEL-AZ-MAANI WAL-AY-YAAM
A'Z-ZA SUL-T'AANUKA I'Z-ZAL-LAA H'AD-DA LAHOO BIW-WALEE-YATIW-WA LAA MUNTAHAA LAHOO BIAAKHAREE-YAH
WAS-TAA'-LAA MUL-KUKA U'LOO-WANA SAQAT'ATIL-ASH-YAAA-U DOONA BULOOGHI AMADIH
WA LAA YAB-LUGHU AD-NAA MAS-TAA-THAR-TA BIHEE MIN D'ALIKA AQ-S'AA NAA'-TIN-NAAI'TEEN
Z''AL-LAT FEEKAS'-S'IFAAT
WA TAFAS-SAKHAT D-DOONAKAN-NUU'WT
WA H'AARAT FEE KIB-REEAAA-IKA LAT'AAA-IFUL-AW-HAAMI
KAD'ALIKA ANTAL-LAAHUL-AW-WALU FEEE AW-WALEE-YATIK
WA A'LAA D'ALIKA ANTA DAAA-IMUL-LAA TAZOOL
WA ANAAL-A'B-D
AZ''-Z''AE'EFU A'MALAA
AL-JASEEMU AMALAA
KHARAJAT MEE-YADEEE AS-BAABUL-WUS'ULAATI IL-LAA MAA WAS'ALAHOO RAH'-MATUK
WA TAQAT'-T'AA'T A'N-NEE I'S'AMUL-AAAMAALI IL-LAA MAAA ANA MUA'-TAS'IMUM-BIHEE MIN A'F-WIK
QAL-LA I'NDEE MAAA AA'-TAD-DU BIHEE MIN T'AAA'TIK
WA KATHURA A'LAY-YA MAAA ABOOO-U BIHEE MIM-MAA'-S'EEATIK
WA LAY-YAZ''EEQA A'LAY-KA A'F-WUN A'N A'B-DIKA WA IN ASAAA-A FAA'-FU A'N-NEE
AL-LAAHUM-MA
WAQAD ASH-RAFA A'LAA KHAFAAYAAL-AA'-MAALI I'L-MUK
WANKASHAFA KUL-LU MAS-TOORIN DOONA KHUB-RIK
WA LAA TANT'AWEE A'NKA DAQAAA-IQUL-UMOOR
WA LAA TAA'-ZUBU A'NKA GHAY-YIBAATUS-SARAAA-IR
WA QADI AS-TAH'-WAD'A A'LAY-YA A'DOO-WUKAL-LAD'EE
S-TANZ'ARAKA LIGHAWAAYATEE FAANZ'AR-TAH
WAS-TAM-HALAKA ILAA YAW-MID-DEENI LIIZ''-LAALEE FAAM-HAL-TAH
FAAW-QAA'NEE WA QAD HARAB-TU ILAY-KA MIN-
S'AGHAAA-IRI D'UNOOBIM-MOOBIQAH
WA KABAAA-IRI AA'-MAALIM-MUR-DEEAH
H'AT-TAAA ID'AA QAARAF-TU MAA'-S'EEATAK
WAS-TAW-JAB-TU BISOOO-I SAA'-YEE SAKH-T'ATAK
FATALA A'N-NEE I'D'AARA GHAD-RIH
WA TALAQ-QAANEE BIKALIMATI KUF-RIH
WA TAWAL-LAAL-BARAAA-ATA MIN-NEE
WA AD-BARA MUWAL-LEEANA A'N-NEE
FAAS'-H'ARANEE LIGHAZ''ABIKA FAREEDAA
WA AKH-RAJANEEE ILAA FINAAA-I NAQIMATIKA T'AREEDAA
LAA SHAFEEU'Y-YASH-FAU' LEEE ILAY-K
WA LAA KHAFEERUY-YOO-MINUNEE A'LAY-K
WA LAA H'IS'-NUY-YAH'-JUBUNEE A'NK
WA LAA MALAAD'UN AL-JAA ILAY-HEE MINK
FAHD'AA MAQAAMUL-A'AA-ID'I BIKA WA MAH'AL-LUL-MUA'-TARIFI LAK
FALAA YAZ''EEQAN-NA A'N-NEE FAZ''-LUK
WA LAA YAQ-S'URAN-NA DOONEE A'F-WUK
WA LAAA AKUN AKH-YABA I'BAADIKAT-TAAA-IBEEN
WA LAAA AQ-NAT'A WFOODIKAL-AAAMILEEN
WAGH-FIR LEEE IN-NAKA KHAY-RUL-GHAAFIREEN
AL-LAAHUM-MA IN-NAK
AMAR-TANEE FATARAK-T
WA NAHAY-TANEE FARAKIB-T
WA SAW-WALA LEEAL-KHAT'AAA-A KHAAT'IRUS-SOOO-I FAFAR-RAT'-T
WA LAAA AS-TASH-HIDU A'LAA S'EEAAMEE NAHAARAA
WA LAAA AS-TAJEERU BITAHAJ-JUDEE LAY-LAA
WA LAA TUTH-NEE A'LAY-YA BIIH'-YAAA-IHAA SUN-NATUN H'AASHAA FUROOZ''IKAL-LATEE MAN Z''AY-YAA'HAA HALAK
WA LAS-TU ATAWAS-SALU ILAY-KA BIFAZ''-LI NAAFILATIM-MAA' KATHEER
MAAA AGH-FAL-TU MIW-WAZ'AAA-IFI FUROOZ''IK
WA TAA'D-DAY-TU A'M-MAQAAMAATI H'UDOODIKA 
ILAA H'URUMAATIN ANTAHAK-TUHAA
WA KABAAA-IRI D'UNOOBIN AJ-TARAH'-TUHAA
KAANAT A'AFEEATUKA LEE MIN FAZ''AAA-IH'IHAA SIT-RAA
WA HAD'AA MAQAAMU MAN
AS-TAH'-YAA LINAF-SIHEE MINK WA SAKHIT'A A'LAY-HAA WA RAZ''EEA A'NKA 
FATALAQ-QAAKA 
BINAF-SIN KHAASHIA'H
WA RAQABATIN KHAAZ''IA'H
WA Z'AH-RIM-MUTH-QALIM-MINA ALKHAT'AAYAA
WAAQIFAM-BAY-NAR-RAGH-BATI ILAY-KA WAR-RAH-BATI MINK
WA ANTA AW-LAA MAR-RAJAAHOO 
WA AH'AQ-QU MAN KHASHEEAHOO WA AT-TAQAAH
FAAA'-T'INEE YAA RAB-BI MAA RAJAW-T
WA AAAMIN-NEE MAA H'AD'IR-T
WA U'D A'LAY-YA BIA'AA-IDATI RAH'-MATIK
IN-NAKA AK-RAMUL-MAS-OOLEEN
AL-LAAHUM-MA WA ID' SATAR-TANEE BIA'F-WIK
WA TAGHAM-MAT-TANEE BIFAZ''-LIKA FEE DAARIL-FANAAA-I BIH'AZ''-RATIL-AK-FAAA-I
FAAJIR-NEE MIN FAZ''EEH'AATI DAARIL-BAQAAA-I I'NDA MAWAAQIFIL-ASH-HAAD
MINAL-MALAAA-IKATIL-MUQAR-RABEEN
WAR-RUSULIL-MUKAR-RAMEEN
WASH-SHUHADAAA-I WAS'-S'AALIH'EEN
MIN JAARIN KUNTU UKAATIMUHOO SAY-YI-AATEE
WA MIN D'EE RAH'IMIN KUNTU AH'-TASHIMU MIN-HOO FEE SAREERAATEE
LAM ATHIQ BIHIM RAB-BI FIS-SIT-RI A'LAY
WA WATHIQ-T BIKA RAB-BI FIL-MAGH-FIRATI LEE
WA ANTA AW-LAA MAW-WUTHIQA BIH
WA AA'-T'AA MAR-RUGHIBA ILAY-H
WA AR-AFU MANI AS-TUR-H'IM FAR-H'AM-NEE
AL-LAAHUM-MA WA ANTA H'ADAR-TANEE MAAA-AM-MAHEENAA
MIN S'UL-BIM-MUTAZ''AAA-IQIL-I'Z'AAMI H'ARIJIL-MASAALIK
ILAA RAH'IMIN Z''AY-YQATIN SATAR-TAHAA BIL-H'UJUB
TUS'AR-RIFUNEE H'AALANA A'N H'AALIN H'AT-TAA
ANTAHAY-TA BEEE ILAA TAMAAMIS'-S'OORAH
WA ATH-BAT-TA FEE-YAL-JAWAARIH'
KAMAA NAA'T-TA FEE KITAABK
(NUT'-FATAN THUM-MA A'LAQATAN THUM-MA MUZ''-GHATAN THUM-MA I'Z'AAMANA THUM-MA KASAW-TAL-I'Z'AAMA LAH'-MANA THUM-MA ANSHAA-TANEE KHAL-QAN AAAKHAR)
KAMAA SHI-T
H'AT-TAAA ID'AA AH'-TAJ-TU ILAA RIZ-QIKA WA LAM AS-TAGH-NI A'N GHEEAATHI FAZ''-LIK
JAA'L-TA LEE QOOTAM-MIN FAZ''-LI T'AA'AMIW-WA SHARAABIN AJ-RAY-TAHOO LIAMATIKAL-LATEE 
AS-KANTANEE JAW-FAHAA
WA AW-DAA'-TANEE QARAARA RAH'IMIHAA
WA LAW TAKIL-NEE YAA RAB-BI FEE TIL-KAL-H'AALAATI ILAA H'AW-LEEE AW TAZ''-T'AR-RUNEEE ILAA QOO-WATEE
LAKAANAL-H'AW-LU A'N-NEE MUA'-TAZILAA
WA LAKAANATI ALQOO-WATU MIN-NEE BAE'EDAH
FAGHAD'AW-TANEE BIFAZ''-LIKA GHID'AAA-AL-BAR-RIL-LAT'EEF
TAF-A'LU D'ALIKA BEE TAT'AW-WULANA A'LAY-YA ILAA GHAAYATEE HAD'IH
LAAA AA'-DAMU BIR-RAK
WA LAA YUB-T'I-U BEE H'US-NU S'ANEEI'K
WA LAA TATAAK-KADU MAA' D'ALIKA THIQATEE FAATAFAR-RAGHA LIMAA HUWA AH'-Z'A LEE I'NDAK
QAD MALAKASH-SHAY-T'AANU I'NAANEE FEE SOOO-IZ'-Z'AN-NI WAZ''AA'-FIL-YAQEEN
FAANAA ASH-KOO
SOOO-A MUJAAWARATIHEE LEE
WA T'AAA'TA NAF-SEE LAH
WA AS-TAA'-S'IMUKA MIM-MALAKATIH
WA ATAZ''AR-RAU' ILAY-KA FEE S'AR-FI KAY-DIHEE A'N-NEE
WA AS-ALUKA FEEE AN TUSAH-HILA ILAA RIZ-QEE SABEELANA
FALAKAL-H'AM-DU A'LAA AB-TIDAAA-IKA BIN-NIA'MIL-JISAAMI WA IL-HAAMIKASH-SHUK-RA A'LAAL-IH'-SAANI WAL-IN-A'AM
FAS'AL-LI A'LAA MUH'AM-MADIW-WA AAALIH
WASAH-HIL A'LAY-YA RIZ-QEE
WA AN TUQ-NIA'NEE BITAQ-DEERIKA LEE
WA AN TUR-Z''EEANEE BIH'IS'-S'ATEE FEEMAA QASAM-TA LEE
WA AN TAJ-A'LA MAA D'AHABA MIN JIS-MEE WAU'M-REE FEE SABEELI T'AAA'TIK
IN-NAKA KHAY-RUR-RAAZIQEEN
AL-LAAHUM-MA IN-NEEE SU'WD'U BIKA MIN-NAAR
TAGHAL-LAZ'-TA BIHAA A'LAA MAN A'S'AAK
WA TAWAA'-A'T-TA BIHAA MAN S'ADAFA A'R-RIZ''AAK
WA MIN-NAARIN-NOORUHAA Z'UL-MAH
WA HAY-YINUHAAA ALEEM
WA BAE'EDUHAA QAREEB
WA MIN-NAAREE-YAA-KULU BAA'-Z''AHAA BAA'-Z''
WA YAS'OOLU BAA'-Z''UHAA A'LAA BAA'-Z''
WA MIN-NAARIN TAD'ARUL-I'Z'AAMA RAMEEMAA
WA TAS-QEEE AH-LAHAA H'AMEEMAA
WA MIN-NAARIL-LAA TUB-QEE A'LAA MAN TAZ''AR-RAA' ILAY-HAA
WA LAA TAR-H'AMU MANI AS-TAA'-T'AFAHAA
WA LAA TAQ-DIRU A'LAAT-TAKH-FEEFI A'M-MAN KHASHAA' LAHAA WAS-TAS-LAMA ILAY-HAA
TAL-QAA SUK-KAANAHAA BIH'AR-RI MAA LADAY-HAA MIN ALEEMIN-NAKAALI WASHADEEDIL-WABAAL
WA AU'WD'U BIKA MIN-
A'QAARIBIHAAL-FAAGHIRATI AF-WAAHUHAA
WA H'AY-YAATIHAAS'-S'AALIQATI BINYAABIHAA
WA SHARAABIHAAL-LAD'EE YUQAT'-T'IU' AM-A'AA-A WA AF-IDATA SUK-KAANIHAA WA YANZIU' QULOOBAHUM
WA AS-TAH-DEEKA LIMAA BAAA'DA MIN-HAA WA AKH-KHARA A'N-HAA
AL-LAAHUM-MA S'AL-LI A'LAA MUH'AM-MADIW-WA AAALIH
WA AJIR-NEE MIN-HAA BIFAZ''-LI RAH'-MATIK
WA AQIL-NEE A'THARAATEE BIH'US-NI IQAALATIK
WA LAA TAKH-D'UL-NEE YAA KHAY-RAL-MUJEEREEN
AL-LAAHUM-MA IN-NAK
TAQEEL-KAREEHAH
WTUA'-T'EEL-H'ASANAH
WA TAF-A'LU MAA TUREED
WA ANTA A'LAA KUL-LI SHAY-IN QADEER
AL-LAAHUM-MA
S'AL-LI A'LAA MUH'AM-MADIW-WA AAALIHEEE ID'AA D'UKIRAL-AB-RAAR
WA S'AL-LI A'LAA MUH'AM-MADIW-WA AAALIHEE MAKH-TALAFAL-LAY-LU WAN-NAHAAR
S'ALAATAL-LAA YANQAT'IU' MADADUHAA
WA LAA YUH'-S'AA A'DADUHAA
S'ALAATAN TASH-H'ANUL-HAWAAA-A
WA TAM-LAAL-AR-Z''A WAS-SAMAAA-
S'AL-LAAL-LAAHOO A'LAY-HEE H'AT-TAA YARZ''AA
WA S'AL-LAAL-LAAHOO A'LAY-HEE WA AAALIHEE BAA'-DAR-RIZ''AA
S'ALAATAL-LAA H'AD-DA LAHAA WA LAA MUNTAHAA
YAAA AR-H'AMAR-RAAH'IMEEN"
328,38,33,"AL-LAAHUM-MA IN-NEEE AS-TAKHEERUKA BII'L-MIK
FAS'AL-LI A'LAA MUH'AM-MADIW-WA AAALIH
WAQ-Z''I LEE BIL-KHEEARAH
WA AL-HIM-NAA MAA'-RIFATALIKH-TEEAAR
WAJ-A'L D'ALIK D'AREEA'TAN ILAA
R-RIZ''AA BIMAA QAZ''AY-TA LANAA
WAT-TAS-LEEMI LIMAA H'AKAM-T
FAAZIH' A'N-NAA RAY-BALIR-TEEAAB
WA AY-YID-NAA BEEAQEENIL-MUKH-LIS'EEN
WA LAA TASUM-NAA A'J-ZAL-MAA'-RIFATI A'M-MAA TAKHAY-YAR-T
FANAGH-MIT'A QAD-RAK
WA NAK-RAHA MAW-Z''IA' RIZ''AAK
WA NAJ-NAH'A ILAAL-LATEE HEE
AB-A'DU MIN H'US-NIL-A'AQIBAH
WA AQ-RABU ILAA Z''ID-DIL-A'AFEEAH
H'AB-BIB ILAY-NAA MAA NAK-RAHOO MIN QAZ''AAA-IK
WA SAH-HIL A'LAY-NAA MAA NAS-TAS'-I'BU MIN H'UK-MIK
WA AL-HIM-NAALINQEEAADA LIMAAA AW-RAT-TA A'LAY-NAA MIM-MASHEE-YATIK
H'AT-TAA LAA NUH'IB
TAA-KHEERA MAA A'J-JAL-T
WA LAA TAA'-JEELA MAAA SKH-KHAR-T
WA LAA NAK-RAHA MAAA AH'-BAB-T
WA LAA NATAKHAY-YARA MAA KARIH-T
WAKH-TIM LANAA BIL-LATEE HEE
AH'-MADU A'AQIBAH
WA AK-RAMU MAS'EERAA
IN-NAKA TUFEEDUL-KAREEMAH
WA TUA'-T'EEL-JASEEMAH
WA TAF-A'LU MAA TUREED
WA ANTA A'LAA KUL-LI SHAY-IN QADEER"
329,38,34,"AL-LAAHUM-MA LAKAL-H'AM-DU A'LAA 
SIT-RIKA BAA'-DA I'L-MIK
WA MUA'AFAATIKA BAA'-DA KHUB-RIK
FAKUL-LUNAA QAD
AQ-TARAFAL-A'AA-IBATA FALAM TASH-HAR-H
WAR-TAKABAL-FAAH'ISHATA FALAM TAF-Z''AH'-H
WA TASAT-TARA BIL-MASAAWI-I FALAM TAD-LUL A'LAY-H
KAM 
NAH-YIL-LAKA QAD ATAY-NAAH
WA AM-RIN QAD WAQAF-TANAA A'LAY-HEE FATAA'D-DAY-NAAH
WA SAY-YI-ATIN AK-TASAB-NAAHAA
WA KHAT'EE-ATIN AR-TAKAB-NAAHAA
KUNTAL-MUT'-T'ALIA' A'LAY-HAA DWNAN-NAAZ'IREEN
WAL-QAADIRA A'LAAA IA'-LAANIHAA FAW-QAL-QAADIREEN
KAANAT A'AFEEATUKA LANAA
H'IJAABANA DOONA AB-S'AARHIM-
WA RAD-MANA DOONA AS-MAAI'HIM-
FAJ-A'L MAA SATAR-TA MINAL-A'W-RATI WA AKH-FAY-TA MINAD-DAKHEELAH
WAAI'Z'AL-LANAA
WA ZAAJIRANA A'N SOOO-IL-KHUL-QI WAQ-TIRAAFIL-KHAT'EE-ATI 
WA SAA'-YAN ILAAT-TAW-BATIL-MAAH'EEATI WAT'-T'AREEQIL-MAH'-MOODAH
WA QAR-RIBIL-WAQ-TA FEEH
WA LAA TASUM-NAAL-GHAF-LATA A'NK
IN-NAAA ILAY-KA RAAGHIBOON
WA MINAD'-D'UNOOBI TAAA-IBOON
WA S'AL-LI A'LAA KHEEARATIKAL-LAAHUM-MA MIN KHAL-QIKA MUH'AM-MADIW-WAI'T-RATIHIS'-S'AF-WATI MIM-BAREE-YATIKAT'-T'AAHIREEN
WAJ-A'L-NAA LAHUM SAAMIE'ENA WAMUT'EEE'ENA KAMAAA AMAR-T"
330,38,35,"AAL-H'AM-DU LL-LAHEE RIZ''AN BIH'UK-MIL-LAAH
SHAHIT-TU AN-NAL-LAAH
QAS-SAMA MAA'AYISHA I'BAADIHEE BIL-A'D-L
WA AKHAD'A A'LAA JAMEEI' KHAL-QIHEE BIL-FAZ''-L
AL-LAAHUM-MA S'AL-LI A'LAA MUH'AM-MADIW-WA AAALIH
WA LAA TAF-TIN-NEE BIMAAA AA'-T'AY-TAHUM-
WA LAA TAF-TIN-HUM BIMAA MANAA'-TANEE
FAAH'-SUDA KHAL-QAK
WA AGH-MIT'A H'UK-MAK
AL-LAAHUM-MA S'AL-LI A'LAA MUH'AM-MADIW-WA AAALIH
WA T'AY-YIB BIQAZ''AAA-IKA NAF-SEE
WA WAS-SIA' BIMAWAAQII' H'UK-MIKA S'AD-REE
WA HAB LEEATH-THIQATA LIUQIR-RA MAA'HAA BIN-NA QAZ''AAA-AKA LAM YAJ-RI IL-LAA BIL-KHEEARAH
WAJ-A'L SHUK-REE LAKA A'LAA MAA ZAWAY-TA A'N-NEEE AW-FARA MIN SHUK-REEE EE-YAAKA A'LAA MAA KHAW-WAL-TANEE
WAA'-S'IM-NEE MIN AN 
AZ'UN-NA BID'EE A'DAMIN KHASAASAH
AW AZ'UN-NA BIS'AAH'IBI THAR-WATIN FAZ''-LAA
FA IN-NASH-SHAREEFA MAN SHAR-RAFAT-HOO T'AAA'TUK
WAL-A'ZEEZA MAN AA'Z-ZAT-HOO I'BAADATUK
FAS'AL-LI A'LAA MUH'AM-MADIW-WA AAALIH
WA MAT-TIA'-NAA BITHAR-WATIL-LAA TANFAD
WA AY-YID-NAA BII'Z-ZIL-LAA YUF-QAD
WA AS-RIH'-NAA FEE MUL-KIL-ABAD
IN-NAKAL-WAAH'IDUL-SH'ADUS'-S'AMAD
AL-LAD'EE LAM TALID WALAM TOOLAD-
WA LAM YAKUL-LAKA KUFUWAN AH'AD"
331,38,36,"AL-LAAHUM-MA 
IN-NA HD'AY-NI AAAYATAANI MIN AAAYAATIK
WA HD'AY-NI A'W-NAANI MIN AA'-WAANIK
YAB-TADIRAANI T'AAA'TAKA BIRAH'-MATIN-NAAFIA'TIN AW NAQIMATIN Z''AAAR-RAH
FALAA TUM-T'IR-NAA BIHIMAA MAT'ARAS-SAW-
WA LAA TUL-BIS-NAA BIHIMAA LIBAASAL-BALAAA-
AL-LAAHUM-MA S'AL-LI A'LAA MUH'AM-MADIW-WA AAALIH
WA ANZIL A'LAY-NAA NAF-A' HAD'IHS-SAH'AAA-IBI WA BARAKATAHAA
WAS'-RIF A'N-NAAA AD'AAHAA WAMAZ''AR-RATAHAA
WA LAA TUS'IB-NAA FEEHAA BIAAFAH
WA LAA TUR-SIL A'LAA MAA'AYISHINAA A'AHAH
AL-LAAHUM-MA
WA IN KUNTA BAA'TH-TAHAA NAQIMAH
WA AR-SAL-TAHAA SAKH-T'AH
FA IN-NAA NAS-TAJEERUKA MIN GHAZ''ABIK
WA NAB-TAHILU ILAY-KA FEE SOO-AALI A'F-WIK
FAMIL BIL-GHAZ''ABI ILAAL-MUSH-RIKEEN
WA ADIR RAH'AA NAQIMATIKA A'LAAL-MUL-H'IDEEN
AL-LAAHUM-MA 
AD'-HIB MAH'-LA BILAADINAA BISUQ-YAAK
WA AKH-RIJ WAH'ARA S'UDOORINAA BIRIZ-QIK
WA LAA TASH-GHAL-NAA A'NKA BIGHAY-RIK
WA LAA TAQ-T'AA' A'N KAAAF-FATINAA MAAAD-DATA BIR-RIK
FA IN-NAL-GHANEE-YA MAN AGH-NAY-T
WA IN-NAS-SAALIMA MAW-WAQAY-T
MAA I'NDA AH'ADIN DOONAKA DIFAAA'
WA LAA BIH'ADIN A'N SAT'-WATIKA AM-TINAAA'
TAH'-KUMU BIMAA SHI-TA A'LAA MAN SHI-T
WA TAQ-Z''EE BIMAAA ARAT-TA FEE MAN ARAT-T
FALAKAL-H'AM-DU A'LAA MAA WAQAY-TANAA MINAL-BALAAA-
WA LAKASH-SHUK-RU A'LAA MAA KHAW-WAL-TANAA MINAN-NAA'-MAAA-I
H'AM-DAY-YUKHAL-LIFU H'AM-DAL-H'AAMIDEENA WARAAA-AH
H'AM-DAY-YAM-LAA AR-Z''AHOO WASAMAAA-AH
IN-NAKAL-MAN-NAANU BIJASEEMIL-MINAN
AL-WAH-HAABU LIA'Z'EEMIN-NIA'M
AL-QAABILU YASEERAL-H'AM-D
ASH-SHAAKIRU QALEELASH-SHUK-R
AL-MUH'-SINUL-MUJ-MILU D'OOT'-T'AW-L
LAAA ILAHA IL-LAAA ANTA 
ILAY-KAL-MAS'EER"
332,38,37,"AL-LAAHUM-MA IN-NA AH'ADAL-
LAA YAB-LUGHU MIN SHUK-RIKA GHAAYATAN IL-LAA H'AS'ALA A'LAY-HEE MIN IH'-SAANIKA MAA YUL-ZIMUHOO SHUK-RAK
WA LAA YAB-LUGHU MAB-LAGHAM-MIN T'AAA'TIKA WAANI AJ-TAHADA IL-LAA KAANA MUQAS'-S'IRANA DOONA AS-TIH'-QAAQIKA BIFAZ''-LIK
FAASH-KARU I'BAADIKA A'AJIZUN A'N SHUK-RIK
WA AA'-BADUHUM LAK MQAS'-S'IRUN A'N T'AAA'TIK
LAA YAJIBU LIAH'ADIM-MIN-HUM
AN TAGH-FIRA LAHOO BIS-TIH'-QAAQIH
WA LAA YAH'IQ-QU LAHOOO AN TAR-Z''AA A'N-HOO BIS-TEEJAABIH
FAMAN GHAFAR-TA LAHOO FABIT'AW-LIK
WA MAR-RAZ''EETA A'N-HOO FABIFAZ''-LIK
TASH-KURU YASEERA MAA SHUKIR-TAH
WA TUTHEEBU A'LAA QALEELI MAA TUT'AAU' FEEH
H'AT-TAA KAAN-NA SHUK-RA I'BAADIKAL-LAD'EE 
AW-JAB-TA A'LAY-HEE THAWAABAHUM-
WA AA'-Z'AM-TA A'N-HOO JAZAAA-AHUM-
AM-RUM-MALAKOOS-TIT'AAA'TALIM-TINAAI' MIN-HOO DOONAKA FAKAAFAA-TAHUM-
WA LAM YAKUN SABABUHOO BEEADIKA FAJAAZAY-TAHUM-
BAL MALAK-TA YAAA ILAAHEEE AM-RAHUM QAB-LA AY-YAM-LIKOO I'BAADATAK
WA AA'-DAT-TA THAWAABAHUM QAB-LA AY-YUFEEZ''OO FEE T'AAA'TIK
WA D'ALIKA AN-NA
SUN-NATAKAL-IF-Z''AAL
WA A'ADATAKAL-IH'-SAAN
WA SABEELAKAL-A'F-W
FAKUL-LUL-BAREE-YAH
MUA'-TARIFATUM-BI N-NAKA GHAY-RU Z'AALIMIL-LIMAN A'AQAB-T
WA SHAAHIDATUM-BI N-NAKA MUTAFAZ''-Z''ILUN A'LAA MAN A'AFAY-T
WA KUL-LU MUQIR-RU A'LAA NAF-SIHEE BIT-TAQ-S'EERI A'M-MAS-TAW-JAB-T
FALAW-LAAA AN-NASH-SHAY-T'AANA YAKH-TADIU'HUM A'N T'AAA'TIKA MAA A'S'AAKA A'AS'
WA LAW-LAAA AN-NAHOO YUS'AW-WIRU LAHUMUL-BAAT'ILA FEE MITHAALIL-H'AQ-QI MAA Z''AL-LA A'N T'AREEQIKA Z''AAAL
FASUB-H'AANAK
MAAA AB-YANA KARAMAKA FEE MUA'AMALATI MAN AT'AAA'KA AW A'S'AAK
TASH-KURUL-MUT'EEA' A'LAA MAAA ANTA TAWAL-LAY-TAHOO LAH
WA TUM-LEE LIL-A'AS'EE FEEMAA TAM-LIKU MUA'AJALATAHOO FEEH
AA'-T'AY-TA KUL-LAM-MIN-HUMAA MAA LAA YAJIBU LAH
WA TAFAZ''-Z''AL-TA A'LAA KUL-LIM-MIN-HUMAA BIMAA YAQ-S'URU A'MALUHOO A'N-H
WA LAW KAAFAY-TAL-MUT'EEA' A'LAA MAAA ANTA TAWAL-LAY-TAHOO LAHOO LAAW-SHAKA 
AY-YAF-QIDA THAWAABAK
WA AN TAZOOLA A'N-HOO NIA'-MATUK
WA LKIN-NAKA BIKARAMIKA JAAZAY-TAHOO 
A'LAAL-MUD-DATIL-QAS'EERATIL-FAANEEATI BIL-MUD-DATIT'-T'AWEELATIL-KHAALIDAH
WA A'LAAL-GHAAYATIL-QAREEBATIZ-ZAAA-ILATI BIL-GHAAYATIL-MADEEDATIL-BAAQEEAH
THUM-MA LAM TASUM-HUL-QIS'AAS'A FEEMAAA AKALA MIR-RIZ-QIKAL-LAD'EE YAQ-WAA BIHEE A'LAA T'AAA'TIK
WA LAM TAH'-MIL-HOO A'LAAL-MUNAAQASHATI FIL-AAALAATIL-LATEE TASAB-BABA BIS-TIA'-MAALIHAAA ILAA MAGH-FIRATIK
WA LAW FAA'L-TA D'ALIKA BIHEE LAD'AHAB
JAMEEU' MAA KADAH'A LAH
WA JUM-LATU MAA SAA'A FEEHEE 
JAZAAA-AL-LILS'-S'UGH-RAA MIN AYAADEEKA WMINANIK
WA LABAQEEA RAHEENAM-BAY-NA YADAY-KA BISAAA-IRI NIA'MIK
FAMATAA KAANA YASTAH'IQ-QU SHAY-AM-MIN THAWAABIKA? LAA MATAA?
HAD'AA YAAA ILAAHEE H'AALU MAN AT'AAA'KA WA SABEELU MAN TAA'B-BADA LAK
FAAM-MAAL-A'AS'EEE AM-RAKA WAL-MUWAAQIU' NAH-YAK
FALAM TUA'AJIL-HOO BINAQIMATIKA LIKAY YAS-TAB-DILA BIH'AALIHEE FEE MAA'-S'EEATIKA H'AALAL-INAABATI ILAA T'AAA'TIK
WA LAQAD KAANA YAS-TAH'IQ-QU YAAA ILAAHEE FEEE AW-WALI MAA HAM-MA BII'S'-YAANIKA KUL-LA MAAA AA'-DAT-TA LIJAMEEI' KHAL-QIKA MIN U'QOOBATIK
FAJAMEEU' MAAA AKH-KHAR-TA A'N-HOO MINAL-A'D'AAB
WA AB-T'AA-TA A'LAY-HEE MIN SAT'AWAATIN-NIQ-MATI WAL-I'QAAB
TAR-KUM-MIN H'AQ-QIKA WARIZ''AN BIDOONI WAAJIBIK
FAMAN AK-RAMU YAAA ILAAHEE MINKA? 
WAMAN ASH-QAA MIM-MAN HALAKA A'LAY-KA? LAA MAN-?! 
FATABAARAK-TA AN TOOS'AFA IL-LAA BIL-IH'-SAAN
WA KARUM-TA AY-YUKHAAFA MINKA IL-LAAL-A'D-L
LAA YUKH-SHAA JAW-RUKA A'LAA MAN A'S'AAK
WA LAA YUKHAAFU IGH-FAALUKA THAWAABA MAN AR-Z''AAKA 
FAS'AL-LI A'LAA MUH'AM-MADIW-WA AAALIH
WA HAB LEE MINKA AMALEE
WA ZID-NEE MIN HUDAAKA MAAA AS'ILU BIHEEE ILAAT-TAW-FEEQI FEE A'MALEE
IN-NAKA MAN-NAANUN KAREEM"
333,38,38,"AL-LAAHUM-MA IN-NEEE AA'-TAD'IRU ILAY-KA 
MIM-MAZ'-LOOMIN Z'ULIMA BIH'AZ''-RATEE FALAM ANS'UR-H
WA MIM-MAA'-ROOFIN US-DEEA ILAY-YA FALAM ASH-KUR-H
WA MIM-MUSEE-IN AA'-TAD'ARA ILAY-YA FALAM AA'-D'IR-H
WA MIN D'EE FAAQATIN SAALANEE FALAM OO-THIR-H
WA MIN H'AQ-QI D'EE H'AQ-QIL-LAZIMANEE LIMOO-MININ FALAM UWAF-FIR-H
WA MIN A'Y-BI MOO-MININ Z'AHARA LEE FALAM AS-TUR-H
WA MIN KUL-LI ITH-MIN A'RAZ''A LEE FALAM AH-JUR-H
AA'-TAD'IRU ILAY-KA YAAA ILAAHEE MIN-HUN-NA WAMIN-NAZ'AAA-IRIHIN
AA'-TID'AARA NADAAMATEE-YAKOONU WAAI'Z'AL-LIMAA BAY-NA YADAY-YA MIN ASH-BAAHIHIN
FAS'AL-LI A'LAA MUH'AM-MADIW-WA AAALIH WAJ-A'L
NADAAMATEE A'LAA MAA WAQAA'-TU FEEHEE MINAZ-ZAL-LAAT
WA A'Z-MEE A'LAA TAR-KI MAA YAA'-RIZ''U LEE MINAS-SAY-YI-AAT
TAW-BATAN TOOJIBU LEE MAH'AB-BATAKA 
YAA MUH'IB-BAT-TAW-WAABEEN"
334,38,39,"AL-LAAHUM-MA S'AL-LI A'LAA MUH'AM-MADIW-WA AAALIH
WAK-SIR SHAH-WATEE A'N KUL-LI MUH'AR-RAM
WAZ-WI H'IR-S'EE A'N KUL-LI MAA-THAM
WAM-NAA'-NEE A'N AD'A KUL-LI MOO-MINIW-WA MOO-MINATIW-WA MUS-LIMIW-WA MUS-LIMAH
AL-LAAHUM-MA WA AY-YUMAA A'B-D
NAALA MIN-NEE MAA H'AZ'AR-TA A'LAY-H
WANTAHAKA MIN-NEE MAA H'AJAR-TA A'LAY-H
FAMZ''AA BIZ'ULAAMATEE MAY-YITAA
AW H'AS'ALAT LEE QIBALAHOO H'AY-YAA
FAGH-FIR LAHOO MAAA ALAM-MA BIHEE MIN-NEE
WAA'-FU LAHOO A'M-MAAA AD-BARA BIHEE A'N-NEE
WA LAA TAQIF-HOO A'LAA MAR-TKABA FEE
WA LAA TAK-SHIF-HOO A'M-MAK-TASABA BEE
WAJ-A'L MAA 
SAMAH'-TU BIHEE MINAL-A'F-WI A'N-HUM-
WA TABAR-RAA'-TU BIHEE MINAS'-S'ADAQATI A'LAY-HIM-
AZ-KAA S'ADAQAATIL-MUTAS'AD-DIQEEN
WA AA'LAA S'ILAATIL-MUTAQAR-RIBEEN
WA A'W-WIZ''-NEE MIN A'F-WEE A'N-HUM A'F-WAK
WA MIN DUA'AA-EE LAHUM RAH'-MATAK H'AT-TAA 
YAS-A'DA KUL-LU WAAH'IDIM-MIN-NAA BIFAZ''-LIK
WA YANJUWA KUL-LUM-MIN-NAA BIMAN-NIK
AL-LAAHUM-MA WA AY-YUMAA A'B-DIM-MIN A'BEEDIKA 
AD-RAKAHOO MIN-NEE DARAK
AW MAS-SAHOO MIN-NAAH'EEATEEE AD'ANA
AW LAH'IQAHOO BEEE AW BISABABEE Z'UL-M
FAFUT-TUHOO BIH'AQ-QIH
AW SABAQ-TUHOO BIMAZ'-LAMATIH
FAS'AL-LI A'LAA MUH'AM-MADIW-WA AAALIH
WA AR-Z''IHEE A'N-NEE MIW-WJ-DIK
WA AW-FIHEE H'AQ-QAHOO MIN I'NDIK
THUM-MA QINEE MAA YOOJIBU LAHOO H'UK-MUK
WA KHAL-LIS'-NEE MIM-MAA YAH'-KUMU BIHEE A'D-LUK
FA IN-NA QOO-WATEE LAA TAS-TAQIL-LU BINAQIMATIK
WA IN-NA T'AAQATEE LAA TAN-HAZ''U BISUKH-T'IK
FA IN-NAKA IN TUKAAFINEE BIL-H'AQ-QI TUH-LIK-NEE
WA IL-LA TAGHAM-MAD-NEE BIRAH'-MATIKA TOOBIQ-NEE
AL-LAAHUM-MA IN-NEE 
AS-TAW-HIBUKA YAAA ILAAHEE MAA LAA YANQUS'UKA BAD'-LUH
WA AS-TAH'-MILUKA MAA LAA YAB-HAZ'UKA H'AM-LUH
AS-TAW-HIBUKA YAAA ILAAHEE NAF-SEEAL-LATEE 
LAM TAKH-LUQ-HAA
LITAM-TANIA' BIHAA MIN SOOO-IN
AW LITAT'AR-RAQA BIHAAA ILAA NAF-A'
WA LKIN ANSHAA-TAHAA 
ITH-BAATAL-LIQUD-RATIKA A'LAA MITH-LIHAA
WAH'-TIJAAJAM-BIHAA A'LAA SHAK-LIHAA
WA AS-TAH'-MILUKA MIN D'UNOOBEE MAA QAD BAHAZ'ANEE H'AM-LUH
WA AS-TAE'ENU BIKA A'LAA MAA QAD FADAH'ANEE THIQ-LUH
FAS'AL-LI A'LAA MUH'AM-MADIW-WA AAALIH
WA HAB LINAF-SEE A'LAA Z'UL-MIHAA NAF-SEE
WA WAK-KIR-R-RAH'-MATAKA BIH'-TIMAALI IS'-REE
FAKAM QAD LAH'IQAT RAH'-MATUKA BIL-MUSEE-EEN
WA KAM QAD SHAMILA A'F-WUKAZ'-Z'AALIMEEN
FAS'AL-LI A'LAA MUH'AM-MADIW-WA AAALIH
WAJ-A'L-NEEE US-WATA MAN 
AN-HAZ''-TAHOO BITAJAAWZIKA A'M-MAS'AARII'L-KHAAT'I-EEN
WA KHAL-LAS'-TAHOO BITAWFEEQIKA MIW-WARAT'AATIL-MUJ-RIMEEN
FAAS'-BAH'A 
T'ALEEQA A'F-WIKA MN ISAARI SUKH-T'IK
WA A'TEEQA S'UN-I'KA MIW-WATHAAQI A'D-LIK
IN-NAKA IN TAF-A'L D'ALIKA YAAA ILAAHEE TAF-A'L-HOO BIMAN 
LAA YAJ-H'ADU AS-TIH'-QAAQA U'QOOBATIK
WA LAA YUBAR-RI-U NAF-SAHOO MIN AS-TEEJAABI NAQIMATIK
TAF-A'LU D'ALIKA YAAA ILAAHEE 
BIMAN KHAW-FUHOO MINKA AK-THARU MIN T'AMAI'HEE FEEK
WA BIMAY-YAA-SUHOO MINAN-NAJAATI AW-KADU MIR-RAJAAA-IHEE LIL-KHALAAS'
LAAA AY-YAKOONA YAA-SUHOO QUNOOT'AA
AW AY-YAKOONA T'AMAU'HOO AGH-TIRAARAA
BAL-LIQIL-LATI H'ASANAATIHEE BAY-NA SAY-YI-AATIH
WA Z''AA'-FI H'UJAJIHEE FEE JAMEEI' TABIA'ATIH
FAAM-MAAA ANTA YAAA ILAAHEE FAAH-LUN AN 
LAA YAGH-TAR-RA BIKAS'-S'ID-DEEQOON
WA LAA YAY-ASA MINKAL-MUJ-RIMOON
LIAN-NAKAR-RAB-BUL-A'Z'EEMUL-LAD'EE 
LAA YAM-NAU' AH'ADANA FAZ''-LAH
WA LAA YAS-TAQ-S'EE MIN AH'ADIN H'AQ-QAH
TAA'ALAA D'IK-RUKA A'NIL-MAD'-KOOREEN
WA TAQAD-DASAT AS-MAAAW-UKA A'NIL-MANSOOBEEN
WA FASHAT NIA'-MATUKA FEE JAMEEI'L-MAKH-LWQEEN
FALAKAL-H'AM-DU A'LAA D'ALIKA YAA RAB-BAL-A'ALAMEEN"
335,38,40,"AL-LAAHUM-MA S'AL-LI A'LAA MUH'AM-MADIW-WA AAALIH
WAK-FINAA T'OOLAL-AMAL
WA QAS'-S'IR-HOO A'N-NAA BIS'ID-QIL-A'MAL
H'AT-TAA LAA NOO-AM-MILA 
IS-TIT-MAAMA SAAA'TIM-BAA'-DA SAAA'H
WA LAA AS-TEEFAAA-A YAW-MIM-BAA'-DA YAW-M
WA LAA AT-TIS'AALA NAFASIM-BINAFAS
WA LAA LUH'OOQA QADAMIM-BIQADAM
WA SAL-LIM-NAA MIN GHUROORIH
WA AAAMIN-NAA MIN SHUROORIH
WANS'IBIL-MAW-TA BAY-NA AY-DEENAA NAS'-BAA
WA LAA TAJ-A'L D'IK-RANAA LAHOO GHIB-BAA
WAJ-A'L-LANAA MIN S'AALIH'IL-AA'-MAALI A'MALANA 
NAS-TAB-T'I-U MAA'HUL-MAS'EERA ILAY-K
WA NAH'-RIS'U LAHOO A'LAA WASH-KIL-LAH'AAQI BIK H'AT-TAA YAKOONAL-MAW-T
MAA-NASANAAL-LAD'EE NAA-NASU BIH
WA MAA-LAFANAAL-LAD'EE NASH-TAAQU ILAY-H
WA H'AAAM-MATANAAL-LATEE NUH'IB-BUD-DUNOO-WA MIN-HAA
FAAD'AAA AW-RAT-TAHOO A'LAY-NAA WA ANZAL-TAHOO BINAA
FAAS-I'D-NAA BIHEE ZAAA-IRAA
WA AAANIS-NAA BIHEE QAADIMAA
WA LAA TUSH-QINAA BIZ''EEAAFATIH
WA LAA TUKH-ZINAA BIZEEAARATIH
WAJ-A'L-HOO BAABAM-MIN AB-WAABI MAGH-FIRATIK
WA MIF-TAAH'AM-MIM-MAFAATEEHEE RAH'-MATIK
AMIT-NAA
MUH-TADEENA GHAY-RA Z''AAAL-LEEN
T'AAA-IE'ENA GHAY-RA MUS-TAK-RIHEEN
TAAA-IBEENA GHAY-RA A'AS'EENA WA LAA MUS'IR-REEN
YAA Z''AAMINA JAZAAA-IL-MUH'-SINEEN
WA MUS-TAS'-LIH'A A'MALIL-MUF-SIDEEN"
336,38,41,"AL-LAAHUM-MA S'AL-LI A'LAA MUH'AM-MADIW-WA AAALIH
WA AF-RISH-NEE MIHAADA KARAAMATIK
WA AW-RID-NEE MASHAARIA' RAH'-MATIK
WA AH'-LIL-NEE BUH'-BOOH'ATA JAN-NATIK
WA LAA TASUM-NEE BIR-RAD-DI A'NK
WA LAA TAH'-RIM-NEE BIL-KHAY-BATI MINK
WA LAA TUQAAAS'-S'ANEE BIMAJ-TARAH'-T
WA LAA TUNAAQISH-NEE BIMAK-TASAB-T
WA LAA TUB-RIZ MAK-TOOMEE
WA LAA TAK-SHIF MAS-TOOREE
WA LAA TAH'-MIL A'LAA MEEZAANIL-INS'AAFI A'MALEE
WA LAA TUA'-LIN A'LAA U'YOONIL-MALAA KHABAREE
AKH-FI A'N-HUM MAA YAKOONU NASH-RUHOO A'LAY-YA A'ARAA
WAT'-WI A'N-HUM MAA YUL-H'IQUNEE I'NDAKA SHANAARAA
SHAR-RIF DARAJATEE BIRIZ''-WAANIK
WA AK-MIL KARAAMATEE BIGHUF-RAANIK
WA ANZ'IM-NEE FEEE AS'-H'AABIL-YAMEEN
WA WAJ-JIH-NEE FEE MASAALIKIL-AAAMINEEN
WAJ-A'L-NEE FEE FAW-JIL-FAAA-IZEEN
WAA'-MUR BEE MAJAALISAS'-S'AALIH'EEN
AAAMEENA RAB-BAL-A'ALAMEEN"
