ID,CATEGORY_ID,TRANS_ID,ENGLISH
1,1,1,"Allahoomma Salle Alaa Mohammadin Wa AaleMohammad.

Bismilla Hir Rahma Nir Rahim 

Allaahumma inni as-aloka bismeka bis-millahir rah'maanir rah'eem yaa d'al jaalale wal ikaraame yaa h'ayyo yaa qayyoomo yaa h'ayyo Laa ilaaha illa anta yaa huwa yaamanl laa ya'lamo maa huwa walaa kaifa huwa walaa aina huwa walaa h'aitho huwa illa huwa yaa d'al mulke wal malaakoote yad'al i'zzate wal jaba roote yaa maleku yaa qudoo so yaa salaamo yaa mo-mino yaa muhai meno yaa a'zeezo yaa jabbaaro yaa mutakab bero yaa khaaleqo yaa baareyo yaa musaw wero yaa mo feedo yaa mudab bero yaa shadeedo yaa mub deo' yaa moe'edo yaa mobee do yaa wadoodo yaa mah' moodo yaa ma' boo do yaa bae'edo yaa qareebo yaa mojee bo yaa raqeebo yaa h'aseebo yaa ba dee'o yaa rafee'o yaa manee'o yaa sa mee'o yaa a'leemo yaa h'aleemo yaa ka reemo yaa h'akeemo yaa qadeemo yaa a'liyyo yaa a'z'eemo yaa h'annaano yaa mannaano yaa day yaano yaa musta' aano yaa jaleelo yaa jameelo yaa wakeelo yaa kafeelo yaa mo qeelo yaa moneelo yaa nabeelo yaa da leelo yaa haadi yaa baadi yaa awwalo yaa aakhero yaa z'aahero yaa baa t'eno yaa qaaemo yaa daemo yaa a'a lemo yaa h'aa kemo yaa qaaz""i yaa a'adelo yaa faas'elo yaa waas'elo yaa t'aa hero yaa mut'ah hero yaa qaadero yaa muqtadero yaa kabeero yaa muta kabbero yaa waahe do yaa ah'ado yaa s'amado yaa manl lam yalid walam yoo lad walam yakullahu kufowan ah'adon Wa lam yakul lahu s'aahebaton walaa kaana maa'aho wa zeerun Walat takha d'a maa'aho mushee ran Wa lah'taaja ila z'aheerin wala kaa na maa'aho min ela ahin ghairoho Laa elaaha illa anta fata a'alaita a'amma yaqooluz' z'aalemoo na o'luwwan kabee ra Yaa a'liyyo yaa shaamekho yaa baa d'ekho yaa fattaa h'o yaa naffaah'o yaa murtaah'o yaa mofar rejo yaa naas'e ro yaa muntas'ero yaa mudreko yaa muhle ko yaa muntaqe mo yaa baa'etho yaa waaretho yaa t'aale bo yaa ghaalebo yaa manlla yafootohu haarebun yaa taw waabo yaa awwaabo yaa wah haabo yaa mosab bebal asbaa be yaa mofattehal abwaabe yaa man h'aitho maa do'eya ajaaba Ya t'ahooro yaa shakooro yaa a'foo-o yaa ghafooro yaa nooran noore yaa modabberal umoore yaa lat'eefo yaa khabeero yaa mojeero yaa monee ro yaa bas'eero yaa z'aheero yaa kabee ro yaa witro yaa fardo yaa abado yaa sanado yaa s'amado yaa kaafi yaa shaafi yaa waafi yaa moa'afi yaa mohsino yaa mujmelo yaa mun e'mo yaa mufz'elo yaa muta karremo yaa mutafar redo yaa man a'laa faqahara yaa man malaka faqadara yaa man bat'ana fa khabara yaa man o'beda fashakara yaa man u's'eya faghafara yaa man laa tah'weehil fekaro Wala yudrekoho bas'arun walaa yakhfa a'laihe atha run yaa raazeqal bashare yaa mukad dera kulle qadarin yaa a'aleyal makaani yaa shadeedal arkaa ne yaa mobaddelaz' z'amaane yaa qaa belal qurbane yaa d'al manne wal eh'saane Yad'al i'z zate wassult'aane yaa rah'eemo yaa rah'maano yaa man huwa kulla yaumin fee sha-nin yaa man laa yashghalohu shaanun a'n sha-nin yaa a'z'ee mash sha-ne yaa man howa bekulle makaa nin yaa saamea'al as'waate yaa mujee bad daa'a-waate yaa munjeh'at' t'alebaate yaa qaaz""eyal h'aa jaate yaa munzelal barakaate yaa raa h'emal a'baraate yaa mo qeelal a'tha raate yaa kaashefal koro-baate yaa waliy yal h'asanaate yaa raafea'd darajaate yaa mo-teyas so-laate yaa moh'yeyal amwaate yaa jaa mea'ash shataate yaa mut't'alea'n a'lan niyaate yaa raadda maaqad faata yaa man laa tash tabeho a'laihil as'waato yaa man laa tuz"" jerohul mas-alaato Walaa tagh shaahuz' z'olo-maato yaa nooral arz""e was samaa waate yaa saabe ghan nea'ame yaa daafea'n neqame yaa baarean na same yaa jaamea'l oma me yaa shaafiyas saqame yaa khaaleqal noore waz'z'olame Yad'al joode wal karame yaa man laa yat'a-o a'rshaho qadamun yaa ajwadal ajwadeena yaa akramal akrameena yaa asma-a's saamee'ena yaa abs'aran naa z'ereena yaa jaa ral mustajeereena yaa amaanal khaa efeena yaa z'ahral laa jeena yaa waliy-yal mo-meneena yaa gha yaathal mustaghe theena yaa ghaa yatat t'aa-lebeena yaa s'aah'eba kulle ghareebin yaa mo-nesa kulle wah'eedin yaa malja-a kulle t'areedin yaa ma-waa kulle shareedin yaa h'aafez'a kulle z""aaallatin yaa raah'emash shaykhil kabeere yaa raazeqat t'iflis' s'a-gheere yaa jaaberal a'z'mil kaseere yaa faakka kulle aseerin yaa mughneyal baaaesil faqeere yaa i's'matal khaaefil mustajeere yaa man lahut tadbeero wattaq deero yaa manil a'seero a'laihe sahlun yaseero yaa man laa yah'taajo elaa tafseerin yaa man howa a'laa kulle shayyin qadeerun yaa man howa be-kulle shayyin khabee run yaa man howa bekulle shayyin ba s'eerun yaa murselar reyah'e yaa faaleqal is'bah'e yaa baa' ethal arwah'e yad'al joode was samaah'e yaa man be yadehi kullo miftaah'in yaa saamea'a kulle s'awtin yaa saabeqa kulle fautin yaa muh'yeyaa kulle nafsin ba'dal maute yaa u'ddati fee shiddati yaa haa fez'i fee ghurbati yaa moonesi fee wah' dati yaa waliyyi fee ne'mati yaa kahfi h'eena toe'eenil mad'aa hebo wato sal-lemonil aqaarebo Wa yakhd'oloni kullo s'aahebin yaa i'maa da manlla i'maada lahu yaa sanada man laa sanada lahu yaa d'ukhra man laa d'ukhra lahu yaa h'irza man laa h'irza lahu yaa kahfa man laa kahfa lahu yaa kanza man laa kanza lahu yaa rukna man laa rukna lahu yaa gheyaatha man laa gheyaatha lahu yaa jaara man laa jaara lahu yaa jaareyal las'eeqa yaa rukneyal watheeqa yaa elaahi bittah'-qeeqe yaa rabbal baitil ateeqe yaa shafeeqo yaa rafeeqo Fukkani min h'alaqil maz""eeqe was'rif a'nni kulla hammin waghammin waz""ee qin Wakfeni sharra maala ot'ee qo wa a-i'nni a'laa maa ot'eeqo Yaraad da yoosofa a'laa ya'qoo ba yaa kaashefa z""urre ayyooba yaa ghaaferad' d'an-be dao'ouda yaa raafe a'a i'esabne marya ma wa munjeyahu min aedil yahoode yaa mujeeba nidaa-e yoonosa fiz' z'olomaa te yaa must'afea moosa bel kalemaate yaa man ghafara le aadama khat'ee-atahu wara faa'a idreesa makaa nan a'liyyan be rah' ma-tehi yaa man najaa nooh'an minal gharaqe yaa man ahlaka a'adanil oola wa thamooda famaa abqa Waqauma noo h'in min qablo inna hum kaanoo hum az'lama wa at'ghaa Wal mo-tafekate ahwa yaa man dam mara a'laa qaume loot'in Wadamdama a'laa qaume shuae'bin yaa manit ta khad'a ibraheema khaleelan yaa mainit takhad'a moosa kaleeman Wat-ta khad'a muh'am madan s'allaaho a'laihe wa aalehi wa a'laihim ajma'eena h'abee ban yaa mo-teya luqmaanal h'ik mata Wal waaheba lesu laimaana mul kan laa yambaghi le ah'a din min ba'dehe yaa man nas'ara d'al qarnaine a'lal moloo kil jabaaberate yaa man aa't'al khiz'ral h'ayaata Waradda le yooshaa' abne noo nish shamsa ba'da ghuroobeha yaa man rabat'a a'laa qalbe umme Moosa Wa ah's'ana farja maryamab nate i'm raana yaa man h'as's'ana yah'yabna zakariyya menad' d'anbe Wasakkana a'n moosal ghaz""aba yaa man bashshara zakariyya beyah'ya yaa man fadaa ismae'ela minad' d'abh'e bedi'bh'in a'z'eemin yaa man qabela qurbaana haabeela Wa ja'alal la'anata a'la qaa beela yaa hazemal ah'zaabe le muh'am madin s'allal-laaho a'laihe wa aalehi S'alle a'laa muh'am madin wa aale muh'ammadin wa a'la jameei'l mursa leena Wa malaa ekatekal muqar rabeena wa ahle t'aa'ateka ajmae'ena Wa as- aloka bekulle mas-alatin sa-laka beha ah'adun mimman raz""ee taa'nho Fa h'atamta lahu a'lal ijaabate yaa allaaho yaa allaaho yaa allaaho yaa rah' maano yaa rah'maa no yaa rah'maano yaa rah'eemo yaa rah'ee mo yaa rahee mo yaa d'al jalaale wal ekraame yaa d'al jalaale wal ekraame yaa d'al jalaale wal ekraame Behi behi behi behi behi behi behi As aloka bekullismin sam mai ta behi nafsaka aw anzal taho fee shayyin Min kotu beka awis ta-atharta behi fee i'lmil ghaibe i'nkdaka Wa-be ma-a'aqedil i'zze min a'rsheka wa be muntahar rah'mate min ketaabeka Wa-bema lau anna maa fil arz""e min shaja-ratin aqlaamun wal bah'ro yamuddoho min ba'dehi sab-a'to abh'orin maa na fedat kalemaa tullaahe in nallaaha a'zeezun h'akeemun Wa as-aloka be asmaaekal h'usna allati naa' attaha fee ketaa beka Faqulta walil laahil asmaaul h'us na fado'oho beha Wa-qulta udo'ooni asta jib lakum waqulta wa id'aa sa-laka i'baadi a'nni fa inni qareebun ojeebo daa'watad daa'i id'aa da'aane Wa qulta yaa i'baadeyal la d'eena asrafu a'laa anfosehim Laa taqnat'u min rah' matillaahe innal laaha yagh ferud' d'unooba jamee'an innahu howal ghafoorur rah'eemo Wa ana as aolaka yaa ilaahi wa ado'oaka yaa rabbe wa arjooka yaa sayyedi Wa at'maa'o fee ijaabati yaa maulaaya kamaa wa a'd tani Wa qad daa'aotoka kamaa amartani Faf a'l bi maa anta ahlohu yaa kareemo Wal h'am do lillahe rabbil a'a lameena Wa s'alal laaho a'laa muh'am madin wa aalehi ajmae'ena.
"
2,1,2,"Bismillahir rah' maa nir ra h'eem

Alla humma yaaman dala'a lisaanas' s'a baah'e be nut'qe ta ballojehi wasarrah'a qet'aa'l lailil muz'leme beghayaahebe talaj lojehi wa atqana s'un a'l falakid dawwaare fee maqaa deere tabarrojehi wa sha' sha'a z""eya-ash shaamse benoore ta ajjojehi 

yaaman dalla a'laa d'aatehi be d'aa tehi watanazzah a'n mujaanasate makh looqaatehi wajalla a'n mula amate kaifiy yaatehi yaa man qaro ba min khat'raatiz' z'unoone wa bao'da a'n lah'az'aatil oyoone wa a'lema bemaa kaana qabla ayn ya koo na yaa man arqa dani fee me haade am nehi wa amaanehi wa ayqaz'ani ilaa maa mana h'ani behi min menanehi wa eh' saanehi wa kaffa akuffas sooe a'nni beyadehi wa sult'aa nehi s'alle allaahumma a'lad daleele ilaika fil lailil alyale wal maa seke min asbaabeka beh'ablish sharafil at' wale wan naas'ei'l h'asabe fee d'arwatil kaahelil aa'bale wa thaabetil qadame a' laa zah'aaleefeha fiz zamanil awwale wa a'laa aalehil akh yaaril must'a fainal abraare waftah'ahe alla humma lanaa ma s'aaria's' s'abaah'e bemafaatehir rah' mate walfalaah'e wa albisni allaahumma min afz""ale khila-i'l hidaayate was' s'alaa h'e wagh rese alla humma be a'z' mateka fee shirbe janaani yanaa beea'l khoshoo-e' wa ajre allaahumma lehai bateka min amaa qi zafaraatid dumooe' wa addib alla humma nazaqal khurqe minni be azzim matil qunoo e' ilaahi inllam tabta denir rah' mato minka beh'usnit tau feeqe fa manis saa leko bi ilai ka fee waaz"" eh'it' t'a reeqe wa in aslamatni anaatoka le qaaedil amale walmunaa fama nil moqeelo a'tha raati min kabawaatil hawa wain khad'a lani nas'roka i'nda muh'aarabatin nafse wash shait'aa ne faqad wa kalani khid'laanoka ilaa h'aithun nas'abe wal h'irmaane ilaahi ataraa ni maaataitoka illa min h'aithul amaale ama'liqto beat'raafe h'ibaaleka illa h'eena ba'aadatni d'unoobi a'n daaril wes'aale fabesal mat'iy yatullati am tat'at nafsi min hawaha fawaa han laha lema saw walat laha z'unoo noha wamnaaha wata bban laha lejur ateha a'laa sayye deha wamaulyaha ilaahi qaraa'to baaba rah'mateka beyade rajaai waharabto ilaika laajean min fart'e ahwaai wa a'l laqto be at'rafe h'ibaa leka anaamela wala-i fas'fah'e 

allaahumma a'm ma kunto ajramtohu min zalali wa khat'aai wa aqleni min s'ar-a'ate redaai fa in naka sayyedi wa maulaaya wa mo'tamadi waraj aai wa anta ghaayato matloobi wa monaaya fee mun qalabi wamathwaaya ilaahi kaifa tat'rudo miskee nan iltajaa ilaika menad' d'unoo bi haa reban am kaifa to khayyebo mustar shedan qasa da ilaa janaa beka saae'yan am kaifa taruddo z'amaa nan warada ilaa h'eyaa z""eka shaareban kal la wa h'eyaaz""oka mutra-a'atun fee z""an kil mah'oole wabaa boka maftooh'un lit' t'alabe wal wughoole wa anta ghaayatul mas-oole wa nehaa yatul maamoole ilahi haad'ehi azim mato nafsi a'qaltoha be i'qaale masheey yate ka wa haad'ehi aa'baao d'unoobi da raatoha be a'fweka wa rah'mateka wa haad'ehi ahwaaeyal muz""illato wa kaltoha ilaa janaabe lut'feka waraa fateka faj-a'le alla humma s'abaah'i haa d'a naazelan a'layya be z""iyaail huda was salaamate fid deene waddunya wamasaai junnatan min kaidil aa'da waweqaa yatan min murdeyaatil hawa 

innaka qaadiron a'laa maa tashaao tootil mulka man tash aao wa tanzeu'l mul ka mimman tashaao wa toi'zzo man tas haao wa tod'illo man tashaao beyadekal khairo innaka a'laa kulle shayyin qadeer toolejul laila finnahaa re wa toolejun nahaa ra fil laile wa tukhrejul h'ayya minal mayyete wa tukhrejul mayyeta minal h'ayye wa tar zoqo man tashaao beghaire h'isaabin 

la ilaaha illa anta subh' aanaka allaahumma wa be h'amdeka man d'aa ya'refo qadraka falaa yakhafoka wa man d'a ya'lamo maa anta falaa yahaa boka allafta bequd ratekal firaqa wafalaqta belut' fekal falaqa wa anarta bekara meka dayaa jeyal ghasaqe wa an hartal meyaaha mi nas' s'ummis' s'ayaakhee de a'd'ban wa ujaajan wa anzalta minal mo' s'eraate maa thajjaa jan waja-a'lta sh sham sa wal qa mara lil bariy yate siraajan wahhaajan min ghaire an tumaa resa feemaabtada-ta behi loghoo ban walaa i'laajan faya- man tawah' h'ada bil i'zze walbaqaae wa qahara i'baadaho bilmaute wal fanaa-e s'alle a'laa muh'am madin wa aalehil atqeyaae was ma' nidaai was tajib dua'ai wa h'aqqeq befaz"" leka a'mali wara jaai yaa khaira man doe'ya lekashfiz"" z""ur re wal maamoole lekulle u'srin wa yusrin bekaa anzalto h'aajati falaa tarud dani min sannie mawaahebeka khaa eban yaa kareemo yaa kareemo yaa ka reemo be rah'mateka yaa arh'amar raah'e meen wa s'al lallaaho a'laa khaire khalqehi muh'amma din wa aalehi ajmaa' eena 

Then he should prostrate and say: ilaahi qalbee mah'joo bun wa nafsee ma' yoobunw wa a'qlee maghloobun wa ha waai ghaalebunw wa t'aa'ati qalee lun wa ma's'eyati kathee runw wa lisaani muqerrun bid'd'unoo be fakaifa h'eelati yaa sattaarul u'yoobe wa yaa a'llaamal gho yoobe wa yaa kaa shefal kuroobe ighfir d'unoobi kullaha be h'urmate muh'am madin wa aale mu h'ammadin yaa ghaf faaro yaa ghaffaaro yaa ghaffaaro be rah'ma teka yaa arh'amar raah'emeen
"
3,1,3,"Bismilla Hir Rahma Nir Rahim

Alla-Hooma Inni As'aloka Be-Rahmatekallati Vase'at Koolla Shai'in Wa Be-Qoo-vatekallati Qaharat Beha Koalla Shai'in Wa Khaza'a Laha Koalla Shai'in Wa Zalla Laha Kaalla Shai'in Wa Be-Jabaroatekal-lati Ghalabta Beha Koolla Shai'in Wa Be-'lzzatekal-Lati La Yaqaomo Laha Shai'oon Wa Be-'Azmatekal-Lati Mala.ta Koolla Shai' in Wa Be-Sooltanekal-lazi 'Ala Kaolla Shai'in Wa Be-Vaj-hekal-Baqi Ba'da Fanaa'e Koala Shai'in Wa Be-Asmaa'ekal-Iati Mala-at Arkana Kaalla Shai'in Be-Ilmekal-lazi Ahata Be-Kaolle Shai'inWo Be-Noore Vaj-hekal-Iazi Azaa'alahoo Kaalla Shai'in Ya Nooro Ya QooddoasoYa Av-valal-Av-valeena Ya Akhiral-Akhereena, Alla-Hoommaghfirle-yaz-zon-oobal-lati Tah-tekal-'Asam, Alla-Hoommaghfir-Leyaz-zonoobal-Iati Taghyyerool-Ne'ama. Alla-Hoommagh-firle-yaz-zonoobal-Lati Tahab-besad-doaa'a; Alla-Hoomaghfirle-yaz-zanaobal-lati Taqta' oor-Rajaa' a. Alla-Haomaghfirle-yaz-zonoobal-lati Tonaz-ze-Iooi-Balaa'a, Alla-Hoomaghfirli Koolla Zambin Az-nabto-hoo Wa Koolla Khati'atin Akh-ta-toha Alla-Hoonma Inni Ata-qarrabo Ilahika Be-Zikreka Vas-Tashfe'o

Beka Ila Nafseka Wa As'aloka Be-Joodeka Wa Karameka An Tood-Neyani Min Qoorbeka Wa An Tooze'ani Shookraka Wa An Toolhemani Zikraka, Allo-Hoomma Inni As'aloka So'ala Khaze'im Mootazol-Iil Khashe'im-Matazar-re'in An Toosa Mehani Wa Tarhamani Wa Taj'alni Be-Qismeka Raziyan Qane'an Wa Fee Jami'il-Ahvale Mootavaze'an, Alla-Hooma Wa As'aloka So'ala Manish-taddat Faqatahoo Wa Al1zala Beka 'Indash-Shadaa'ede Hajatahoo Wa 'Azoma Feema 'Indaka Raghba-toho,Alla-Hoomma 'Azoma Sooltanoka Wa 'Ala-Makanoka Wa Khafe-ya Makroka Wa Zahara Amroka Wa Ghalaba Qahroka Wa Jarat Qoodratoka Wa La Yoomkenool Firaro Min Hookoomateka, Alla-Hooma La Ajido Le-Zanoobi Ghaferaon Wa La Le-qabaa'ehi Sateran Wa La Le-Shaim Min 'Amalil Qabeehin Bil-Hoosne Moobaddelan Ghairaka Laa Ilaha Illa Anta Soobhanaka Wa Be-Hamdeka Zalamto Nafsee Wa Tajarrato Bejahli Wa Sakanto Ila Qadeeme Zikreka Lee Wa Minneka 'Alyya, Alla-Hoomma Mavlaya Kam Min Qabeehe Satarataho Wa Kam Min Fadehim Minal-Balaa'e Aqaltahoo Wa Kam Min 'Isarin Wa Kam Mim Makroohin Daf'atahoo Wa Kam Min Sanaa'in Jameelil-Jasto Ahlal-lahoo Nashratahoo, AJla-Hooma 'Azma Balaa'ee Wa Afrata Bi Soo'o Hali Wa Qasorat

Bi A'mali Wa Qa'adat Bi Aghlali Wa Habasani 'An Nafee Bo'do Amali Wa Khada 'Atanid-doonya Be-Ghorooreha Wa Nafsi Be-Kheyanateha Wa Matali Ya Syyedi Fa-As'aloka Be-Izzateka Al-Ia Yahjoba 'Anka Doaa'ee Soo'o 'Amali Wa Fe'ali Wa La Taf-zahni Be-Khafi-yo Mat-Tala'ta 'Alaihe Min Sirri Wa La Toajilni Bil-'Oqoobate 'Ala Ma 'Amiltohoo Fee Khalavati Min Soo'ay Faili Wa Isaa'a Wa Davame Tafreeti Wa Jahalati Wa Kasrate Shahvati Wa Ghafalati Wa Kin; AJJa-Hoomma Be-'lzzateka Lee Fil-Ahvaie Koolleha Ra'oofan Wa 'Alyya Fee Jamee'il-Omoore 'Atoofan Ilahi Wa Mavlaya Wa Rabbi Mal-Ii G hairoka As'aloka Kashafa Zorri Van-Nazara Fee Amree Ilahi Wa Mav-

laya Ajvaita 'Alyya Hookma Nit-taba.to Feehe Hava Nafsi Wa Lam Ahtaris Faehe Min Taz'eene 'Adoo-vee Fagharrani Be-Maa Ahva Wa As'adaho 'Ala Zalekal- Qazaa'o Fatajavazta Be-Ma Jara 'Alyya Min Zaleka Ba'za Hodoodeka Wa Khalofto Ba'za Avamireka Falakal-Hamdo 'Alyya Fee Jamge'ay Zaleka Wa La Hoojjata Lee Feema Jara 'Alyya Feehe Qazaa'oka Wa Alzamani Hookmoka Wa Balaa'oka Wa Qad Ataitoka Ya Illahi Ba'da Taqseeri Wa Israfi 'Ala Nafsee Mo'tazeran Nademam Maonkaseram MoostaqeeJam Moostaghferam Moneebam Moqirram Mooz'enam Mo'tarefal-la Ajedo Mafarram Mimma Kana Minni Wa La Mafza'an Atavaj-jahoo Illahe Fee Amri Ghaira

Qabooleka 'ozri Wa Idkhaleka Iyyaya Fee Sa'atim Mir-rahmateka. Alla-Hooma Faqbal 'Ozri Var-Ham Shiddata Zorri Wa Fokkani Min Shadde Va-Saqi Ya Rabbir-Ham Za'fa Badani Wa Riqqata Jildi Wa Diqqata 'Azmi Ya Mam Bada Khalqi Wa Zikri Wa Tarbeyati Wa Barri Wa Taghzeyati Habnj Lib-tedaa'ay Karameka Wa Salefe Barreka Bi Ya Ilahi Wa Svyedi Wa Rabbi Atoraka Mo'azzabi Be-Nareka Ba'da Tavheedeka Wa Ba'da Mantava 'Alajhe Qalbi Mim Ma'refateka Wa Laheja Behi Lesani Min Zikreka

Va'taqGdahoo Zameeri Min Hoobeka Wa Ba'da Sidqe Nav-terafi Wa Do'aaee Khaze'an Le-Roboo-bi-vateka Haihata Anta Akramo Min An Tozvve'a Mar-Rab-baitahoo Av-to-ba-'ldda Man Adnaitahoo AV Tosharreda Man Avab-baitahoo Av Toosal-lema Ilal-Bala'av Man Kafai-tahoo Wa Rahimtahoo Wa Laita Shairri Ya Syvadi Wa Ilahi Wa Mavlaya Atosal-litoonnara 'Ala Vajoohin Kharraf Le'azamateka Sajedatan Wa 'Ala

AI-sonin Nataqat Be- Tav-Heedeka Sadeqatan Wa Be-Shookreka Ma-dehatan Wa 'Ala Qoloobe Netarafat Be-Ilahi-yateka Mohaq-qeqatan Wa .Ala Zamaa'era Haval Minal 'lime Beka Hatta Sarat Khashe'atan Wa 'Ala Javareha Sa'at Ila Av-tane Ta'abbodeka Taa'e-atan

Wa Asharat Be-lstigh-fareka Mooz'anetan Ma Hakazalzanno Beka Wa La Okhbirna Be-Fazleka 'Anka Ya Karimo Ya Rabbe Wa Anta Ta'lamo Za'fi 'An Qaleelim Mim Balaa'id-doonya Wa 'Oqoobateha Wa Ma Yajri Feeha Minal-Makarehe 'Ala Ahleha 'Ala Anna Zaleka Balaa'oom Maqroohon Qaleeloom-Maksohoo Yaseeroon Baqaa'ohoo Qaseeroon Mood-datohoo Fa-Kaifa Ehtemali Le-Balaa'il-Akhirate Wa Jaleele Wa Qoo'il- Makarahe Feeha Wa Hova Balaa 'oon Ta'toolo Mooddatohoo Wa Yadoomo Maqamahoo Wa La Yokhaf-fafo 'An Ahlehe Le-Annahoo La Yakoona Ilia 'An Ghazabeka Van-teqameka Wa Sakhateka Wa Haza Ma La Taqoomo Lahoos-samavato Val-Arzo Ya Syyedi Fa-Kaifa Bi Wa Ana 'Abdokaz-za.eefooz-zaleelool-Haqeerool-Miskee-nool-Moostakeeno, Ya Illahi Wa Rabbi Wa Syyedi Wa Mavlaya Le-Iyyil-Omoore I1aika Ashkoo Wa Lama Minha

Azij-jo Wa Abkj Le-Aleemil 'Azabe Wa Shiddateh Av Le-toolil-Balaa.ay Wa Mood-datehi Fala'in Syyar-tani Fil-'Oqoobate Ma.a A.daa.eka Wa Jama'ta Bajni Wa Baina Ahle Balaa'eka Wa Farraqta Baini Wa Baina Ahib-baa'eka Fahbani, Ya Ilahi Wa Syyedi Wa Mavlaya Wa Rabbi Sabarto 'Ala 'Azabaka Fa-Kaifa Asbiro 'Ala Firaqeka Wa Habni

Sabarto 'Ala Harrenareka Fa-Kaifa Asbiro 'Anin-nazare Ila Karamateka Am Kaifa  skono Fin-nare Wa Rajaa'ee 'Afooka Fa-Be'lzzateka Ya Syyedi Wa Mavlaya Ooqsimo Sadeqal-Ia'in Taraktani Nateqal-Ia-Azze-janna Ilaika Baina Ahleha Zajeejal-Ameleena Wa La-asro khanna Ilaika Soorakhal-Moostasre-kheena Wa La-Abke-yanna 'Alaika Bookaa'al-Faqedeena Wa La 'Nade-yannaka Aina Koonta Ya Vali-yal Mo'meneena Ya Ghayate Amalil' Arefeena Ya Gheyasal-Moostaghee-seena Ya Habeeba Qoloobis-Sadeqeena Wa Ya Ilahal 'Alameena Afatoraka Soobhanaka Ya Ilahi Wa Be-Hamdeka Tasma'o Feeha Savta 'Abdim Mooslemin 'Soojena Feeha Be-Mokhalafatehi Wa Zaka Ta'ma 'Azabeha Be-Ma'si-yatehi Wa Hoobesa Baina Atmaqeha Be-Joprmehi Wa Jareerateha, Wa Hova Yoozij-jo Ilaika Zajeeja Mo'am-melin Le-Rehmateka Wa Yoonadeeka Be-Iesane Ahle Tavheedeka Wa Yatavas-salo Ilaika Be-Roboobi-yateka Ya Mavlaya Fa kaifa Yabqa Fil' Azabe Wa Hova Yarjoo Ma Salafa Hilmeka Wa Raf'ateka Wa Rahmateka Am Kaifa Too-Iemohoon-Naro Wa Hova Yamolo Fazlaka Wa Rahmateka Am Katfa Yoh-reqohoo

Lahabooha Wa Anta Tasma'o Savtahoo Wa Tara Maka-nahop Am Kaifa Yashtamelo 'Alaihe Zafeeroha Wa Anta Ta'lamo Za'fahoo Am Kaifa Yata-gha1-ghelo Baina

Atbaqeha Wa Anta Ta'lamo Sjdqahoo Am Kaifa Tazjo-rohoo Zabani-yatoha Wa Hova Yoonadeeka Ya Rabbahoo Am Kaifa Yarjoo Fazleka Fee 'Onoqehi Minha Fa-tat-rokohoo Feeha Haihata Ma Zalekazz-anno Beka Wa Lal-Ma'roofo Min Fazleka Wa La Mooshbehool-Lema 'Amalto Behil-Movahhedeena Mim Birreka Wa Ehsaneka Fa-bil-yaqeene Aqta'o Lav La Ma Hakamta Behi Min Ta'zeebe Jahedeeka Wa Qazaita Behi Min

Ekhlade Mo'anedeeka Laja'altan Nahara Koollaha Bar-davn Wa Salamavn Wa Ma Kanat Le-Ahadin Feeha Maqar-ravn Wa La Meqamal-la-Kinnaka Taqaddasat Asmaa'oka Aqsamta An Tamla-aha Minal-Kafereena Minal-Jinnate Vannase Ajma'eena Wa An Tookhal-lido Feehal-Mo'anedeena Wa Anta Jalla Sanaa'oka Qoolta Moo-btade'an Wa Ta-tavvalta Bil-In.ame Mootakarreman Afaman Kana Mo'menan Kaman Kana Faseqal-La

Yas-ta-oona Ilahi Wa Syyedi Fa-As'aloka Bil-Qoodratillati Qaddar- Taha Bil-Qazi-yatil-Iati Qaddar-Taha Wa Bil-Qazi-yatil-Iati Hatam-taha Wa Hakamtaha Wa Ghalabta Man    'Alaihe Ajraitaha An Tahaba Lee Fee Hazehil-Iai-Iate Wa Fee Hazehis-Sa'ate Koolla Joormin Ajramtohoo Wa Koolla Zambin Az-nab-tohoo Wa Koolla Qabeehin Asrar-tohoo Wa Koolla Jahlin 'Amil-tohoo Katam-tohoo Av A'lan-tohoo Akh-fal-tohoo Av Azhar-tohoo Wa Koolla Syye'atin Amarta Be-lsbaqehal-Kiramal-Katebeenal-lazeena Vak-kal-ta-hdom Be-Hifze Ma Yakoona Minni Wa Ja'alta-hoom Shohoodan 'Alyya Ma'a Javarehi Wa Koonta Antar-Raqeeba 'Alyya Min Varaa'ehim Vash-shaheda lema Khafe-ya 'An- hoom Wa Be-Rahmateka Akhfai-tahoo Wa Be-Fazleka Satar-tahoo Wa An Tavaffira Hazzi Min Koolle Khairin Toonzelohoo Av Ehsanin Toofzelohoo Av Birrin Tan-

shorohoo Av Rizqin Basat-taho Av Zambin Taghferohoo Av Khata'in Tastorohoo, Ya Rabbe, Ya Rabbe Ya Rabbe Ya Ilahi Wa Syyedi Wa Mavlaya Wa Maleka Riqqi Ya

Mam Be-Yadehi Nasi-yati Ya Aliman Be-Zorri Wa Maskalani Ya Khabiran Be-Faqri Wa Faqati, Ya Rabbe Ya Rabbe, Ya Rabbe As'aloka Be-Haqqeka Wa Qood-seka Wa A'zame Sifateka Wa Asmaa'eka An Taj'al Av-Qati Fil-Iaile Vau-Nahare Be-Zikreka Ma'mooratavn Wa Be-Khizmateka Mavsoo-latavn, Wa A'mali 'Indaks Maqboolatan- Hatta Takoona A'mali Wa Avradi Koollaha Virdavn Vahedan Wa Hali Fee Khid-mateka Sarmadan, Ya Syyedi, Ya Man 'Alaihe Mo'av-vali, Ya Man Ilaihe Shakavto Ahvali, Ya Rabbtl, Ya Rabbe, Ya Rabbe Qav-ve 'Ala Khid-mateka Javarehi Vash-dood 'Alal 'Azimate Javanehi Vahab Li-yal- jadde Fee Khash-yateka Vad-davame Fil-Itte-sale Be-Khid-mateka Hatta Asraha Ilaika Fee Maya-deenis-Sabeqeena Oosre'a Ilaika Fil Moobadereena Va3h-taqa lla aoorbeka Fil-Mooshtaqeena Wa Adnoova Minka Donov-val-Mookhleseena Wa Ahfaka Makhafatal-Mooqeneena Vaj-tama'a Fee Javareka Ma'al-Mo'meneena, Alla-Hoomma Wa Man Aradani Be-Soo'jn Fa-aridho Wa Man Kadani Fakjdha Vaj'alni Min Ahsane 'Ibadeka Naseeban 'Indaka Wa Aqra-Be-him Manzelatam Minka Wa Akhze-him Zaal-fatal-Iadajka Fa-Innahoo La-Yanalo Zaleka tlla Be-Fazleka Wa Jodani Be-Joodeka Va'tif 'Alyya Be-Maj-deka Vah-tizni Be-Rahmateka Vaj'al lasani Be-Zikreka Lahejan Wa Qalbi Be-Hoobbeka Mootamyyeman Wa Manna Be-Hoosne Ijabateka Wa Aqilni 'Asratj Vaghfirli Zallati Fa Innaka Fazaita 'Ala 'lbadeka Be-Ibadateka Wa Amarta-hoom Be-Doaa'eka Wa Zaminta lahomaal-Ijabata Fa-Ilaika Ya Rabbe Nasabta Vaj-heya Wa Ilaika Ya Rabbe Madad-to Yade-ya Fa-Be-'lzzatekas- Tajib lee Doaa'ee Wa Ballighni Moonaya Wa la Taq-Ta'Min Fazleka Rajaa'ee Ya Saree'oor-Reza Igh-fir lemal-La Yamlekood-doaa'a Fa-Innaka Fa.alool-lema Tashaa'o Ya Manis-mohoo Davaa'oon Wa Zikrohoa Shlfaa'aan Wa Ta'atohoo 'Ghenan Irham-Mar Rasa Malehir-Rajaa'o Wa Silaho-hool-Bookaa'o Ya Sabeghan-Ne'amay Ya Dafe'anneqamay Ya Nooral-Mastav-Heshgena Fiz-zolame Ya 'Alemal-la-Ya'lama Salle 'Alaa Mohammadin Wa Aale Mohammadin Vaf'al Bi Ma Anta Ahlohoo Wa Sal-Ial-Iaho 'Ala Rasoalehi Val-A'immatil Mayamgena Min Alehi Wa SalJam Tasleeman Kaseeran aseera:

Allahaomma Sal1e Alaa Mohammadin Wa Aale Mahammad
"
