ID,CATEGORY_ID,TRANS_ID,ENGLISH
43,2,1,"ASSALAAMO A'LAYKA YAA ABAA A'BDILLAAHE ASSALAAMO A'ALAYKA UABNA RASOOLILLAAHE ASSALAAMO A'LAYKA YABNA AMEERIL MOMINEENA WABNA SAYYEDIL WASIYYEENA ASSALAAMO A'LAYKA YABNA FAATEMAATA SAYYEDATE NESAAIL A'ALAMEENA ASSALAAMO A'LAYKA YAA KHEYARATALLAAHE WABNA KHEYARATEHI 

ASSALAAMO A'LAYKA YAA SAARALLAAHE WABNA SAAREHEE WAL WITRAL MAWTOORA ASSALAAMO A'LAYKA WA A'LAL ARWAAHIL LATEE HALLAT BE FENAA-EKA A'LAYKUM MINNEE JAMEE-A'N SALAAMUL LAAHE ABADAN MAA BAQEETO WA BAQEYAL LAYLO WAN NAHAARO YAA ABAA A'BDILLAAHE LAQAD A'ZOMATIR RAZIYYATO WA JALLAT WA A'ZOMATIL MOSEEBATO BEKA A'LAYNAA WA A'LAA JAMI'E AHLIL ISLAAME WA JALLAT WA A'ZOMAT MOSEEBATOKA FIS SAMAAWAATE A'LAA JAMEE-E' AHLIS SAMAAWAATE 

FA LA-A'NALLAAHO UMMATAN ASSASAT ASAASAZ ZULME WAL JAWRE A'LAYKUM AHLAL BAYTE WA LA-A'NALLAAHO UMMATAN DAFA-A'TKUM A'N MOQAAMEKUM WA AZAALATKUM A'N MARAATEBOKOMULLATEE RATTABAKOMULLAAHO FEEHAA WA LA-A'NALLAAHO UMMATAN QATALATKUM WA LA-A'NALLAAHUL MOMAH-HEDEENA LAHUM BIT TAMKEENE MIN QETAALEKUM WA BAREA-TO ILALLAAHE WA ILAYKUM MINHUM WA MIN ASHYAA-I'HIM WA ATBAA-E'HIM WA AWLEYAAEHIM YAA ABAA A'BDILLAAHE INNEE SILMUN LEMAN SAALAMAKUM WA HARBUN LEMAN HAARABAKUM ELAA YAWMIL QEYAAMATE 

WA LA-A'NALLAAHO AALA ZEYAADIN WA AALA MARWAANA WA LA-A'NALLAAHO BANEE UMAYYATA QAATEBATAN WA LA-A'NALLAAHUBNA MARJAANAT WA LA-A'NALLAAHO O'MARABNA SAA'DIN WA LA-A'NALLAAHO SHIMRAN WA LA-A'NALLAAHO UMMATAN ASRAJAT WA ALJAMAT WA TANAQQABAT LE QETAALEKA BE ABEE ANTA WA UMMEE LAQAD A'ZOMA MOSAABEE BEKA FA ASALULLAAHAL LAZEE AKRAMA MAQAAMAKA WA AKRAMANEE BEKA AN YARZOQANEE TALABA SAAREKA MA-A' EMAAMIN MANSOORIN MIN AHLE BAYTE MUHAMMADIN SALLALLAAHO A'LAYHE WA AALEHEE 

ALLAAHUMMAJA'LNEE I'NDAKA WA JEEHAN BIL HUSAYNE FID DUNYAA WAL AAAKHERATE YAA ABAA A'BDILLAAHE INNEE ATAQARRABO ELALLAAHE WA ELAA RASOOLEHEE WA ELAA AMEERIL MOMINEENA WA ELAA FAATEMATA WA ELAL HASANE WA ELAYKA BE MAWAALAATEKA WA BIL BARAA-ATE MIMMAN QAATALAKA WA NASABA LAKAL HARBA WA BIL BARAAA-ATE MIMMAN ASSASA ASAASAZ ZULME WAL JAWRE A'LAYKUM WA ABRAO ELALLAAHE WA ELAA RASOOLEHEE  MIMMAN ASSASA ASAASA ZAALEKA WA BANAA A'LAYHE BUNYAANAHU WA JARAA FEE ZULMEHEE WA JAWREHI A'LAYKUM WA A'LAA ASHYAA-E'KUM BARIA'TO ELALLAAHE WA ELAYKUM MINHUM WA ATAQARRABO ELALLAAHE SUMMA ELAYKUM BE MAWAALAATEKUM WA MOWAALAATE WALIYYEKUM WA BIL BARAAA-ATE MIN AA'-DAAA-EKUM WAN NAASEBEENA LAKOMUL HARBA WA BIL BARAAA-ATE MIN ASHYAA-I'HIM WA ATBAA-E'HIM 

INNEE SILMUN LEMAN SAALAMAKUM WA HARBUN LEMAN HAARABAKUM WA WALIYYUN LEMAN WAALAAKUM WA A'DUWWUN LEMAN A'ADAAKUM FA AS-ALULLAAHALLAZEE AKRAMANEE BE MAA'REFATEKUM WA MAA'REFATE AWLEYAAAEKUM WA RAZAQANIL BARAAA-ATA MIN AA'-DAAA-EKUM WA AN YAJ-A'LANEE MA-A'KUM FID DUNYAA WAL AAKHERATE WA AN YUSABBETA LEE I'NDAKUM QADAMA SIDQIN FID DUNYAA WAL AAKHERATE WA AS-ALOHOO AN YOBALLEGHANIL MAQAAMAL MAHMOODA LAKUM I'NDALLAAHE WA AN YARZOQANEE TALABA SAAREE MA-A' EMAAMIN HODAN ZAHERIN NAATEQIN BIL HAQQE MINKUM WA AS-ALULLAAHA BE-HAQQEKUM WA BISHSHAANIL LAZEE LAKUM I'NDAHU AN YOA'-TEYANEE BE MOSAABEE BEKUM AFZALA MAA YOA'-TEE MOSAABAN BE-MOSEEBATIN MOSEEBATAN MAA AA'-ZAMAHAA WA AA'-ZAMA RAZIYYATAHAA FIL ISLAAME WA FEE JAMEE-I'S SAMAAWAATE WAL ARZ 

ALLAAHUMMAJ-A'LNEE FEE MAQAAMEE HAAZAA MIMMAN TANAALOHU MINKA SALAWAATUN WA RAHMATUN WA MAGHFERATUN ALLAAHUMAJ-A'L MAHYAAYA MAHYAA MUHAMMADIN WA AALE MUHAMMADIN WA MAMAATEE MAMAATA MUHAMMADIN WA AALE MUHAMMADIN ALLAAHUMMA INNA HAAZAA YAWMUN TABARRAKAT BEHEE BANOO UMAYYATA WABNO AAKELATIL AKBAADIL LA-E'ENOBNUL LA-E'ENE A'LAA LESAANEKA WA LESAANE NABIYYEKA SALLALLAAHO A'LAYHE WA AALEHEE FEE KULLE MAWTENIN WA MAWQEFIN WAQAFA FEEHE NABIYYOKA SALLALLAAHO A'LAYHE WA AALEHEE

 ALLAAHUMMA AL-A'N ABAA SUFYAAN WA MO-A'AWEYATA WA YAZEEDABNA MO-A'AWIYATA A'LAYHIM MINKAL LAA'-NATO ABADAL AABEDEENA WA HAAZAA YAWMUN FAREHAT BEHEE AALO ZEYAADIN WA AALO MARWAANA BE-QATLEHOMUL HUSAYNA SALAWAATULLAAHE A'LAYHE ALLAAHUMMA FAZAA-I'F A'LAYHEMUL LAA'-NA MINKA WAL A'ZAABAL ALEEMA ALLAAHUMMA INNEE ATAQARRABO ELAYKA FEE HAAZAL YAWM WA FEE MAWQEFEE HAAZAA WA AYYAAME HAYAATEE BIL BARAAA-ATE MINHUM WAL LAA'-NATE A'LAYHIM WA BIL MOWAALAATE LE-NABIYYEKA WA AALE NABIYYEKA A'LAYHE WA A'LAYHEMUS SALAAMO 

Then again say 100 times: 

ALLAAHUMMAL-A'N AWWALA ZAALEMIN ZALAMA HAQQA MUHAMMADIN WA AALE MUHAMMADIN WA AAKHERA TAABE-I'N LAHU A'LAA ZAALEKA ALLAAHUMMAL-A'NIL E'SAABATAL LATEE JAAHADATIL HUSAYNA WA SHAAY-A'T WA BAAY-A'T WA TAABA-A'T A'LAA QATLEHEE ALLAHUMMAL-A'NHUM JAMEE-A'N

Then again say 100 times:

ASSALAAMO A'LAYKA YAA ABAA A'BDILLAAH WA A'LAL ARWAAHILLATEE HALLAT BEFENAA-EKA A'LAYKA MINNE SALAAMULLAAHE ABADAN MAA BAQEETO WA BAQEYAL LAYLO WAN NAHAARO WA LAA JA-A'LAHULLAAHO AAKHERAL A'HDE MINNEE LE-ZEYAARATEKUM ASSALAAMO A'LAL HUSAYNE WA A'LAA A'LIYYIBNIL HUSAYNE WA A'LAA AWLAADIL HUSAYNE WA A'LAA ASHAABIL HUSAYNE

 Then say:

ALLAAHUMMA KHUSSA ANTA AWWALA ZAALEMIN BIL-LAA'-NE MINNEE WABDAA BEHEE AWWALAN SUMMAS SAANEYA WAS SAALESA WAR RAABE-A' ALLAAHUMMAL-A'N YAZEEDA KHAAMESAN WAL-A'N O'BAYDALLAAHIBNA ZEYAADIN WABNA MARJAANAH WA O'MARABNA SAA'DIN WA SHIMRAN WA AALA ABEE SUFYAANA WA AALA ZEYAADIN WA AALA MARWAANA ELAA YAWMIL QEYAAMATE

 Then go is Sajdah and say:

ALLAAHUMMA LAKAL HAMDO HAMDASH SHAAKEREENA LAKA  A'LAA MOSAABEHIM ALHAMDO LILLAAHE A'LAA A'ZEEME RAZIYYATEE ALLAAHUMMAR-ZUQNEE SHAFAA-A'TAL HUSAYNE YAWMAL WOROODE WA SABBIT LEE QADAMA SIDQIN 'INDAKA MA-A'L HUSAYNE WA ASHAABIL HUSAYNIL LAZEENA BAZALOO MOHAJAHUM DOONAL HUSAYNE A'LAYHIS SALAAMO"
44,2,2,"ASSALAAMO A’LAA WALIYYILLAAHE WA HABEEBEHI..

ASSALAAMO A’LAA KHALEELILLAAHE WA NAJEEBEHI

ASSALAAMO A’LAA SAFIYYILLAAHE WABNA SAFIYYEHI

ASSALAAMO A’LAL HUSYANIL MAZLOOMISH SHAHEEDE

ASAAALAAMO A’LAA ASEERIL KOROBAATE WA QATEELIL A’BARAATE

ALLAAHUMMAA INNEE ASH-HADO ANNAHU WALIYYOKA WABNO

WALIYYEKA WA SAFIYYOKA WABNO SAFIYYEKAL…

FAAA-EZO BE-KARAAMATEKA AKRAMTAHU BISH SHAHAADATE WA

HABAWTAHU BIS SA-A’DATE WAJ-TABAYTAHU BE-TEEBIL

WELAADATE WA JA-A’LTAHU SAYYEDAN MENAS SAADATE WA

QAAA-EDAN MENAL QAADATE WA ZAAA-EDAN MINAZ ZAADATE WA

 AA’-TAYTAHU MAWAAREESUL AMBEYAAA-E WA JA-A’LTAHU

HUJJATAN A’LAA KHALQEKA MENAL AWSEYAAA-E FA-AA’-ZARA FID

DO-AAA-E WA MANAHAN NUSHA WA BAZALA MOHJATAHU FEEKA LE-

YASTANQEZA E’BAADEKA MENAL JAHAALATI WA HAYRATIZ

ZALAALATE WA QAD TAWAAZARA A’LAYHE MAN GHARRAT-HUD

DUNYAA WA BAA-A’ HAZZAHU BIL-ARZALIL ADNAA WA SHARAA

AAKHERATAHU BIS-SAMANIL AWKASE WA TA-GHAT-RASA WA…

TARADDAA FEE HAWAAHO WA ASKHATAKA WA ASKHATA NABIYYAKA

WA ATAA-A’ MIN E’BAADEKA AHLASH SHEQAAQE WAN NEFAAQE WA

HAMALATAL AWZAARIL MUSTAWJEBEENAN NAARA FA-JAAHADA

HUM FEEKA SAABERAN MOHTASEBAN HATTAA SOFEKA FEE TAA-

A’TEKA DAMOHU WASTOBEEHA HAREEMOHU ALLAAHUMMA FAL-

A’NHUM LA’-NAN WABEELAN WA A’ZZIBHUM A’ZAABAN ALEEMAN…

ASSALAAMO A’LAYKA YABNA RASOOLILLAAHE

ASSALAAMO A’LAYKA YABNA SAYYEDIL AWSEYAAA-E ASH-HADO

ANNAKA AMEENULLAAHE WABNO AMEENEHI I’SHTA SA-E’EDAN WA

MAZAYTA HAMEEDAN WA MUTTA FAQEEDAN MAZLOOMAN SHAHEEDAN ….

WA ASH-HADO ANNALLAAHA MUNJEZUN MAA WA-A’DAKA WA

MOHLEKUN MAN KHAZALAKA WA MO-A’ZZEBUN MAN QATALAKA WA

ASH-HADO ANNAKA WAFAYTA BE-A’HDILLAAHE WA JAAHADTA FEE

SABEELEHI HATTAA AATAYRKAL  YAQEENO FA-LA-A’NALLAAHO MAN

QATALAKA WA LA-A’NALLAAHO MAN ZALAMAKA WA LA-

A’NALLAAHO UMMATAN SAME-A’T BE-ZAALEKA FARAZEYAT BEHI ..

ALLAHUMA INNEE USH-HEDOKA ANNEE WALIYYUN LEMAN WALAAHO

WA A’DUWWUN LEMAN A’ADAAHO BE-ABEE ANTA WA UMMEE YABNA

RASOOLILLAAHE ASH-HADO ANNAAKA KUNTA NOORAN FIL ..

ASLAABISH SHAAMEKHATE WAL ARHAAMIL MOTAHHARATE LAM

TONAJJISKAL JAAHELIYYATO BE-ANJAASEHAA WA LAM TULBISKAL

MUDLAHIMMAATO MIN SEYAABEHAA WA ASH-HADO ANNAKA MIN DA-

A’AA-EMID DEENE WA ARKAANIL MUSLEMEENA WA MA’-QELIL MO-

MINEENA WA ASH-HADO ANNAKAL EMAAMUL BARRUT TAQQIYYUR

RAZIYYUZ ZAKIYYUL HAADIL MAHDIYYO WA ASH-HADO ANNAL A-

IMMATA MIN WULDEKA KALEMATUT TAQWAA WA AA’-LAAMUL

HODAA WAL U’RWATUL WUSQAA WAL HUJJATO A’LAA AHLID

DUNYAA WA ASH-HADO ANNEE BEKUM MO-MENUN WA BE-

EYAABEKUM MOOQENUN BE-SHARAA-YE-E’DEENEE WA

KHAWAATEEME A’MALEE WA QALBEE LE-QALBEKUM SILMUN WA

AMREE LE-AMREKUM MUTTABE-U’N WA NUSRATEE LAKUM MO-

A’DDATUN HATTAA YAAZANALLAAHO LUKUM FA-MA-A’KUM LAA MA-A’ A’DDUWWEKUM SALAWAATULLAAHE A’LAYKUM

WA A’LAA ARWAAHEKUM WA AJSAADEKUM WA SHAAHEDEKUM WA

GHAAA-EBEKUM WA ZAAHEREKUM WA BAATENEKUM AAMEENA

RABBAL A’ALAAMEENA …"
45,2,3,"ASSALAAMU A’LAYKA YAA WAARITHA AADAMA S’IFWATILLAAH ASSALAAMU A’LAYKA YAA WAARITHA NOOH’IN NABIYYILLAAH ASSALAAMU A’LAYKA YAA WAARITHA IBRAAHEEMA KHALEELILLAAH
ASSALAAMU A’LAYKUM YAA WAARITHA MOOSAA KALEEMILLAAH
ASSALAAMU A’LAYKA YAA WAARITHA E’ESAA ROOH’ILLAAH
ASSALAAMU A’LAYKA YAA WAARITHA MUH’AMMADIN H’ABEEBILLAAH
ASSALAAMU A’LAYKA YAA WAARITHA AMEERIL MOOMINEEN
ASSALAAMU A’LAYKA YAA WAARITHA FAAT’IMATAZ ZAHRAA
ASSALAAMU A’LAYKA YABNA MUH’AMMADINIL MUS’T’AFAA
ASSALAAMU A’LAYKA YABNA FAAT’IMATAZ ZAHRAA
ASSALAAMU A’LAYKA YABNA A’LIYYIL MURTAZ”AA
ASSALAAMU A’LAYKA YABNA KHADEEJATAL KUBRAA
ASSALAAMU A’LAYKA YAA THAARALLAAHI
WABNA THAARIHI
WAL WITRAL MAWTOOR

ASHHADU ANNAKA QAD AQAMTAS’ S’ALAATA WA AATAYTAZ ZAKAATA
WA AMARTA BIL MAA’-ROOFI WA NAHAYTA A’NIL MUNKAR
WA AT’AA’-TALLAAHA H’ATTAA ATAAKAL YAQEEN FALA-A’NALLAAHU UMMATAN QATALATKA WA LA-A’NALLAAHU UMMATAN Z’ALAMATKA WA LA-A’NALLAAHU UMMATAN SAMI-A’T BID’AALIKA FARAZ”IYAT BIHI YAA MAWLAAYA YAA ABAA A’BDILLAAH USH-HIDULLAAHA WA MALAAA-IKATAHU WA AMBIYAAA-AHU WA RUSULAHU ANNEE BIKUM MOOMINUN WA BI-IYAA BIKUM MOOQINUN BISHARAAYI-I’DEENEE WA KHAWAATEEMI A’MALEE WA MUNQALABEE ILAA RABBEE

FAS’ALAWAATULLAAHI A’LAA ARWAAH’IKUM WA A’LAA AJSAADIKUM WA A’LAA SHAAHIDIKUM WA A’LAA GHAAA-IBIKIM WA Z’AAHIRIKUM WA BAAT’INIKUM ASSALAAMU A’LAYKA YABNA KHAATIMIN NABIYYEEN WABNA SAYYIDIL WAS’IYYEEN WABNA IMAAMIL MUTTAQEEN WABNA QAAA-IDIL GHURRIL MUH’AJJALEENA ILAA JANNAATIN NA-E’EM

WA KAYFA LAA TAKOOONU KAD’AALIKA WA ANTA BAABUL HUDAA WA IMAAMUT TUQAA WAL U’RWATUL WUTHQAA WAL H’UJJATU A’LAA AHLID DUNYAA WA KHAAMISU AS’H’AABIL KISAAA GHAD’ATKA YADUR RAH’MATI WA RUZ”IA’-TA MIN THADYIL EEMAAN WA RUBBEETA FEE H’IJRIL ISLAAM FAN NAFSU GHAYRU RAAZ”IYATIN BIFIRAAQIKA WA LAA SHAAAKKATIN FEE H’AYAATIKA S’ALAWAATULLAAHI A’LAYKA WA A’LAA AABAAA-IKA WA ABNAAA-IKA ASSALAAMU A’LAYKA YAA S’AREE-A’L A’BRATIS SAAKIBATI WA QAREENAL MUS’EEBATIR RAATIBAH LA-A’NALLAAHU UMMATANAS-TAH’ALLAT MINKAL MAH’AARIM FAQUTILTA S’ALLALLAAHU A’LAYKA MAQHOORAN WA AS’BAH’A RASOOLULLAAHI S’ALLALLAAHU A’LAYHI WA AALIHI BIKA MAWTOORAN WA AS’BAH’A KITAABULLAAHI BIFAQDIKA MAHJOORAA ASSALAAMU A’LAYKA WA A’LAA JADDIKA WA ABEEKA WA UMMIKA WA AKHEEKA WA A’LAL A-IMMATI MIN BANEEKA WA A’LAA MUSTASHHADEENA MA-A’KA WA A’LAL MALAAA-IKATIL H’AAAFFEENA BIQABRIKA WASH SHAAHIDEENA LIZUWWAARIKAL MOOMINEENA BILQABOOLI A’LAA DU-A’AAA-I SHEE-A’TIKA WASSALAAMU A’LAYKA WA RAH’MATULLAAHI WA BARAKAATUH BI-ABEE ANTA WA UMMEE YABNA RASOOLILLAAH

BI-ABEE ANTA WA UMMEE YAA ABAA A’BDILLAAH LAQAD A’Z’UMATIR RAZIYYATU WA JALLATIL MUS’EEBATU BIKA A’LAYNAA WA A’LAA JAMEE-I’AHLIS SAMAAWAATI WAL ARZ” FALA-A’NALLAAHU UMMATAN ASRAJAT WA AL-JAMAT WA TAHAYYA-AT LIQITAALIKA YAA MAWLAAYA YAA ABAA A’BDILLAAH QAS’ADTU H’ARAMAKA WA ATAYTU MASHHADAKA

AS-ALULLAAHA BISH SHAANIL LAD’EE LAKA I’NDAHU WA BIL MAH’ALLILLAD’EE LAKA LADAYHI AN YUS’ALLIYA A’LAA MUH’AMMADIN WA AALI MUH’AMMAD WA AN YAJ-A’LANEE MA-A’KUM FID DUNYAA WAL AAKHIRATI BIMANNIHI WA JOODIHI WA KARAMINI"
46,2,4,"SALAAMUN A'LAA AALE YAASEEN
ASSALAAMO A'LAYKA YAA DAA-E'YALLAAHE WA RABBAANIYYA AAYAATEHI
ASSALAAMO A'LAYKA YAA BAABALLAAHE WA DAYYAANA DEENEHI
ASSALAAMO A'LAYKA YAA KHALEEFATALLAAHE WA NAASERA HAQQEHI
ASSALAAMO A'LAYKA YAA HUJJATALLAAHE WA DALEELA ERAADATEHI
ASSALAAMO A'LAYKA YAA TAALEYA KETAABILLAAHE WA TARJOMAANEHI
ASSALAAMO A'LAYKA FEE AANAAA-E LAYLEKA WA ATRAAFE NAHAAREKA
ASSALAAMO A'LAYKA YAA BAQIYYATALLAAHE FEE ARZEHI
ASSALAAMO A'LAYKA YAA MEESAAQALLAAHIL LAZEE AKHAZAHU WA WAKKADAHU
ASSALAAMO A'LAYKA YAA WA'DALLAAHIL LAZEE ZAMENAHU
ASSALAAMO A'LAYKA AYYOHAL A'LAMUL MANSOOBO
WAL I'LMUL MASBOOBO WAL GHAWSO
WAR RAHMATUL WAASE-A'TO
WA'DAN GHAYRA MAKZOOBIN
ASSALAAMO A'LAYKA HEENA TAQOOMO
ASSALAAMO A'LAYKA HEENA TAQ-O'DO
ASSALAAMO A'LAYKA HEENA TAQRA-O WA TOBAYYENO
ASSALAAMO A'LAYKA HEENA TOSALLEE WA TAQNOTO
ASSALAAMO A'LAYKA HEENA TAR-KA-O' WA TASJODO
ASSALAAMO A'LAYKA HEENA TOHALLELO WA TOKABBERO
ASSALAAMO A'LAYKA HEENA TAHMADO WA TASTAGH-FERO
ASSALAAMO A'LAYKA HEENA TUSBEHO WA TUMSEE
ASSALAAMO A'LAYKA FIL LAYLE EZAA TAGH-SHAA
WAN NAHAARE EZAA TAJALLAA
ASSALAAMO A'LAYKA AYYOHAL EMAAMUL MAAMOONO
ASSALAAMO A'LAYKA AYYOHAL MOQADDAMUL MAAMOOLO
ASSALAAMO A'LAYKA BE-JAWAAME-I'S SALAAME
USH-HEDOKA YAA MAWLAAYA ANNEE
ASH-HADO AN LAA ELAAHA ILLALLAAHO WAHDAHU LAA SHAREEKA LAHU
WA ANNA MOHAMMADAN A'BDOHU WA RASOOLOHU
LAA HABEEBA ILLAA HOWA WA AHLOHU
WA USH-HEDOKA YAA MAWLAAYA ANNA A'LIYYAN AMEERAL MOMINEENA HUJJATOHU
WAL HASANA HUJJATOHU WAL HUSAYNA HUJJATOHU
WA A'LIYYABNAL HUSAYNE HUJJATOHU
WA MOHAMMADABNA A'LIYYIN HUJJATOHU
WA JA'FARABNA MOHAMMADIN HUJJATOHU
WA MOOSABNA JA'FARIN HUJJATOHU
WA A'LIYYIBNA MOOSAA HUJJATOHU
WA MOHAMMADABNA A'LIYYIN HUJJATOHU
WA A'LIYYABNA MOHAMMADIN HUJJATOHU
WAL HASANABNA A'LIYYIN HUJJATOHU
WA ASH-HADO ANNAKA HUJJATULLAAHE
ANTOMUL AWWALO WAL AAKHERO
WA ANNA RAJ-A'TAKUM HAQQUN LAA RAYBA FEEHAA
YAWMA LAA YANFA-O' NAFSAN EEMAANOHAA LAM TAKUN AAMANAT MIN QABLO
AW KASABAT FEE EEMAANEHAA KHAYRAN WA ANNAL MAWTA HAQQUN
WA ANNA NAAKERAN WA NAKEERAN HAQQUN
WA ASH-HADO ANNAN NASHRA HAQQUN WAL BA'SA HAQQUN
WA ANNAS SERAATA HAQQUN WAL MIRSAADA HAQQUN
WAL MEEZAANA HAQQUN WAL HASHRA HAQQUN
WAL HESAABA HAQQUN WAL JANNATA HAQQUN
WAN NAARA HAQQUN WAL WA'DA WAL WA-E'EDA BEHEMAA HAQQUN
YAA MAWLAAYA SHA-QEYA MAN KHAALAFAKUM WA SA-E'DA MAN A-TAA-A'KUM
FASH-HAD A'LAA MAA ASH-HADTOKA A'LAYHE
WA ANAA WALIYYUN LAKA BAREE-UN MIN A'DUWWEKUM
FAL HAQQO MAA RAZEETOMOOHO WAL BAATELO MAA ASKHAT-TOMOOHO
WAL MA'ROOFO MAA AMARTUM BEHI WAL MUNKARO MAA NAHAYTUM A'NHO
FA NAFSEE MOA-MENATAN BILLAAHE WAHDAHU LAA SHAREEKA LAHU
WA BE RASOOLEHI WA BE AMEERIL MOMINEENA WA BEKUM YAA MAWLAAYA
AWWALEKUM WA AAKHEREKUM WA NUSRATEE MO-A'DDATAN LAKUM
WA MAWADDEE KHAALESATAN LAKUM AAMEENA AAMEENA"
47,2,5,"ASSALAAMO A’LAYKA YABNA RASOOLILLAAHE 

ASSALAAMO A’LAYKA YABNA AMEERIL MOMINEENA

ASSALAAMO A’LAYKA YABNAS SIDDEEQATIT TAAHERATE 

FAATEMATA SAYYEDATE NESAAA-IL A’ALAMEENA…

ASSALAAMO A’LAYKA YAA MAWLAAYA YAA ABAA A’BDILLAAHE WA 

RAHMATULLAAHE WA BARAKAATOHU ASH-HADO ANNAKA QAD 

AQAMTAS SALAATA WA AATAYTAZ ZAKAATA WA AMARTA BIL 

MA’-ROOFE WA NAHAYTA A’NIL MUNKARE WA TALAWTAL KETAABE 

HAQQA TELAAWATEHI WA JAAHADTA FILLAAHE HAQQA 

JEHAADEHI WA  SABARTA A’LAL AZAA FEE JANBEHI MOHTASEBAN 

HATTAA ATAAKAL YAQEENO ASH-HADU ANNALLAZEENA  

KHAALAFOOKA WA HAARABOOKA WALLAZEENA… 

KHAZALOOKA WALLAZEENA QATALOOKA MAL-O’ONOONA A’LAA 

LESAANIN NABIYYIL UMMIYE WA QAD KHAABA MANIF-TARAA

LA-A’NALLAAHUZ ZAALEMEENA LAKUM MENAL AWWALEENA

WAL AAKHEREEN WA ZAA-A’FA A’LAYHEMUL A’ZAABAL ALEEMA 

ATAYTOKA YAA MAWLAAYA YABNA RASOOLILLAAHE ZAA-ERAN 

A’AREFAN BEHAQQEKA MOWAALEYAN LE-AWLEYAAA-EKA 

MO-A’ADEYAN LE-AA’-DAAA-EKA MUSTABSERAN BIL HODAL LAZEE 

ANTA A’LAYHE A’AREFAN BE ZALAALATE MAN KHAALAFAKA 

FASHFA’LEE I’NDARABBEKA "
48,2,7,"ASSALAAMU A’LAYKA YABNA RASOOLILLAAH

ASSALAAMU A’LAYKA YABNA KHAATIMIN NABIYYEEN 

ASSALAAMU A’LAYKA YABNA SAYYIDIL MURSALEEN 

ASSALAAMU A’LAYKA YABNA SAYYIDIL WAS’IYYEEN

ASSALAAMU A’LAYKA YAA ABAA A’BDILLAAH 

ASSALAAMU A’LAYKA YAA H’USAYNABNA A’LIYY

ASSALAAMU A’LAYKA YABNA FAAT’IMATA SAYYIDATI NISAAA-IL A’ALAMEEN 

ASSALAAMU A’LAYKA YAA WALIYYALLAAH WABNA WALIYYIHI

ASSALAAMU A’LAYKA YAA S’AFIYYAALLAAH WABNA S’AFIYYIHI 

ASSALAAMU A’LAYKA YAA H’UJJATALLAAH WABNA H’UJJAATIHI

ASSALAAMU A’LAYKA YAA H’BEEBALLAAH WABNA H’ABEEBIHI 

ASSALAAMU A’LAYKA YAA SAFEERALLAAH WABNA SAFEERIHI 

ASSALAAMU A’LAYKA YAA KHAAZINAL KITAABIL MAST’OOR

ASSALAAMU A’LAYKA YAA WAARITHAT TAWRAATI WAL INJEEL WAZ ZABOOR 

ASSALAAMU A’LAYKA YAA AMEENAR RAH’MAN

ASSALAAMU A’LAYKA YAA SHAREEKAL QUR-AAN 

ASSALAAMU A’LAYKA YAA A’MOODAD DEEN 

ASSALAAMU A’LAYKA YAA BAABA H’IKMATA RABBIL A’ALAMEEN 

ASSALAAMU A’LAYKA YAA BAABA H’IT’T’ATIL-LAD’EE MAN DAKHALAHU KAANA MINAL AAMINEEN 

ASSALAAMU A’LAYKA TAA A’YBATA I’LMILLAAH

ASSALAAMU A’LAYKA YAA MAWZ”I-A” SIRRILLAAH

ASSALAAMU A’LAYKA YAA THARALLAAH WABNA THAARIHI WAL WITRAL MAWTOOR 

ASSALAAMU A’LAYKA WA A’LAL ARWAAH’ILLATEE H’ALLAT BIFINAAA-IKA WA ANAAKHAT BIRAH’LIKABI-ABEE ANTA WA UMMEE WA NAFSEE YAA ABAA 

A’BDILLAAH LAQAD A’ZUMATIL MUS’EEBATU WA 

JALLATIR RAZIYYATU BIKA A’LAYNAA WA A’LAA JAMEE-I’AHLIL ISLAAM FALA-A’NALLAAHU UMMATAN ASSASAT ASAASAZ’ Z’ULMI WAL JAWRI 

A’LAYKUM AHLAL BAYT WA LA-A’NALLAAHU UMMATAN DAFA-A’TKUM A’N MAQAAMIKA WA AZAALATKUM A’N MARAATIBIKUMUL LATEE RATTABAKUMULLAAHU 

FEEHAA BI-ABEE ANTA WA UMEE WA NAFSEE YAA ABAA A’BDILLAAH ASH-HADU LAQADIQ-SHA-A’RAAT LIDIMAAA-IKUM AZ’ILLATUL A’RSHI MA-A’ AZ’ILLATIL KHALAAA-IQ WA BAKATKUMUS SAMAAA-U WAL ARZ”U WA SUKKAANUL JINAANI WAL BARRI WAL BAH’R S’ALLALLAAHU A’LAYKA A’DADA MAA FEE I’LMILLAAH LABBAYKA DAA-I’YALLAAH IN KAANA LAM YUJIBKA BADANEE I’NDAS-TIGHAATHATIKA WA LISAANEE I’NDAS-TINS’AARIKA FAQAD AJAABAKA QALBEE WA SAM-E’E WA BAS’AREE SUBH’AANA RABBINAA IN KAANA WAA’-DU RABBINAA LAMAF-O’OLAN ASH-HADU ANNAKA TUHRUN T’AAHIRUN MUT’AHHARUN MIN T’UHRIN T’AAHIRIN MUT’AHHARIN T’AHURTA WA 

T’AHURAT BIKAL BILLADU WA T’AHURAT ARZ”UN ANTA BIHAA WA T’AHURA H’ARAMUKA ASH-HADU ANNAKA QAD AMARTA BIL QIST’I WAL A’DL WA DA-A’WTA ILAYHIMAA WA ANNAKA S’AADIQUN S’IDDEEQ SADAQTA FEEMAA DA-A’WTA ILAYHI WA ANNAKA THAARULLAAHI FIL ARZ” WA ASHHADU ANNAKA QAD BALLAGHTA A’NILLAAHI WA A’N JADDIKA RASOOLILLAAH WA A’N ABEEKA AMEERIL MOOMINEEN WA A’N AKHEEKAL H’ASAN WA NAS’AH’TA WA JAAHADTA FEE SABEELILLAAH WA A’BADTAHU MUKHLIS’AN H’ATTAA ATAAKAL YAQEEN 

FAJAZAAKALLAAHU KHAYRA JAZAAA-IS SAABIQEEN WA S’ALLAALLAAHU A’LAYKA WA SALLAMA TASLEEMAA  

ALLAAHUMMA S’ALLI A’LAA MUH’AMMADIN WA AALI MUH’AMMAD WA S’ALLI A’LAL H’USAYNIL MAZ’LOOMISH SHAHEEDIR RASHEED QATEELIL A’BARAATI WA ASEERIL KURUBAAT S’ALAATAN NAAMIYATAN ZAAKIYATAN MUBAARAKATAN YAS’-A’DU AWWALUHAA WA LAA YANFADU AAKHIRUHAA AFZ”ALA MAA S’ALLAYTA A’LAA AH’ADIN MIN AWLAADI AMBIYAAAA-IKAL MURSALEEN YA ILAAHAL A’ALAMEEN "
49,2,9,"ASSALAAMU A’LAYKA YA WAARITHA AADAMA S’IFWATILLAAH  

ASSALAAMU A’LAYKA YAA WAARITHA NOOH’IN NABIYYILLAAH  

ASSALAAMU A’LAYKA YAA WAARITHA IBRAAHEEM KHALEELILLAH  

ASSALAAMU A’LAYKA YAA WAARITHA MOOSA KALEEMILLAAH  

ASSALAAMU A’LAYKA YAA WAARITHA E’ESAA ROOH’ILLAAH  

ASSALAAMU A’LAYKA YAA WAARITHA MUH’AMMADIN H’ABEEBILLAAH  

ASSALAAMU A’LAYKA YAA WAARITHA A’LIYYIN AMEERIL MOOMINEENA WALIYYILLAH  

ASSALAAMU A’LAYKA YAA WAARITHAL H’ASANISH SHAHEEDI SIBT’I RASOOLILLAAH  

ASSALAAMU A’LAYKA YABNA RASOOLILLAAH 

ASAALAAMU A’LAYKA YABNA BASHEERIN NAD’EERI WABNA SAYYIDIL WAS’IYYEN  

ASSALAAMU A’LAYKA YABNA FAAT’IMATA SAYYIDATE NISAAA-IL A’ALAMEEN 

 ASSALAAMU A’LAYKA YAA ABAA A’BDILLAAH  

ASSALAAMU A’LAYKA YAA KHIYARATALLAAH WABNA KHIYARATIHEE  

ASSALAAMU A’LAYKA YAA THAARALLAAH WABNA THAARIHEE

 ASSALAAMU A’LAYKA AYYUHAL WITRUL MAWTOOR  

ASSALAAMU A’LAYKA AYYUHAL IMAAMUL HAADIZ ZAKIYY WA A’LAA ARWAAH’IN H’ALLAT BIFINAAA-IKA WA AQAAMAT FEE J WAARIKA WA WAFADAT MA-A ZUWWAARIKA 

 ASSALAAMU A’LAYKA MINNE MAA BAQEETU WA BAQIYAL LAYLU WAN NAHAAR  

FA-LAQAD A’ZUMAT BIKAR RAZIYYATU WA JALLAL MUS’AABU FIL MOO-MINEENA WAL MUSLIMEENA WA FEE AH-LIS SAMAAWAATI AJMA-E’ENA WA FEE SUK'KAANIL ARZ”EENA  

FA-INNAA LILLAAHI WA INNAA ILAYHI RAAJI-O’ON WA S’ALAWAATULLAAHI WA BARAKAATUH WA TAH’IYYAATUHU A’LAYKA WA A’LAA AABAAA-IKAT’ T’AAHIREENAT’ T’AYYIBEENAL MUNTAJABEEN WA A’LAA D’ARAAREEHIMUL HUDAATIL MAHDIYYEEN  

ASSALAAMU A’LAYKA YAA MAWLAAYA WA A’LAYHIM WA A’LAA ROOH’IKA WA A’LAA ARWAAH’IM WA A’LAA TURBATIKA WA A’LAA TURBATIHIM  

ALLAAHUMMA LAQQIHIM RAH’MATAN WA RIZ”WAANAN WA RAWH’AN WA RAYHAANAN  

ASSALAAMU A’LAYKA YAA MAWLAAYA YAA ABAA A’BDILLAAH YABNA KHAATAMIN NABIYEENA WA YABNA SAYYIDIL WAS’IYYEENA WA YABNA SAYYIDATE NISAAA-IL A’ALAMEEN  

ASSALAAMU A’LAYKA YAA SHAHEED YABNASH SHAHEED YAA AKHASH SHAHEED YAA ABASH SHUHADAAA-I  

ALLAAHUMMA BALLIGH-HU A’NNEE FEE HAAD’I-HIS SAA-A’TI WA FEE HAAD’AL YAWMI WA FIL WAQTI WA FEE KULLI WAQTIN TAH’IYYATAN KATHEERATAN WA SALAAMAA 

 SALAAMULLAAHI A’LAYKA WA RAH’MATULLAAHI WA BARAKAATUH  

YABNA SAYYIDIL A’ALAMEEN WA A’LAL MUSTASH-HADEENA 

MA –A’KA SALAAMAN MUTTAS’ILAN MAT-TAS’ALAL LAYLU WAN NAHAAR

 ASSALAAMU A’LAL H’USAYNIBNI A’LIYYISH SHAHEED  

ASSALAAMU A’LAA A’LIYYIBNIL H’USAYNISH SHAHEED  

ASSALAAMU A’LAL A’BBAASIBNI AMEERIL MOO-MINEENASH SHAHEED  

ASSALAAMU A’LASH SHUHADAAA-I MIN WULDI AMEERIL MOO-MINEEN  

ASSALAAMU A’LASH SHUHADAAA-I MIN WULDIL H’ASAN 

 ASSALAAMU A’LASH SHUHADAAA-I MIN WULDIL HUSAYN  

ASSALAAMU A’LASH SHUHADAAA-I MIN WULDI  JAA’-FAR WA A’QEEL  

ASSALAAMU A’LAA KULLI MUTASH-HADIN MA-A’HUM MINAL MOO-MINEEN 

 

ALLHUMMA S’ALLI A’LAA MUH’AMMADIN WA AALI MUH’AMMAD  

WA BALLIGH-HUM A’NNEE TAH’IYYATAN KATHEERATAN WA SALAAMAA  

ASSALAAMU A’LAYKA YAA RASOOLALLAAH AH’SANALLAAHU LAKAL A’ZAAA-A FEE WALADIKAL H’USAYN  

ASSALAAMU A’LAYKI YAA FATIMAH AH’SAANALLAAHU LAKIL A’ZAAA-A FEE WALADIKIL H’USAYN  

ASSALAAMU A’LAYKA YAA AMEERAL MOO-MINEEN  AH’SANALLAAHU LAKAL A’ZAAA-A FEE WALADIKAL H’USAYN  

ASSALAAMU A’LAYKA YAA ABAA MUH’AMMADIL H’ASAN AH’SANALLAAHU LAKAL A’ZAAA-A FEE AKHEEKAL H’USAYN  

YAA MAWLAAYA YAA ABAA A’BDILLAAH ANAA Z”AYFULLAAHI WA Z”AYFUKA

 WA JAARULLAAHI WA JAARUKA WA LI-KULLI Z”AYFIN WA JAARIN 

WA QIRAAYA FEE HAAD’AL WAQTI AN TAS-ALALLAAHA SUBH’AANAHOO WA TA-A’ALAA AN YARZUQNEE FAKAAKA RAQABATEE MINAN NAAR  

INNAHOO SAMEE-U’D DU-A’AA-I QAREEBUN MUJEEB ….."
50,2,11,"alhamdu lillahi al`aliyy al`azimi

wa alssalamu `alayka ayyuha al`abdu alSSalihu alzzakiyy

udi`uka shahadatan minny laka tuqarribuny ilayka fi yawmi shafa`atika

ash-hadu annaka qutilta wa lam tamut

bal biraja‘i hayatika hayiyat qulubu shi`atika

wa biziya‘i nurika ahtada alttalibuna ilayka

wa ash-hadu annaka nuru allahi alladhy lam yutfa wa la yutfa’u abadan

wa annaka wajhu allahi alladhy lam yahlik wa la yuhlaku abadan

wa ash-hadu ann hadhihi alttrbata turbatuka

wa hadha alharama haramuka

wa hadha almaSra`a maSra`u badanika

la dhalila wallahu mu`izzuka

wa la maghluba wallahu naSiruka

hadhihi shahadatun li `indaka ila yawmi qabzi ruhy bihazratika

wa alssalamu `alayka wa rahmatu allahi wa barakatuhu "
51,2,12,"Ash’hadu An Laa Ilaaha Illallaahu Wahdahu Laa Shareeka Lahu Wa Ash’hadu Annaka Muhammadabnu Abdillaahi Wa Ash’hadu Annaa Qad Ballaghta Risaalaati Rabbika Wa Naswahta Li Ummatika Wa Jaahadta Fee Sabeelillaahi Bill Hikmati Wal Maw’idhwatil Hasanati Wa Addaytal-Ladhee Alayka Minal Haqqi Wa Annaka Qad Ra’ufta Bil Mu’mineena Wa Ghaladhta Alal Kaafireena Wa Abadtallaaha Mukhliswan, Hattaa Ataakal Yaqeen, Fa Balaghallaahu Bika Ashrafa Mahallil Mukarrameen. Al-Hamdu Lillaahil-Ladhees-Tanqadhanaa Bika Minash-Shirki Wadh-Dhalaali, Allaahumma Swalli Alaa Muhammadin Wa Aalihi Waj’al Swalawaatika, Wa Swalawaati Malaaikatik Wa Ambiyaa’ika Wal Mursaleen Wa Ibaadikas-Swaaliheen, Wa Ahlis-Samaawaati Wal Ardheena Wa Man Sabbaha Laka Yaa Rabbal Aalameen Minal Awwaleena Wal Aakhareena Alaa Muhammadin Abdika Wa Rasoolika Wa Nabiyika Wa Ameenika Wa Najeebika Wa Habeebika Wa Swafiyyika Wa Swifwatika Wa Khaaswatika Wa Khaaliswatika Wa Khiyaratika Min Khalqika Wa A’atwihil Fadhla Wal Fadheelata Wal Waseelata Wad-Darajatar-Rafee’ata Wab’ath’hu Maqaaman Mahmoodan Yaghbituhu Bihil Awwaloona Wal Aakhiroona. Allaahumma Innaka Qulta Walaw Annahum Idh-Dhwalamoo Anfusahum Jaa’ooka Fastaghfarullaaha Wastaghfara Lahumur-Rasoolu, Li Wajadallaaha Tawwaaban Raheema, Ilaahee Faqad Ataytu Nabiyyika Mustaghfiran Taa’iban Min Dhunoobee Fa Swalli Alaa Muhammadin Wa Aalihee Waghfirhaa Lee, Ya Sayyidinaa Atawajjahu Bika Wa Bi Ahli Baytika Ilallaahi Ta’aalaa Rabbika Wa Rabbee Li Yaghfira Lee.

 Then recite 3 times: Innaa Lillaahi Wa Innaa Ilayhi Raajioon.

 Then continue: Uswibnaa Bika Yaa Habeeba Quloobinaa Famaa A’adhwamal Musweebata Bika Haythun Qatwa’a Annal Wahyu Wa Haythu Faqad Naaka Fa Innaa Lillaahi Wa Innaa Ilayhi Raajioon. Yaa Sayyidanaa Yaa Rasoolallaahi Swalawaatulaahi Alayka Wa Alaa Ahlibaytikat-Twayyibeenat-Twaahireen. Haadha Yawmus-Sabti Wa Huwa Yawmuka Wa Anaa Feehi Dhayfuka Wa Jaaruka Fa’adhifnee Wa Ajirnee, Fa Innaka Kareemun, Tuhibudh-Dhiyaafata Wa Ma’amoorun Bil Ijaarati Fa Adhifnee Wa Ahsin Dhiyaafatee Wa Ajirnaa Wa Ahsin Ijaaratanaa Bi Manziltillaahi Indaka Wa Inda Ahli Baytika Wa Bi Manzilatihim Indahoo Wa Bi Mastawda’akum Min Ilmihee Fa Innahoo Akramul Akrameen"
