ID,PARENT_ID,LTEXT,LTRANSLATE,ORDER_BY,LTYPE
912,312,وَ عَلِمْتَ الْحَقَّ یَقِینا وَ اعْتَمَدْتَهُ کَمَا أَمَرَکَ [وَ] أَشْهَدُ أَنَّکَ بَابُ وَصِیِّ الْمُصْطَفَى وَ طَرِیقُ حُجَّةِ اللهِ الْمُرْتَضَى وَ أَمِینُ اللهِ فِیمَا اسْتُودِعْتَ مِنْ عُلُومِ الْأَصْفِیَاءِ أَشْهَدُ أَنَّکَ مِنْ أَهْلِ بَیْتِ النَّبِیِّ النُّجَبَاءِ الْمُخْتَارِینَ لِنُصْرَةِ الْوَصِیِّ أَشْهَدُ أَنَّکَ صَاحِبُ الْعَاشِرَةِ وَ الْبَرَاهِینِ وَ الدَّلائِلِ الْقَاهِرَةِ وَ أَقَمْتَ الصَّلاةَ وَ آتَیْتَ الزَّکَاةَ وَ أَمَرْتَ بِالْمَعْرُوفِ وَ نَهَیْتَ عَنِ الْمُنْکَرِ وَ أَدَّیْتَ الْأَمَانَةَ وَ نَصَحْتَ للهِ وَ لِرَسُولِهِ وَ صَبَرْتَ عَلَى الْأَذَى فِی جَنْبِهِ حَتَّى أَتَاکَ الْیَقِینُ لَعَنَ اللهُ مَنْ جَحَدَکَ حَقَّکَ وَ حَطَّ مِنْ قَدْرِکَ لَعَنَ اللهُ مَنْ آذَاکَ فِی مَوَالِیکَ لَعَنَ اللهُ مَنْ أَعْنَتَکَ فِی أَهْلِ بَیْتِکَ [نَبِیِّکَ‏] لَعَنَ اللهُ مَنْ لامَکَ فِی سَادَاتِکَ لَعَنَ اللهُ عَدُوَّ آلِ مُحَمَّدٍ مِنَ الْجِنِّ وَ الْإِنْسِ مِنَ الْأَوَّلِینَ وَ الْآخِرِینَ وَ ضَاعَفَ عَلَیْهِمُ الْعَذَابَ الْأَلِیمَ,و حق را به یقین دانستى، و به آنچنان‏که فرمان دادى اعتماد کردى، گواهى مى‏دهم که‏ تو درگاه جانشین مصطفى، و راه حجّت خدا مرتضى، و امین خدایى در آنچه از علوم برگزیدگان‏ به تو سپرده شده، گواهى مى‏دهم که تو از اهل بیت پیامبرى، آن شرافتمندان برگزیده براى یارى جانشین آن حضرت‏ گواهى مى‏دهم که تو صاحب درجات دهگانه ایمان، و دلایل مغلوب کننده‏اى، و تو نماز را به پا داشتى، و زکات را دادى‏ و امر به معروف و نهى از منکر کردى، و امانت الهى را ادا نمودى، و براى خدا و رسولش خیرخواهى کردى، و در جنب خدا بر آزار مردم صبر نمودى، تا مرگ تو را دررسید، خدا لعنت کند کسى را که حق تو را انکار کرد، و از مقامت‏ کاست، خدا لعنت کند کسى را که تو درباره سرورانت آزرد، خدا لعنت کند کسى را که تو درباره خانواده‏ات به زحمت افکند. خدا لعنت کند کسى را که تو را درباره سرورانت سرزنش نمود، خدا لعنت کند دشمن خاندان محمّد را، از پرى و آدمى، از پیشینیان و پسینیان، و بر آنان عذاب دردناک را دوچندان گرداند,3,1
913,312,صَلَّى اللهُ عَلَیْکَ یَا أَبَا عَبْدِ اللهِ صَلَّى اللهُ عَلَیْکَ یَا صَاحِبَ رَسُولِ اللهِ صَلَّى اللهُ عَلَیْهِ وَ آلِهِ وَ عَلَیْکَ یَا مَوْلَى أَمِیرِ الْمُؤْمِنِینَ وَ صَلَّى اللهُ عَلَى رُوحِکَ الطَّیِّبَةِ وَ جَسَدِکَ الطَّاهِرِ وَ أَلْحَقَنَا بِمَنِّهِ وَ رَأْفَتِهِ إِذَا تَوَفَّانَا بِکَ وَ بِمَحَلِّ السَّادَةِ الْمَیَامِینِ وَ جَمَعَنَا مَعَهُمْ بِجِوَارِهِمْ فِی جَنَّاتِ النَّعِیمِ [صَلَّى اللهُ عَلَیْکَ‏] یَا أَبَا عَبْدِ اللهِ وَ صَلَّى اللهُ عَلَى إِخْوَانِکَ الشِّیعَةِ الْبَرَرَةِ مِنَ السَّلَفِ الْمَیَامِینِ وَ أَدْخَلَ الرَّوْحَ وَ الرِّضْوَانَ عَلَى الْخَلَفِ مِنَ الْمُؤْمِنِینَ وَ أَلْحَقَنَا وَ إِیَّاهُمْ بِمَنْ تَوَلاهُ مِنَ الْعِتْرَةِ الطَّاهِرِینَ وَ عَلَیْکَ وَ عَلَیْهِمُ السَّلامُ وَ رَحْمَةُ اللهِ وَ بَرَکَاتُهُ,درود خدا بر تو اى ابا عبد الله، درود خدا بر تو اى یار رسول خدا، (درود خدا بر او و خاندانش)، و بر تو اى دوست امیر مؤمنان‏ و درود خدا بر روح پاکیزه و پیکر پاک تو، و خدا هنگامى‏که ما را مى‏میراند، به منّت و مهرش‏ به تو و به جایگاه سروران با میمنت ملحق سازد، و ما را همراه آنان و جوار ایشان در بهشتهاى پرنعمت گرد آورد، درود خدا بر تو اى ابا عبد الله، و درود خدا بر برادرانت شیعیان نیکوکار از گذشتگان پر میمنت، و وارد کن‏ نسیم رحمت و رضوان را، بر بازماندگان از اهل ایمان، و ملحق کند ما و آنان را به کسانى که سلمان دوست داشت از عترت پاک‏ و سلام و رحمت و برکات خدا بر تو و بر ایشان,4,1
914,312,آنگاه سوره انّا انزلناه فى لیلة القدر را هفت‏ مرتبه بخوان، سپس هرچه خواهى نماز مستحبّ بجا آر. مؤلّف گوید: چون خواستى از زیارت سلمان بازگردى، به جهت وداع نزد قبر بایست، و این وداع را که سیّد در آخر زیارت چهارم ذکر فرموده است بگو:,0,5,2
915,312,السَّلامُ عَلَیْکَ یَا أَبَا عَبْدِ اللهِ أَنْتَ بَابُ اللهِ الْمُؤْتَى مِنْهُ وَ الْمَأْخُوذُ عَنْهُ أَشْهَدُ أَنَّکَ قُلْتَ حَقّا وَ نَطَقْتَ صِدْقا وَ دَعَوْتَ إِلَى مَوْلایَ وَ مَوْلاکَ عَلانِیَةً وَ سِرّا أَتَیْتُکَ زَائِرا وَ حَاجَاتِی لَکَ مُسْتَوْدِعا وَ هَا أَنَا ذَا مُوَدِّعُکَ أَسْتَوْدِعُکَ دِینِی وَ أَمَانَتِی وَ خَوَاتِیمَ عَمَلِی وَ جَوَامِعَ أَمَلِی إِلَى مُنْتَهَى أَجَلِی وَ السَّلامُ عَلَیْکَ وَ رَحْمَةُ اللهِ وَ بَرَکَاتُهُ وَ صَلَّى اللهُ عَلَى مُحَمَّدٍ وَ آلِهِ الْأَخْیَارِ,سلام بر تو اى ابا عبد الله، تو درگاه خدایى که از آن درآیند، و از آن برگیرند، گواهى مى‏دهم که‏ حق گفتى، و صادقانه سخن راندى، و به سوى مولایم در آشکار و نهان دعوت کردى، زائر به جانب‏ تو آمدم، درحالى‏که سپارنده حاجاتم به توام، و من اینک تو را وداع مى‏گویم، دین و امانت و عواقب کار و همه آرزویم را در طول عمرم به تو مى‏سپارم، و سلام و رحمت و برکات خدا بر تو باد، و درود خدا بر محمّد و خاندان نیکویش,6,1
916,312,آنگاه خدا را بسیار بخوان و بازگرد.,0,7,2
917,313,مؤلّف گوید: چون زائر به زیارت سلمان مشرّف شد، پس از زیارت دو وظیفه دیگر دارد: اول: نماز خواندن در طاق کسرى، دو رکعت یا بیشتر، چون‏ آنجا مصلاى حضرت امیر مؤمنان علیه السّلام است. از عمّار ساباطى روایت شده: امیر مؤمنان به مدائن آمد و در ایوان‏ کسرى نزول فرمود، درحالى‏که ابو دلف بن بحیر با او بود، در آنجا نماز خواند، پس از آن برخاست و به دلف فرمود: با من برخیز. و جماعتى از اهل ساباط در خدمت آن حضرت بود، در منازل کسرى گردش کرد و به دلف مى‏فرمود: براى‏ کسرى در این مکان چنین و چنان بوده، و دلف مى‏گفت: به خدا قسم چنین است که مى‏فرمایى، پس با آن جماعت‏ در تمام آن مواضع گردش کرد، و دلف مى‏گفت: اى سیّد و مولاى من، شما چنان به این مکانها آگاهى دارید، که‏ گویا شما این چیزها را در این مکانها نهاده‏اید!! روایت شده وقتى حضرت بر مداین مرور فرمود، و آثار کسرى و خرابى آن را مشاهده مى‏کرد، یکى از افرادى که در خدمت آن حضرت بود، از روى عبرت این شعر را خواند:,0,1,2
918,313,جَرَتِ الرِّیَاحُ عَلَى رُسُومِ دِیَارِهِمْ فَکَأَنَّهُمْ کَانُوا عَلَى مِیعَادِ,بادها بر خرابه‏هاى دیارشان وزید گویا اینان بر وعده‏گاهى بوده‏اند,2,1
919,313,حضرت فرمود: چرا نخواندى,0,3,2
920,313,(کَمْ تَرَکُوا مِنْ جَنَّاتٍ وَ عُیُونٍ وَ زُرُوعٍ وَ مَقَامٍ کَرِیمٍ وَ نِعْمَةٍ کَانُوا فِیهَا فَاکِهِینَ کَذَلِکَ وَ أَوْرَثْنَاهَا قَوْما آخَرِینَ فَمَا بَکَتْ عَلَیْهِمُ السَّمَاءُ وَ الْأَرْضُ وَ مَا کَانُوا مُنْظَرِینَ),چه بسیار باغها و چشمه‏ها، و مقام کریم. و نعمتى که در آن کامیاب بودند و واگذاشتند. چنین بود، و ما آنها را به مردمان دیگرى ارث دادیم. پس گریه نکرد بر آنها آسمان و زمین، و نبودند مهلت داده‏ شده,4,1
921,313,إِنَّ هَؤُلاءِ کَانُوا وَارِثِینَ فَأَصْبَحُوا مَوْرُوثِینَ لَمْ یَشْکُرُوا النِّعْمَةَ فَسُلِبُوا دُنْیَاهُمْ بِالْمَعْصِیَةِ إِیَّاکُمْ وَ کُفْرَ النِّعَمِ لا تَحُلَّ بِکُمُ النِّقَمُ,پس از آن فرمود: البته آنان ارث بودند، اما اکنون ارث برده شده‏اند، نعمت را شکر نکردند، در نتیجه‏ دنیایشان بر اثر معصیت از دستشان گرفته شد، از ناسپاسى نسبت به نعمت بپرهیزید، تا انتقامهاى بر شما فرود نیاید,5,1
922,313,فقیر گوید: حاصل این‏ معنى را حکیم خاقانى، در قالب شعر آورده، آنجا که فرموده:,0,6,2
923,313,هان اى دل عبرت‏بین از دیده نظر کن هان ایوان مدائن را آیینه عبر‌دان,0,7,2
924,313,پرویز که بنهادى بر خوان تره زرّین زرّین تره کو بر خوان,0,8,2
925,314,دوم:  زیارت جناب حذیفه بن الیمان مى‏باشد، که از بزرگان اصحاب رسول خدا صلى الله علیه و آله و خاصان امیر مؤمنان عیه السّلام‏ است، و در میان صحابه به شناختن منافقان و آگاهى بر اسامى آنان جایگاه خاصى داشت، و اگر در نماز جنازه کسى‏ حاضر نمى‏شد، خلیفه ثانى بر او نماز نمى‏خواند. او از جانب خلیفه ثانى سالها والى مداین بود، و پس از عزل کردندش جناب‏ سلمان والى آنجا شد. چون سلمان از دنیا رفت دوباره حذیفه والى مداین شد، و ولایتش مستقر گشت تا نوبت خلافت‏ به شاه ولایت علیه السّلام رسید، از جانب حضرت از مدینه فرمانى مبارک به او و به اهل مداین صادر شد، که در آن فرمان‏ مبارک، از خلافت خود، و استقرار حکومت حذیفه بر مداین اطلاع دادند. ولى حذیفه پس از حرکت آن حضرت از مدینه‏ به جانب بصره، به خاطر دفع شرّ اصحاب جمل و پیش از نزول موکب همایون امیر مؤمنان به کوفه وفات یافت و در‌‌ همان مدائن دفن شد. از ابو حمزه ثمالى روایت شده: چون حذیفه مشرف به وفات شد فرزند خود را خواست و او را به عمل کردن به این نصیحتهاى پرفایده وصیت کرد: پسرجان من، آشکار کن ناامیدى خویش از آنچه را در دست مردم است، که در این ناامیدى بى‏نیازى و توانگرى است، و از مردم حاجات خود را مخواه، که در آن فقر هویدا است، و همواره چنان باش، که روزى که در آن هستى، از روز گذشته‏ات بهتر باشد، و هرگاه نماز مى‏خوانى، چنان بخوان که گویا نماز وداع و آخرین نماز توست، و کارى مکن که از آن پوزش بخواهى. و بدان که در جنب حرم‏ جناب سلام مسجد جامع مداین مى‏باشد که منسوب به حضرت عسگرى علیه السّلام است، معلوم نیست چه کسى آن را ساخته‏ یا در آنجا نماز خوانده، شایسته است زائر در آن محل شریف خود را از فیض‏ دو رکعت نماز تحیّت محروم نکند.,0,1,2
926,316,فضیلت زیارت آن حضرت بیش از آن است که به شمار آید، و ما در اینجا تنها به ذکر چند خبر تبرّک مى‏جوییم، و بیشتر آن را از «تحفة الزائر» نقل مى‏کنیم. اول: از رسول خدا صلى الله علیه و آله روایت شده: زود باشد که پاره‏اى از تن من، در زمین خراسان‏ مدفون شود، هیچ مؤمنى او را زیارت نکند، مگر آنکه حق تعالى بهشت را براى او واجب کند و بدنش را بر آتش دوزخ حرام‏ سازد، و در حدیث معتبر دیگرى فرمود: پاره‏اى از بدن من در خراسان مدفون خواهد شد، هر غمناکى او را زیارت کند، البته‏ حق تعالى اندوهش را برطرف کند، و هر گناهکارى او را زیارت نماید، البته گناهانش را بیامرزد. دوم: به سند معتبر روایت‏ حج پذیرفته باشد. راوى بعید دانست و گفت: هفتاد حجّ پذیرفته؟! حضرت فرمود: آرى هفتاد هزار حج، گفت: هفتاد هزار حجّ؟! فرمود: چه بسا حجّى که پذیرفته نباشد، هرکه آن حضرت را زیارت کند یا یک شب نزد آن حضرت بیتوته کند چنان باشد که خدا را در عرش زیارت کرده باشد، گفت: چنان‏که خدا را در عرش زیارت کرده باشد؟ فرمود: آرى چون روز قیامت‏ شود، چهار نفر از پیشینیان و چهار نفر از پسینیان بر عرش الهى خواهند بود، اما پیشینیان، نوح و ابراهیم و موسى و عیسى علیهم السّلام هستند و اما پسینیان، محمّد و على و حسن و حسین علیهم السّلام‏اند، آنگاه ریسمانى در پاى عرش مى‏کشند، پس زیارت‏کنندگان قبور امامان با ما مى‏نشینند و به تحقیق زیارت‏کنندگان قبر فرزندم على، درجه ایشان از همه بالا‌تر و عطایشان از همه بیشتر خواهد بود.,0,1,2
927,316,سوم: از حضرت رضا علیه السّلام‏ روایت شده: در خراسان بقعه‏اى است، که زمانى بر آن خواهد آمد، که محل رفت وآمد ملائکه شود پس پیوسته گروههایى از ملائکه‏ از آسمان فرود خواهند آمد و گروههایى بالا خواهند رفت تا در صور بدمند، پرسیدند: یابن رسول الله کدام بقعه است؟ فرمود: آن بقعه در زمین طوس است و آن و الله باغى است از باغهاى بهشت، هرکه مرا در آن بقعه زیارت کند، چنان است که رسول‏ خدا صلى الله علیه و آله را زیارت کرده و حق تعالى براى او به سبب آن زیارت، ثواب هزار حجّ پسندیده و هزار عمره پذیرفته بنویسد و من و پدرانم در روز قیامت شفیع او باشیم. چهارم: به چندین سند صحیح از ابن ابى نصر نقل شده که گفت: نامه امام رضا علیه السّلام را خواندم‏ در آن نوشته شده بود: به شیعیان من برسانید، که زیارت من نزد خدا برابر است با هزار حج، پس من این حدیث را خدمت‏ حضرت جواد علیه السّلام عرض کردم، فرمود: آرى و الله هزار حج است، براى کسى‏که آن حضرت را زیارت کند و حق او را بشناسد. پنجم: به دو سند معتبر روایت شده: حضرت رضا علیه السّلام فرمود: هرکه مرا با این دورى بارگاه زیارت کند، من در سه‏ موطن روز قیامت نزد او آیم تا او را از اهوال آنها خلاصى بخشم: نخست وقتى که نامه‏هاى نیکوکاران در دست راست ایشان و نامه‏هاب بدکاران در دست چپ ایشان پرواز کند و دیگر نز صراط و سوم نزد ترازوى اعمال. ششم: در حدیث معتبر دیگرى فرمود زود باشد که بر اثر ظلم و ستم با زهر به قتل برسم و کنار هارون الرشید به خاک سپرده شوم و خدا تربت مرا محلّ تردّد شیعیان و دوستان من گرداند پس هرکه مرا در این غربت زیارت کند، براى او واجب می‌شود، که من او را در روز قیامت زیارت کنم و سوگند مى‏خورم، به خدایى که‏ محمّد صلى الله علیه و آله را به پیامبرى گرامى داشته و او را بر تمام حلایق برگزیده، که هرکه از شما شیعیان نزد قبر من دو رکعت بجا آورد، البته از جانب‏ خداى عالمیان در روز قیامت آمرزش گناهان را مستحقّ شود و به حق آن خدایى که ما بعد از محمّد صلى الله علیه و آله به امامت گرامى داشته، و به‏ وصیّت آن حضرت مخصوص گردانید، سوگند یاد مى‏کنم که زیارت‏کنندگان قبر من در روز قیامت بر خدا گرامى‏‌تر از هر گروه دیگرى هستند و هر مؤمنى که مرا زیارت کند و بر روى او قطره‏اى از باران برسد، البته حق تعالى جسم او را بر آتش دوزخ حرام گرداند.,0,2,2
928,316,هفتم: به سند معتبر روایت شده: محمّ بن سلیمان از حضرت جواد علیه السّلام پرسید: شخصى به عنوان حج تمتع، حج واجب خود را انجام داد و پس از آن‏ به مدینه رفت و حضرت رسول صلى الله علیه و آله را زیارت نمود، آنگاه به نجف رفت و پدرتان امیر مؤمنان علیه السّلام را زیات کرد، درحالى‏که حق او را مى‏شناخت و مى‏دانست که او حجت خدا بر خلق و باب الله است که از آن باب باید به خدا رسید، بر آن حضرت سلام کرد و به کربلا رفت و حضرت امام حسین علیه السّلام را زیارت کرد. سپس به بغداد رفت و حضرت امام موسى کاظم علیه السّلام را زیارت کرد و پس از این‏ زیارتها به شهر خود بازگشت، د راین وقت خدا آن‏قد رمال به او روزى کرد که مى‏تواند به حج برود، براى این مرد که حج واجب خود را انجام داده کدام یک از این دو عمل بهتر است، آیا برگردد و دوباره حج کند، یا به خراسان رفته و پدرتان حضرت رضا علیه السّلام‏ را زیارت کند؟ فرمود: بلکه برود بر پدرم سلام کند که این افضل است و باید که در ماه رجب باشد و در این زمان انجام ندهید، که بر ما و شما از خلیفه زمان خوف رسوا ساختن و عیب‏جویى است. هشتم: شیخ صدوق در کتاب من لا یحضره الفقیه از حضرت امام جواد علیه السّلام‏ روایت کرده: در میان دو کوه طوس قطعه‏اى از زمین است که از بهشت برداشته شده، هرکه وارد آن شود در روز قیامت از آتشى ایمنى‏ یابد. نهم: و نیز از آن حضرت روایت کرده: من از جانب حق تعالى بهشت را ضمانت مى‏کنم براى هرکه قبر پدرم را در طوس زیارت‏ کند، درحالى‏که عارف به حق آن حضرت باشد. دهم: شیخ صدوق در کتاب عیون اخبار الرّضا روایت کرده: مردى از نیکان، حضرت رسول صلى الله علیه و آله را در خواب دید، خدمت آن حضرت عرضه داشت: یا رسول الله از فرزندانت کدام یک را زیارت کنم؟ فرمود بعضى از فرزندان من زهر نوشیده و برخى کشته شده پیش من آمدند. گفتم: با پراکنده شدن مشاهد ایشان کدامیک از آنان را زیارت کنم؟ فرمود: آن را که به تو نزدیک‌تر است زیارت کن. یعنى آن را که محل تو به بارگاهش نزدیک‏‌تر است و او را در زمین غربت به خاک سپرده‏اند، گفتم: یا رسول الله از این فرمایش «رضا» را قصد کردید، فرمود: بگو صلى الله علیه بگو: صلى الله علیه بگو: صلى الله علیه، این جمله را سه بار فرمود. مؤلّف گوید: در کتاب «وسائل» و «مستدرک» فصول و ابوابى ذکر شده در مورد استحباب تبرّک به مشهد امام رضا و مشاهد امامان علیهم السّلام و استحباب اختیار زیارت امام رضا بر زیارت امام حسین علیهما السّلام و بر زیارت دیگر امامان علیهم السّلام و بر حجّ مستحب و عمره مستحب‏ و چون این کتاب گنجایش بسط مطلب را ندارد، ما به همین چند روایت که عشره کامله است اکتفا کردید.,0,3,2
929,317,بدانکه براى آن بزرگوار زیارات چندى نقل شده و زیارت مشهور آن حضرت زیارتى است که در کتب معتبر مذکور است و به شیخ جلیل القدر محمّد بن حسن بن ولید که از مشایخ جناب صدوق است منسوب کرده‏اند و از کتاب «مزار» ابن قولویه معلوم مى‏شود که از ائمه علیهم السّلام روایت شده و کیفیّت آن موافق کتاب من لا یحضره الفقیه چنان است که: چون زیارت قبر امام رضا علیه السّلام را در طوس قصد کنى، پیش از آنکه از خانه بیرون روى غسل کن، و وقتى که غسل مى‏کنى بگو:,0,1,2
930,317,اللهُمَّ طَهِّرْنِی وَ طَهِّرْ لِی قَلْبِی وَ اشْرَحْ لِی صَدْرِی وَ أَجْرِ عَلَى لِسَانِی مِدْحَتَکَ وَ الثَّنَاءَ عَلَیْکَ فَإِنَّهُ لا قُوَّةَ اِلّا بِکَ اللهُمَّ اجْعَلْهُ لِی طَهُورا وَ شِفَاءً,خدایا مرا پا کن، و دلم را پاک گردان، و سینه‏ام را بگشا، و مدح و ثناى خودت را بر زبانم جارى‏ ساز، که نیرویى نیست جز به تو. خدایا این غسل را برایم پاک کننده و شفابخش قرار ده,2,1
931,317,و در وقت بیرون رفتن از خانه مى‏گویى:,0,3,2
