ID,PARENT_ID,LTEXT,LTRANSLATE,ORDER_BY,LTYPE
606,276,السَّلامُ عَلَیْکَ یَا وَارِثَ آدَمَ صَفْوَةِ اللهِ السَّلامُ عَلَیْکَ یَا وَارِثَ نُوحٍ نَبِیِّ اللهِ السَّلامُ عَلَیْکَ یَا وَارِثَ إِبْرَاهِیمَ خَلِیلِ اللهِ السَّلامُ عَلَیْکَ یَا وَارِثَ مُوسَى کَلِیمِ اللهِ السَّلامُ عَلَیْکَ یَا وَارِثَ عِیسَى رُوحِ اللهِ السَّلامُ عَلَیْکَ یَا وَارِثَ مُحَمَّدٍ سَیِّدِ رُسُلِ اللهِ السَّلامُ عَلَیْکَ یَا وَارِثَ عَلِیٍّ أَمِیرِ الْمُؤْمِنِینَ وَ خَیْرِ الْوَصِیِّینَ السَّلامُ عَلَیْکَ یَا وَارِثَ الْحَسَنِ الرَّضِیِّ الطَّاهِرِ الرَّاضِی الْمَرْضِیِّ السَّلامُ عَلَیْکَ أَیُّهَا الصِّدِّیقُ الْأَکْبَرُ السَّلامُ عَلَیْکَ أَیُّهَا الْوَصِیُّ الْبَرُّ التَّقِیُّ السَّلامُ عَلَیْکَ وَ عَلَى الْأَرْوَاحِ الَّتِی حَلَّتْ بِفِنَائِکَ وَ أَنَاخَتْ بِرَحْلِکَ السَّلامُ عَلَیْکَ وَ عَلَى الْمَلائِکَةِ الْحَافِّینَ بِکَ أَشْهَدُ أَنَّکَ قَدْ أَقَمْتَ الصَّلاةَ وَ آتَیْتَ الزَّکَاةَ وَ أَمَرْتَ بِالْمَعْرُوفِ وَ نَهَیْتَ عَنِ الْمُنْکَرِ وَ جَاهَدْتَ الْمُلْحِدِینَ وَ عَبَدْتَ اللهَ حَتَّى أَتَاکَ الْیَقِینُ السَّلامُ عَلَیْکَ وَ رَحْمَةُ اللهِ وَ بَرَکَاتُهُ,سلام بر تو اى وارث آدم برگزیده خد، سلام بر تو اى وارث نوح پیامبر خدا، سلام‏ بر تو اى وارث ابراهیم دوست خدا، سلام بر تو اى وارث موسى همسخن خدا، سلام‏ بر تو اى وارث عیسى روح خدا، سلام بر تو اى وارث محمّد حبیب خدا، سلام بر تو اى وارث على امیر مؤمنان و بهترین جانشینان، سلام بر تو اى وارث‏ حسن پسندیده، و پاک و راضى و مورد خشنودى حق، سلام بر تو اى صدیق اکبر، سلام بر تو اى جانشین نیکوکار پرهیزگار، سلام بر تو و بر ارواحى که به درگاهت فرود آمدند، و مرکب به بارگاهت خواباندند، سلام بر تو و فرشتگان چرخنده گرداگردت، شهادت مى‏دهم که ماز به‏ پا داشتى، و زکات پرداختى، و امر نمودى به معروف و از منکر نهى کردى، با ملحدان جهاد کردى‏ و خدا را پرستیدى تا مرگت دررسید، سلام و رحمت و برکات خدا بر تو باد,3,1
607,276,آنگاه به جانب قبر مطهر مى‏روى، و براى تو به هر قدمى که بردارى و بگذارى، ثواب کسى‏که در راه خدا کشته شده و در خون خود غلطیده‏ خواهد بود. چون به قبر رسیدى، دست خود را به قبر بمال و بگو: السّلام علیک یا حجّة الله فى ارضه‏ سپس براى انجام نماز برو، به هر رکعتى که نزد آن حضرت بجا آورى، براى تو همانند ثواب کسى‏که هزار حج و عمره بجا آورده، و هزار بنده آزاد کرده خواهد بود، و همانند کسى‏که هزار موقف با پیامبر مرسلى ایستاده باشد پاداشى مى‏گیرى... تا آخر خبر. و این روایت با اختلاف کمى به روایت مفضّل بن عمر، در آداب زیارت امام حسین علیه السّلام گذشت,0,4,2
608,277,زیارت چهارم حضرت ابى عبد الله الحسین علیه السّلام,0,1,2
609,277,از معاویة بن عمّار نقل شده: خدمت امام صادق علیه السّلام عرضه داشتم: چون به زیارت حضرت امام حسین علیه السّلام بروم‏ چه بگویم؟ فرمود: بگو:,0,2,2
610,277,السَّلامُ عَلَیْکَ یَا أَبَا عَبْدِ اللهِ صَلَّى اللهُ عَلَیْکَ یَا أَبَا عَبْدِ اللهِ رَحِمَکَ اللهُ یَا أَبَا عَبْدِ اللهِ لَعَنَ اللهُ مَنْ قَتَلَکَ وَ لَعَنَ اللهُ مَنْ شَرِکَ فِی دَمِکَ وَ لَعَنَ اللهُ مَنْ بَلَغَهُ ذَلِکَ فَرَضِیَ بِهِ أَنَا إِلَى اللهِ مِنْ ذَلِکَ بَرِی‏ءٌ,سلام بر تو اى ابا عبد الله، درود خدا بر تو اى ابا عبد الله، خدا رحمتت‏ کند اى ابا عبد الله، خدا لعنت کند کسى را که در خونت شریک شد، و خدا لعنت کند کسى را که این واقعه به او رسید، و با آن خشنود شد، من به سوى خدا از این واقعه هولناک بیزارم,3,1
611,278,زیارت پنجم حضرت ابى عبد الله الحسین علیه السّلام,0,1,2
612,278,به سند معتبر روایت شده: حضرت موسى بن جعفر علیه السّلام به ابراهیم بن ابى البلاد فرمود: هنگامى‏که به زیارت‏ امام حسین علیه السّلام مى‏روى چه مى‏گویى؟ گفت مى‏گویم:,0,2,2
613,278,السَّلامُ عَلَیْکَ یَا أَبَا عَبْدِ اللهِ السَّلامُ عَلَیْکَ یَا ابْنَ رَسُولِ اللهِ أَشْهَدُ أَنَّکَ قَدْ أَقَمْتَ الصَّلاةَ وَ آتَیْتَ الزَّکَاةَ وَ أَمَرْتَ بِالْمَعْرُوفِ وَ نَهَیْتَ عَنِ الْمُنْکَرِ وَ دَعَوْتَ إِلَى سَبِیلِ رَبِّکَ بِالْحِکْمَةِ وَ الْمَوْعِظَةِ الْحَسَنَةِ وَ أَشْهَدُ أَنَّ الَّذِینَ سَفَکُوا دَمَکَ وَ اسْتَحَلُّوا حُرْمَتَکَ مَلْعُونُونَ مُعَذَّبُونَ عَلَى لِسَانِ دَاوُدَ وَ عِیسَى ابْنِ مَرْیَمَ ذَلِکَ بِمَا عَصَوْا وَ کَانُوا یَعْتَدُونَ,سلام بر تو اى ابا عبد الله سلام بر تو اى فرزند رسول خدا، شهادت مى‏دهم که تو نماز بپا داشتى، و زکات پرداختى و به خوبى امر کردى، و از بدى نهى نمودى، و به سوى راه پروردگارت با حکمت و موعظه نیکو فرا خواندى، و شهادت مى‏دهم آنان‏که خونت را ریختند، و حرمتت را حلال شمردند، در لعنت و شکنجه بر زبان‏ داود و عیسى پسر مریم‏اند، به خاطر گناهى که مرتکب شدند، و اهل ستم و تجاوز بودند,3,1
614,278,حضرت فرمود آرى چنین است.,0,4,2
615,279,زیارت ششم حضرت ابى عبد الله الحسین علیه السّلام,0,1,2
616,279,از امام صادق علیه السّلام روایت شده: به عمار ساباطى فرمود: چون به قبر امام حسین علیه السّلام برسى بگو:,0,2,2
617,279,السَّلامُ عَلَیْکَ یَا ابْنَ رَسُولِ اللهِ السَّلامُ عَلَیْکَ یَا ابْنَ أَمِیرِ الْمُؤْمِنِینَ السَّلامُ عَلَیْکَ یَا أَبَا عَبْدِ اللهِ السَّلامُ عَلَیْکَ یَا سَیِّدَ شَبَابِ أَهْلِ الْجَنَّةِ وَ رَحْمَةُ اللهِ وَ بَرَکَاتُهُ السَّلامُ عَلَیْکَ یَا مَنْ رِضَاهُ مِنْ رِضَى الرَّحْمَنِ وَ سَخَطُهُ مِنْ سَخَطِ الرَّحْمَنِ السَّلامُ عَلَیْکَ یَا أَمِینَ اللهِ وَ حُجَّةَ اللهِ وَ بَابَ اللهِ وَ الدَّلِیلَ عَلَى اللهِ وَ الدَّاعِیَ إِلَى اللهِ أَشْهَدُ أَنَّکَ قَدْ حَلَّلْتَ حَلالَ اللهِ وَ حَرَّمْتَ حَرَامَ اللهِ وَ أَقَمْتَ الصَّلاةَ وَ آتَیْتَ الزَّکَاةَ وَ أَمَرْتَ بِالْمَعْرُوفِ وَ نَهَیْتَ عَنِ الْمُنْکَرِ وَ دَعَوْتَ إِلَى سَبِیلِ رَبِّکَ بِالْحِکْمَةِ وَ الْمَوْعِظَةِ الْحَسَنَةِ وَ أَشْهَدُ أَنَّکَ وَ مَنْ قُتِلَ مَعَکَ شُهَدَاءُ أَحْیَاءٌ عِنْدَ رَبِّکُمْ تُرْزَقُونَ وَ أَشْهَدُ أَنَّ قَاتِلَکَ فِی النَّارِ أَدِینُ اللهَ بِالْبَرَاءَةِ مِمَّنْ قَتَلَکَ وَ مِمَّنْ قَاتَلَکَ وَ شَایَعَ عَلَیْکَ وَ مِمَّنْ جَمَعَ عَلَیْکَ وَ مِمَّنْ سَمِعَ صَوْتَکَ وَ لَمْ یُعِنْکَ یَا لَیْتَنِی کُنْتُ مَعَکُمْ فَأَفُوزَ فَوْزا عَظِیما,سلام بر تو اى فرزند رسول خدا، سلام بر تو اى فرزند امیر مؤمنان، سلام بر تو اى‏ ابا عبد الله، سلام بر تو اى سرور جوانان اهل بهشت، و رحمت و برکات خدا بر تو باد اى آن‏که خشنودى‏اش از خشنودى خداى رحمن، و خشمش از خشم خداى رحمن است، سلام بر تو اى‏ امین خدا، و حجّت خدا و باب خدا، و راهنماى به راه خدا، و دعوت کننده خدا، شهادت مى‏دهم که‏ تو حلال خدا را حلال کردى، و حرام خدا را حرام نمودى، و نماز را برپا داشتى، و زکات دادى، و امر به معروف، و نهى از منکر نمودى، و به سوى راه پروردگارت با حکمت و موعظه نیکو فرا خواندى، و شهادت مى‏دهم که تو و کسانى که کشته شدند، با همه شهیدند، نزد پروردگارتان زنده‏اید و روزى داده مى‏شوید، و شهادت‏ مى‏دهم که قاتل تو در آتش دوزخ است، خدا را پیروى مى‏کنم، با بیزارى از کسى‏که با تو جنگید، و بر علیه تو از دشمن پیروى کرد، و از کسى که بر علیه تو گرد آمد، و از کسى‏که صدایت را شنید، و یارى‏ات ننمود، اى کاش با شما بودم، و به رستگارى بزرگ مى‏رسیدم,3,1
618,279,مؤلّف گوید: این سه زیارت [چهارم و پنجم و ششم] از کتاب «مزار» ابن قولویه منقول است.,0,4,2
619,280,زیارت هفتم حضرت ابى عبد الله الحسین علیه السّلام (زیارت وارث),0,1,2
620,280,شیخ طوسى در کتاب «مصباح» از صفوان جمّال روایت کرده: از امام صادق علیه السّلام براى زیارت مولایمان‏ حسین علیه السّلام اجازه خواستم، و استدعا نمودم، براى من جهت زیارت آن حضرت دستور العملى ذکر کند، که به آن صورت‏ به زیارت اقدام کنم، فرمود: اى صفوان، پیش از حرکت به سفر، سه روز روزه بدار، و روز سوم غسل کن، پس اهل‏ و عیال خود را نزد خویش جمع کن و چنین بگو اللهم انىّ استودعک تا آخر دعا که قبلا ذکر شد. آنگاه دعایى تعلیم او فرمود که وقتى به فرات برسد بگوید. سپس فرمود: با آب فرات غسل کن، به درستى که پدرم مرا از پدرانش علیهم السّلام خبر داد که‏ رسول خدا صلّى الله علیه و آله و سلّم فرمود: همانا فرزند من حسین، پس از من در کنار فرات کشته خواهد شد، هرکه او را زیارت‏ کند، و از فرات غسل نماید، گناهان او بریزد و مانند روزى شود که مادر او را به دنیا آورده است. چون غسل کنى در حال انجام غسل بگو:,0,2,2
621,280,بِسْمِ اللهِ وَ بِاللهِ اللهُمَّ اجْعَلْهُ نُورا وَ طَهُورا وَ حِرْزا وَ شِفَاءً مِنْ کُلِّ دَاءٍ وَ سُقْمٍ وَ آفَةٍ وَ عَاهَةٍ اللهُمَّ طَهِّرْ بِهِ قَلْبِی وَ اشْرَحْ بِهِ صَدْرِی وَ سَهِّلْ لِی بِهِ أَمْرِی,به خدا، و با خدا. خدایا آن را قرار ده روشنى و پاک کننده‏ و نگهدارنده، و شفاى از هر درد و بیمارى و آفت و آسیب، خدایا دلم را با آن پاک کن، و سینه‏ام را بگشاى، و کارم را با ان آسان گردان,3,1
622,280,چون از غسل فارغ شوى دو جامه پاکیزه بپوش، و در مشرعه دو رکعت‏ نماز بجاى آر، که آن‌‌ همان مکانى است که حق تعالى درباره شأنش فرمود: «در زمین قطعه‏هایى است نزدیک یکدیگر، و بوستانهاست از انواع انگور، و کشتزار و باغستانهایى است از خرما، دو تا از یک ریشه رسته، و غیر دو تا از یک اصل روییده شده، به یک آب، آبخورده مى‏شوند، و بعضى از آنها را بر بعض دیگر از میوه زیادتى مى‏دهیم». چون از نماز فارغ شوى، با حالتى آرام، و همراه با وقار به جانب حائر حرکت کن، و گامهاى خود را کوتاه بردار، به‏ درستى که خداى تعالى براى گامى که برمى‏دارى برایت حجّ و عمره مى‏نویسد، و با دل فروتن و دیده گریان راه برو و بسیار کن ذکر الله اکبر و لا اله الا الله و ثنا بر خدا، و صلوات بر رسول خدا صلّى الله علیه و آله و سلّم و به ویژه صلوات بر حسین علیه السّلام‏ را. و بسیار کن لعنت بر قاتلان آن حضرت و بیزارى جستن از کسانى که در ابتدا، پایه ظلم و جور بر اهل بیت علیهم السّلام را بنا گذاشتند. هرگاه به درگاه حائر رسیدى بایست و بگو:,0,4,2
623,280,اللهُ أَکْبَرُ کَبِیرا وَ الْحَمْدُ للهِ کَثِیرا وَ سُبْحَانَ اللهِ بُکْرَةً وَ أَصِیلا الْحَمْدُ للهِ الَّذِی هَدَانَا لِهَذَا وَ مَا کُنَّا لِنَهْتَدِیَ لَوْ لا أَنْ هَدَانَا اللهُ لَقَدْ جَاءَتْ رُسُلُ رَبِّنَا بِالْحَقِّ,خدا بزرگ‌تر است بزرگ‌تر، و سپاس خدا راست بسیار، و منزّه است خدا هر صبح و شب، سپاس خداى را که ما را به این مسیر هدایت کرد، و ما نبودیم کسانى که هدایت شویم، اگر خدا هدایتمان نمى‏کرد، همانا رسولان پروردگار ما به حق آمدند.,5,1
624,280,پس بگو:,0,6,2
625,280, السَّلامُ عَلَیْکَ یَا رَسُولَ اللهِ السَّلامُ عَلَیْکَ یَا نَبِیَّ اللهِ السَّلامُ عَلَیْکَ یَا خَاتَمَ النَّبِیِّینَ السَّلامُ عَلَیْکَ یَا سَیِّدَ الْمُرْسَلِینَ السَّلامُ عَلَیْکَ یَا حَبِیبَ اللهِ السَّلامُ عَلَیْکَ یَا أَمِیرَ الْمُؤْمِنِینَ السَّلامُ عَلَیْکَ یَا سَیِّدَ الْوَصِیِّینَ السَّلامُ عَلَیْکَ یَا قَائِدَ الْغُرِّ الْمُحَجَّلِینَ السَّلامُ عَلَیْکَ یَا ابْنَ فَاطِمَةَ سَیِّدَةِ نِسَاءِ الْعَالَمِینَ السَّلامُ عَلَیْکَ وَ عَلَى الْأَئِمَّةِ مِنْ وُلْدِکَ السَّلامُ عَلَیْکَ یَا وَصِیَّ أَمِیرِ الْمُؤْمِنِینَ السَّلامُ عَلَیْکَ أَیُّهَا الصِّدِّیقُ الشَّهِیدُ السَّلامُ عَلَیْکُمْ یَا مَلائِکَةَ اللهِ [رَبِّی‏] الْمُقِیمِینَ فِی هَذَا الْمَقَامِ الشَّرِیفِ,سلام بر تو اى رسول خدا، سلام بر تو اى پیامبر خدا، سلام بر تو اى خاتم‏ پیامبران، سلام بر تو اى سرور رسولان، سلام بر تو اى حبیب خدا، سلام‏ بر تو اى امیر مؤمنان، سلام بر تو اى آقاى جانشینان، سلام بر تو اى پیشواى‏ سپیدرویان، سلام بر تو اى فرزند فاطمه، سرور زنان جهانیان، سلام بر تو و بر امامان از فرزندانت، سلام بر تو اى جانشین امیر مؤمنان، سلام بر تو اى‏ صدّیق شهید، سلام بر شما اى فرشتگان که مقیّم در این مقام شریفید,7,1
626,280,السَّلامُ عَلَیْکُمْ یَا مَلائِکَةَ رَبِّی الْمُحْدِقِینَ بِقَبْرِ الْحُسَیْنِ علیه السلام السَّلامُ عَلَیْکُمْ مِنِّی أَبَدا مَا بَقِیتُ وَ بَقِیَ اللَّیْلُ وَ النَّهَارُ,سلام بر شما اى فرشتگان پروردگارم، که گرداگرد قبر حسین (درود بر او) هستید، سلام بر شما از سوى من همیشه تا هستم و شب و روز برپاست. ,8,1
627,280,پس مى‏گویى,0,9,2
628,280,  السَّلامُ عَلَیْکَ یَا أَبَا عَبْدِ اللهِ السَّلامُ عَلَیْکَ یَا ابْنَ رَسُولِ اللهِ السَّلامُ عَلَیْکَ یَا ابْنَ أَمِیرِ الْمُؤْمِنِینَ عَبْدُکَ وَ ابْنُ عَبْدِکَ وَ ابْنُ أَمَتِکَ الْمُقِرُّ بِالرِّقِّ وَ التَّارِکُ لِلْخِلافِ عَلَیْکُمْ وَ الْمُوَالِی لِوَلِیِّکُمْ وَ الْمُعَادِی لِعَدُوِّکُمْ قَصَدَ حَرَمَکَ وَ اسْتَجَارَ بِمَشْهَدِکَ وَ تَقَرَّبَ إِلَیْکَ بِقَصْدِکَ أَ أَدْخُلُ یَا رَسُولَ اللهِ أَ أَدْخُلُ یَا نَبِیَّ اللهِ أَ أَدْخُلُ یَا أَمِیرَ الْمُؤْمِنِینَ أَ أَدْخُلُ یَا سَیِّدَ الْوَصِیِّینَ أَ أَدْخُلُ یَا فَاطِمَةُ سَیِّدَةَ نِسَاءِ الْعَالَمِینَ أَ أَدْخُلُ یَا مَوْلایَ یَا أَبَا عَبْدِ اللهِ أَ أَدْخُلُ یَا مَوْلایَ یَا ابْنَ رَسُولِ اللهِ,سلام بر تو اى ابا عبد الله سلام بر تو اى فرزند رسول خدا، سلام بر تو اى فرزند امیر مؤمنان، بنده‏ات و فرزند بنده‏ات‏ و فرزند کنیزت هستم، اقرار به غلامى شما دارم، و ترک کننده مخالفت با شمایم، دوستدار دوستانتان، و دشمن دشمنانتان‏ مى‏باشم، حرمت را قصد کرده، و به زیارتگاهت پناه آورده، و به سوى تو با قصد کردنت تقرّب جسته، آیا وارد شوم‏ اى رسول خدا؟، آیا وارد شوم اى پیامبر خدا، آیا وارد شوم اى امیر مؤمنان، آیا وارد شوم اى سرور جانشینان‏ آیا وارد شوم اى فاطمه سرور زنان جهانیان، آیا وارد شوم اى مولایم اى ابا عبد الله، آیا وارد شوم اى‏ مولایم اى فرزند رسول خدا,10,1
629,280,پس اگر دلت فروتن و دیده‏ات گریان شد، نشانه اجازه ورود است، پس‏ وارد شو و بگو:,0,11,2
630,280,الْحَمْدُ للهِ الْوَاحِدِ الْأَحَدِ الْفَرْدِ الصَّمَدِ الَّذِی هَدَانِی لوِلایَتِکَ وَ خَصَّنِی بِزِیَارَتِکَ وَ سَهَّلَ لِی قَصْدَکَ,سپاس خداى را آن یگانه و یکتا و فرد و بى‏نیازى که مرا به ولایتت هدایت نمود، و به‏ زیارتت اختصاصم داد، و آهنگ به سوى تو را برایم آسان نمود,12,1
631,280,آنگاه تا درگاه قبّه مطهره برو، و برابر بالا سر بایست و بگو:,0,13,2
632,280,السَّلامُ عَلَیْکَ یَا وَارِثَ آدَمَ صَفْوَةِ اللهِ السَّلامُ عَلَیْکَ یَا وَارِثَ نُوحٍ نَبِیِّ اللهِ السَّلامُ عَلَیْکَ یَا وَارِثَ إِبْرَاهِیمَ خَلِیلِ اللهِ السَّلامُ عَلَیْکَ یَا وَارِثَ مُوسَى کَلِیمِ اللهِ السَّلامُ عَلَیْکَ یَا وَارِثَ عِیسَى رُوحِ اللهِ السَّلامُ عَلَیْکَ یَا وَارِثَ مُحَمَّدٍ حَبِیبِ اللهِ السَّلامُ عَلَیْکَ یَا وَارِثَ أَمِیرِ الْمُؤْمِنِینَ علیه السلام [وَلِیِّ اللهِ‏] السَّلامُ عَلَیْکَ یَا ابْنَ مُحَمَّدٍ الْمُصْطَفَى السَّلامُ عَلَیْکَ یَا ابْنَ عَلِیٍّ الْمُرْتَضَى السَّلامُ عَلَیْکَ یَا ابْنَ فَاطِمَةَ الزَّهْرَاءِ السَّلامُ عَلَیْکَ یَا ابْنَ خَدِیجَةَ الْکُبْرَى السَّلامُ عَلَیْکَ یَا ثَارَ اللهِ وَ ابْنَ ثَارِهِ وَ الْوِتْرَ الْمَوْتُورَ أَشْهَدُ أَنَّکَ قَدْ أَقَمْتَ الصَّلاةَ وَ آتَیْتَ الزَّکَاةَ وَ أَمَرْتَ بِالْمَعْرُوفِ وَ نَهَیْتَ عَنِ الْمُنْکَرِ وَ أَطَعْتَ اللهَ وَ رَسُولَهُ حَتَّى أَتَاکَ الْیَقِینُ فَلَعَنَ اللهُ أُمَّةً قَتَلَتْکَ وَ لَعَنَ اللهُ أُمَّةً ظَلَمَتْکَ,سلام بر تو اى وارث آدم برگزیده خدا، سلام بر تو اى وارث نوح پیامبر خدا سلام بر تو اى وارث ابراهیم دوست خدا، سلام بر تو اى وارث موسى همسخن‏ خدا، سلام بر تو اى وارث عیسى روح خدا، سلام بر تو اى وارث محمّد حبیب خدا، سلام بر تو اى وارث امیر مؤمنان ولىّ خدا، سلام بر تو اى‏ فرزند محمّد مصطفى، سلام بر تو اى فرزند على مرتضى، سلام بر تو اى فرزند فاطمه‏ زهرا، سلام بر تو اى فرزند خدیجه کبرى، سلام بر تو اى خون خدا و فرزند خون‏ خدا، و تنهاى ستمدیده، شهادت مى‏دهم که تو نماز بپا داشتى، و زکات پرداختى، و امر به معروف و نهى از منکر نمودى، و خدا و رسولش را اطاعت کردى، تا مرگ تو را دررسید، خدا لعنت کند ملتى را که تو را کشتند و لعنت کند مردمى را که به تو ستم نمودند,14,1
