ID,PARENT_ID,LTEXT,LTRANSLATE,ORDER_BY,LTYPE
338,40,وَ أَوَّلُ مَنْ آمَنَ بِاللهِ وَ صَدَّقَ بِمَا أُنْزِلَ عَلَى نَبِیِّهِ وَ أَشْهَدُ أَنَّهُ قَدْ بَلَّغَ عَنِ اللهِ مَا أَنْزَلَهُ فِیکَ فَصَدَعَ بِأَمْرِهِ وَ أَوْجَبَ عَلَى أُمَّتِهِ فَرْضَ طَاعَتِکَ وَ وِلایَتِکَ وَ عَقَدَ عَلَیْهِمُ الْبَیْعَةَ لَکَ وَ جَعَلَکَ أَوْلَى بِالْمُؤْمِنِینَ مِنْ أَنْفُسِهِمْ کَمَا جَعَلَهُ اللهُ کَذَلِکَ ثُمَّ أَشْهَدَ اللهَ تَعَالَى عَلَیْهِمْ فَقَالَ أَ لَسْتُ قَدْ بَلَّغْتُ فَقَالُوا اللهُمَّ بَلَى فَقَالَ اللهُمَّ اشْهَدْ وَ کَفَى بِکَ شَهِیدا وَ حَاکِما بَیْنَ الْعِبَادِ فَلَعَنَ اللهُ جَاحِدَ وِلایَتِکَ بَعْدَ الْإِقْرَارِ وَ نَاکِثَ عَهْدِکَ بَعْدَ الْمِیثَاقِ وَ أَشْهَدُ أَنَّکَ وَفَیْتَ بِعَهْدِ اللهِ تَعَالَى وَ أَنَّ اللهَ تَعَالَى مُوفٍ لَکَ بِعَهْدِهِ وَ مَنْ أَوْفَى بِمَا عَاهَدَ عَلَیْهِ اللهَ فَسَیُؤْتِیهِ أَجْرا عَظِیما وَ أَشْهَدُ أَنَّکَ أَمِیرُ الْمُؤْمِنِینَ الْحَقُّ الَّذِی نَطَقَ بِوِلایَتِکَ التَّنْزِیلُ وَ أَخَذَ لَکَ الْعَهْدَ عَلَى الْأُمَّةِ بِذَلِکَ الرَّسُولُ وَ أَشْهَدُ أَنَّکَ وَ عَمَّکَ وَ أَخَاکَ الَّذِینَ تَاجَرْتُمُ اللهَ بِنُفُوسِکُمْ,و اوّل کسى‏که به خدا ایمان آورد، و آنچه را بر پیامبرش نازد شده بود تصدیق کرد، و شهادت مى‏دهم که‏ آن حضرت همه آنچه را خدا درباره تو نازل کرد به مردم رساند، و امر خدا را درباره تو با صداى بلند اعلام کرد، و بر امّتش حتمى بودن طاعت و ولایتت‏ را واجب نمود، و بیعت تو را بر عهدّ آنان نهاد، و حضرتت را نسبت به مؤمنان سزاوار‌تر از خودشان قرار داد، چنان‏که‏ خدا خود او را اینچنین قرار داد، سپس پیامبر اسلام خدا را بر مردم شاهد گرفت و فرمود: آیا من آن نیستم که رساندم. همه گفتند: به خدا آرى. پس فرمود: خدایا گواه باش، و تو براى گواهى و حاکمیت بین بندگان بسى. پس خدا لعنت کند منکر ولایتت را بعد از اقرار، و شکننده پیمانت را پس از پیمان بستن، و شهادت مى‏دهم که‏ تو به عهد خداى تعالى وفا کردى، و خداى تعالى وفا کننده به عهد خویش براى توست، و هرکس به آن پیمانى که با خدا بسته وفا کند، خدا پاداش بزرگى به او خواهد داد. و شهادت مى‏دهم که تویى امیر مؤمنان آن حقّى که قرآن به‏ ولایتت گویا شد، و رسول خدا در این زمینه براى تو از امّتت پیمان گرفت، و شهادت مى‏دهم که تو و عمو و برادرت کسانى هستید که با خدا با جا‌‌نهایتان معامله کردید,4,1
339,40,فَأَنْزَلَ اللهُ فِیکُمْ إِنَّ اللهَ اشْتَرَى مِنَ الْمُؤْمِنِینَ أَنْفُسَهُمْ وَ أَمْوَالَهُمْ بِأَنَّ لَهُمُ الْجَنَّةَ یُقَاتِلُونَ فِی سَبِیلِ اللهِ فَیَقْتُلُونَ وَ یُقْتَلُونَ وَعْدا عَلَیْهِ حَقّا فِی التَّوْرَیةِ وَ الْإِنْجِیلِ وَ الْقُرْآنِ وَ مَنْ أَوْفَى بِعَهْدِهِ مِنَ اللهِ فَاسْتَبْشِرُوا بِبَیْعِکُمُ الَّذِی بَایَعْتُمْ بِهِ وَ ذَلِکَ هُوَ الْفَوْزُ الْعَظِیمُ التَّائِبُونَ الْعَابِدُونَ الْحَامِدُونَ السَّائِحُونَ الرَّاکِعُونَ السَّاجِدُونَ الْآمِرُونَ بِالْمَعْرُوفِ وَ النَّاهُونَ عَنِ الْمُنْکَرِ وَ الْحَافِظُونَ لِحُدُودِ اللهِ وَ بَشِّرِ الْمُؤْمِنِینَ أَشْهَدُ یَا أَمِیرَ الْمُؤْمِنِینَ أَنَّ الشَّاکَّ فِیکَ مَا آمَنَ بِالرَّسُولِ الْأَمِینِ وَ أَنَّ الْعَادِلَ بِکَ غَیْرَکَ عَانِدٌ [عَادِلٌ‏] عَنِ الدِّینِ الْقَوِیمِ الَّذِی ارْتَضَاهُ لَنَا رَبُّ الْعَالَمِینَ وَ أَکْمَلَهُ بِوِلایَتِکَ یَوْمَ الْغَدِیرِ وَ أَشْهَدُ أَنَّکَ الْمَعْنِیُّ بِقَوْلِ الْعَزِیزِ الرَّحِیمِ وَ أَنَّ هَذَا صِرَاطِی مُسْتَقِیما فَاتَّبِعُوهُ وَ لا تَتَّبِعُوا السُّبُلَ فَتَفَرَّقَ بِکُمْ عَنْ سَبِیلِهِ ضَلَّ وَ اللهِ وَ أَضَلَّ مَنِ اتَّبَعَ سِوَاکَ وَ عَنَدَ عَنِ الْحَقِّ مَنْ عَادَاکَ,پس خدا این آیه را در حق شما نازل کرد: به درستى که خدا از مؤمنان خرید جانها و اموالشان را، که در عوض به آنها بهشت براى آنان باشد، و در راه خدا پیکار مى‏کنند، پس مى‏کشند و کشته مى‏شوند، وعده‏اى است بر او، محقق شده در تورات و انجیل و قرآن، و کیست که‏ به عهد خود وفادار‌تر از خدا باشد، پس شادى کنید به معامله‏اى که انجام دادید، و این است آن رستگارى بزرگ آنانند توبه‏کنندگان، عبادت‏کنندگان، روزه‏گیران، رکوع‏کنندگان، سجودکنندگان، امرکنندگان‏ به معروف، نهى‏کنندگان از منکر، و نگهبانان حدود خدا، و به مؤمنان بشارت ده، شهادت‏ مى‏دهم اى امیر مؤمنان، که شک کننده در باره تو به رسول امین ایمان نیآورده، و اینکه روى گرداننده از ولایت‏ تو به ولایت غیر، معاندانه روى گردان از دین است، دین میانه‏اى که پروردگار جهانیان براى ما پسندیده، و آن را روز غدیر به ولایت تو کامل نموده است، و گواهى مى‏دهم که در این گفته خداى عزیز رحیم، مقصود تویى: به حقیقت این است راه راست من، از آن پیروى‏ کنید، و راههاى دیگر را پیروى ننمایید، که شما را از راه او پراکنده کند، به خدا سوگند گمراه شد، و گمراه کرد کسى‏که از غیر تو پیروى نمود، و کسى‏که تو را دشمن داشت، ستیزه‏ورزان از حق روى گرداند,5,1
340,40,اللهُمَّ سَمِعْنَا لِأَمْرِکَ وَ أَطَعْنَا وَ اتَّبَعْنَا صِرَاطَکَ الْمُسْتَقِیمَ فَاهْدِنَا رَبَّنَا وَ لا تُزِغْ قُلُوبَنَا بَعْدَ إِذْ هَدَیْتَنَا إِلَى طَاعَتِکَ وَ اجْعَلْنَا مِنَ الشَّاکِرِینَ لِأَنْعُمِکَ وَ أَشْهَدُ أَنَّکَ لَمْ تَزَلْ لِلْهَوَى مُخَالِفا وَ لِلتُّقَى مُحَالِفا وَ عَلَى کَظْمِ الْغَیْظِ قَادِرا وَ عَنِ النَّاسِ عَافِیا غَافِرا وَ إِذَا عُصِیَ اللهُ سَاخِطا وَ إِذَا أُطِیعَ اللهُ رَاضِیا وَ بِمَا عَهِدَ إِلَیْکَ عَامِلا رَاعِیا لِمَا اسْتُحْفِظْتَ حَافِظا لِمَا اسْتُودِعْتَ مُبَلِّغا مَا حُمِّلْتَ مُنْتَظِرا مَا وُعِدْتَ وَ أَشْهَدُ أَنَّکَ مَا اتَّقَیْتَ ضَارِعا وَ لا أَمْسَکْتَ عَنْ حَقِّکَ جَازِعا وَ لا أَحْجَمْتَ عَنْ مُجَاهَدَةِ غَاصِبِیکَ [عَاصِیکَ‏] نَاکِلا وَ لا أَظْهَرْتَ الرِّضَى بِخِلافِ مَا یُرْضِی اللهَ مُدَاهِنا وَ لا وَهَنْتَ لِمَا أَصَابَکَ فِی سَبِیلِ اللهِ,خدایا امرت را شنیدیم. و اطاعت کردیم و راه راست تو را پیروى نمودیم‏ پروردگارا ما را هدایت کن، و بعد از اینکه ما را به طاعتت هدایت کردى دلهایمان را منحرف مساز، و ما را از سپاسگذاران نعمتهایت‏ قرار ده، و شهادت مى‏دهم که تو پیوسته با هواى نفس مخالف، و با پرهیزگارى هم‏پیمان، و به فرو خوردن خشم توانا و گذشت کننده از مردم و آمرزنده آنان بودى، و زمانى که خدا معصیت مى‏شود خشمناک، و هنگامى‏که اطاعت مى‏شود خشنودى‏ به آنچه خدا با تو پیمان بسته بود عامل بودى، و آنچه نگهدارى‏اش از تو خواسته شده بود رعایت نمودى، و آنچه به تو سپرده شده بود حفظ کردى، و آنچه از حق بر عهده‏ات نهاده شده بود رساندى، و آنچه را به آن وعده داده شدى به انتظار نشستى، و شهادت مى‏دهم که از روى زبونى محافظه‏کارى نکردى، و در اثر بى‏تابى و عجز از گرفتن حقت باز نایستادى، و به خاطر ترس و وحشت، از پیکار با غصبان ولایتت قدم به عقب نگذاشتى، و به علّت سستى بر خلاف آنچه خدا را خشنود مى‏کند اظهار خشنودى ننموده، و براى آنچه در راه خدا به تو دررسیده سست نشدى,6,1
341,40,وَ لا ضَعُفْتَ وَ لا اسْتَکَنْتَ عَنْ طَلَبِ حَقِّکَ مُرَاقِبا مَعَاذَ اللهِ أَنْ تَکُونَ کَذَلِکَ بَلْ إِذْ ظُلِمْتَ احْتَسَبْتَ رَبَّکَ وَ فَوَّضْتَ إِلَیْهِ أَمْرَکَ وَ ذَکَّرْتَهُمْ فَمَا ادَّکَرُوا وَ وَعَظْتَهُمْ فَمَا اتَّعَظُوا وَ خَوَّفْتَهُمُ اللهَ فَمَا تَخَوَّفُوا وَ أَشْهَدُ أَنَّکَ یَا أَمِیرَ الْمُؤْمِنِینَ جَاهَدْتَ فِی اللهِ حَقَّ جِهَادِهِ حَتَّى دَعَاکَ اللهُ إِلَى جِوَارِهِ وَ قَبَضَکَ إِلَیْهِ بِاخْتِیَارِهِ وَ أَلْزَمَ أَعْدَاءَکَ الْحُجَّةَ بِقَتْلِهِمْ إِیَّاکَ لِتَکُونَ الْحُجَّةُ لَکَ عَلَیْهِمْ مَعَ مَا لَکَ مِنَ الْحُجَجِ الْبَالِغَةِ عَلَى جَمِیعِ خَلْقِهِ السَّلامُ عَلَیْکَ یَا أَمِیرَ الْمُؤْمِنِینَ عَبَدْتَ اللهَ مُخْلِصا وَ جَاهَدْتَ فِی اللهِ صَابِرا وَ جُدْتَ بِنَفْسِکَ مُحْتَسِبا وَ عَمِلْتَ بِکِتَابِهِ وَ اتَّبَعْتَ سُنَّةَ نَبِیِّهِ وَ أَقَمْتَ الصَّلاةَ وَ آتَیْتَ الزَّکَاةَ وَ أَمَرْتَ بِالْمَعْرُوفِ وَ نَهَیْتَ عَنِ الْمُنْکَرِ مَا اسْتَطَعْتَ مُبْتَغِیا مَا عِنْدَ اللهِ رَاغِبا فِیمَا وَعَدَ اللهُ لا تَحْفِلُ بِالنَّوَائِبِ وَ لا تَهِنُ عِنْدَ الشَّدَائِدِ,و به خاطر ترس و زبونى از خواستن حقّت ناتوان و درمانده نگشتى، پناه به خدا از اینکه چنین باشى، بلکه زمانى‏که مورد ستم واقع شدى. به حساب پروردگارت گذاشتى، و کارت را به او واگذار کردى، و ستمکاران را پند دادى ولى نپذیرفتند، و اندرز دادى ولى‏ قبول نکردند، و آنان را از خدا ترساندى، ولى نترسیدند، و شهادت مى‏دهم که تو اى امیر مؤمنان در راه خدا به حق‏ جهاد کردى، تا اینکه خدا تو را بجوارش فرا خواند، و به اختیارش تو را به جانب خود قبض روح کرد، و حجّتت را بر دشمنانت ختم کرد، با به قتل رساندن تو را، تا حجّت به سود تو و زیان باشد همراه با آنچه براى تو بود از حجّتهاى رسا بر همه‏ خلق. سلام بر تو اى امیر مؤمنان، خدا را خالصانه عبادت کردى، و صابرانه در راه‏ خدا جهاد نمودى، و به حساب خدا جانبازى کردى، و به کتابش عمل نمودى، و روش پیامبرش را پیروى کردى، و نماز را بپا داشتى، و زکات را پرداختى، و به معروف امر کردى، و تا توانستى از منکر نهى نمودى‏ طالب بودى آنچه را نزد خداست، راغب بودى در آنچه خدا وعده داد، کاسه صبرت از پیش آمدها لبریز نشد، و هنگام سختیها سست‏ نگشتى,7,1
342,40,وَ لا تَحْجِمُ عَنْ مُحَارِبٍ أَفِکَ مَنْ نَسَبَ غَیْرَ ذَلِکَ إِلَیْکَ وَ افْتَرَى بَاطِلا عَلَیْکَ وَ أَوْلَى لِمَنْ عَنَدَ عَنْکَ لَقَدْ جَاهَدْتَ فِی اللهِ حَقَّ الْجِهَادِ وَ صَبَرْتَ عَلَى الْأَذَى صَبْرَ احْتِسَابٍ وَ أَنْتَ أَوَّلُ مَنْ آمَنَ بِاللهِ وَ صَلَّى لَهُ وَ جَاهَدَ وَ أَبْدَى صَفْحَتَهُ فِی دَارِ الشِّرْکِ وَ الْأَرْضُ مَشْحُونَةٌ ضَلالَةً وَ الشَّیْطَانُ یُعْبَدُ جَهْرَةً وَ أَنْتَ الْقَائِلُ لا تَزِیدُنِی کَثْرَةُ النَّاسِ حَوْلِی عِزَّةً وَ لا تَفَرُّقُهُمْ عَنِّی وَحْشَةً وَ لَوْ أَسْلَمَنِی النَّاسُ جَمِیعا لَمْ أَکُنْ مُتَضَرِّعا اعْتَصَمْتَ بِاللهِ فَعَزَزْتَ وَ آثَرْتَ الْآخِرَةَ عَلَى الْأُولَى فَزَهِدْتَ وَ أَیَّدَکَ اللهُ وَ هَدَاکَ وَ أَخْلَصَکَ وَ اجْتَبَاکَ فَمَا تَنَاقَضَتْ أَفْعَالُکَ وَ لا اخْتَلَفَتْ أَقْوَالُکَ وَ لا تَقَلَّبَتْ أَحْوَالُکَ وَ لا ادَّعَیْتَ وَ لا افْتَرَیْتَ عَلَى اللهِ کَذِبا وَ لا شَرِهْتَ إِلَى الْحُطَامِ وَ لا دَنَّسَکَ الْآثَامُ وَ لَمْ تَزَلْ عَلَى بَیِّنَةٍ مِنْ رَبِّکَ وَ یَقِینٍ مِنْ أَمْرِکَ تَهْدِی إِلَى الْحَقِّ وَ إِلَى صِرَاطٍ مُسْتَقِیمٍ أَشْهَدُ شَهَادَةَ حَقٍّ,از مقابل هیچ جنگجویى بازنگشتى، آنکه غیر این امور را به تو نسبت داد تهمت زد، و به باطل دروغ‏ بر تو بست، و مرگ بر کسى‏که با اصرار بر مخالفت با تو از تو روى گرداند، به راستى در راه خدا به حق جهاد کردى، و بر آزار مردم به‏ نیکى صبر کردى صبرى به حساب خدا، تویى اوّل کسى‏که به خدا ایمان آوردى، و براى او نماز خواندى، و جهاد کردى، و خود را در خانه شرک براى حق آشکار نمودى، در حالى‏که زمین انباشته به گمراهى بود، و شیطان آشکارا عبادت مى‏شد، و تویى‏ گوینده این سخن: کثرت مردم در پیرامونم عزّتى به من نیفزاید و پراکنده‏شدنشان ترسى به من اضافه نکند، اگر همه مردم از من دست بردارند، نالان نشوم، پناهنده به خدا شدى و عزّت یافتى، آخرت را بر دنیا برگزیدى‏ و پارسا گشتى، خدا تأییدت نمود و راهنمایى فرمود، و در گردونه خلوص قرار داد، و تو را برگزید، کردارهایت ضد و نقیض‏ نشد، گفتارهایت اختلاف نیافت، حالاتت زیرورو نگشت، ادعاى بیهوده نکردى، و بر خدا دروغ نبستى، و به متاع اندک دنیا طمع نورزیدى، گناهان تو را آلوده نساخت، همواره امورت بر پایه برهانى‏ از سوى پروردگارت بود، در کارت بر یقین بودى، به سوى حق و راه مستقیم هدایت مى‏نمودى، شهادت مى‏دهم‏ شهادت حق,8,1
343,40,وَ أُقْسِمُ بِاللهِ قَسَمَ صِدْقٍ أَنَّ مُحَمَّدا وَ آلَهُ صَلَوَاتُ اللهِ عَلَیْهِمْ سَادَاتُ الْخَلْقِ وَ أَنَّکَ مَوْلایَ وَ مَوْلَى الْمُؤْمِنِینَ وَ أَنَّکَ عَبْدُ اللهِ وَ وَلِیُّهُ وَ أَخُو الرَّسُولِ وَ وَصِیُّهُ وَ وَارِثُهُ وَ أَنَّهُ الْقَائِلُ لَکَ وَ الَّذِی بَعَثَنِی بِالْحَقِّ مَا آمَنَ بِی مَنْ کَفَرَ بِکَ وَ لا أَقَرَّ بِاللهِ مَنْ جَحَدَکَ وَ قَدْ ضَلَّ مَنْ صَدَّ عَنْکَ وَ لَمْ یَهْتَدِ إِلَى اللهِ وَ لا إِلَیَّ مَنْ لا یَهْتَدِی بِکَ وَ هُوَ قَوْلُ رَبِّی عَزَّ وَ جَلَّ وَ إِنِّی لَغَفَّارٌ لِمَنْ تَابَ وَ آمَنَ وَ عَمِلَ صَالِحا ثُمَّ اهْتَدَى إِلَى وِلایَتِکَ مَوْلایَ فَضْلُکَ لا یَخْفَى وَ نُورُکَ لا یُطْفَأُ [لا یُطْفَى‏] وَ أَنَّ مَنْ جَحَدَکَ الظَّلُومُ الْأَشْقَى مَوْلایَ أَنْتَ الْحُجَّةُ عَلَى الْعِبَادِ وَ الْهَادِی إِلَى الرَّشَادِ وَ الْعُدَّةُ لِلْمَعَادِ مَوْلایَ لَقَدْ رَفَعَ اللهُ فِی الْأُولَى مَنْزِلَتَکَ وَ أَعْلَى فِی الْآخِرَةِ دَرَجَتَکَ وَ بَصَّرَکَ مَا عَمِیَ عَلَى مَنْ خَالَفَکَ وَ حَالَ بَیْنَکَ وَ بَیْنَ مَوَاهِبِ اللهِ لَکَ,و سوگند مى‏خورم سوگند صدق، که محمّد و خاندانش (درود خدا بر آنان باد) سروران خلقند، و اینکه تو مولاى من و مولاى همه مؤمنانى، تو بنده خدا و ولىّ او و برادر جانشین و وارث او هستى، و او گوینده این سخن به حضرت توست: سوگند به کسى‏که مرا به حق برانگیخت‏ به من ایمان نیاورد آن‏که به تو کافر شد، و به خدا اقرار ننمود آن‏که به انکار تو برخاست، گمراه شد کسى‏که مردم را از تو بازداشت، و به سوى خدا و به جانب من راه نیافت، و این گفتار پروردگار عزّ و جلّ من است: من آمرزنده‏ام آن کس را که توبه کرد، و ایمان آورد، و عمل شایسته انجام داد، سپس به سوى ولایت تو راه یابد. مولاى من فضل تو مخفى نمى‏ماند، و نورت خاموش نگردد، و آن‏که تو را انکار کند ستمکار و بدبخت است، مولاى من تو حجّت بر بندگانى‏ و راهنماى به سوى راه راستى، و ذخیره روز معادى، مولاى من خدا مقامت را در دنیا بلند کرد، و درجه‏ات را در آخرت والا گردانید، و بینایت نمود به آنچه بر کسى‏که با تو مخالفت کرد پوشیده ماند، و بین تو و موهبتهاى‏ خدا حجاب شد,9,1
344,40,فَلَعَنَ اللهُ مُسْتَحِلِّی الْحُرْمَةِ مِنْکَ وَ ذَائِدِی الْحَقِّ عَنْکَ وَ أَشْهَدُ أَنَّهُمُ الْأَخْسَرُونَ الَّذِینَ تَلْفَحُ وُجُوهَهُمُ النَّارُ وَ هُمْ فِیهَا کَالِحُونَ وَ أَشْهَدُ أَنَّکَ مَا أَقْدَمْتَ وَ لا أَحْجَمْتَ وَ لا نَطَقْتَ وَ لا أَمْسَکْتَ اِلّا بِأَمْرٍ مِنَ اللهِ وَ رَسُولِهِ قُلْتَ وَ الَّذِی نَفْسِی بِیَدِهِ لَقَدْ نَظَرَ إِلَیَّ رَسُولُ اللهِ صَلَّى اللهُ عَلَیْهِ وَ آلِهِ أَضْرِبُ بِالسَّیْفِ قُدْما فَقَالَ یَا عَلِیُّ أَنْتَ مِنِّی بِمَنْزِلَةِ هَارُونَ مِنْ مُوسَى اِلّا أَنَّهُ لا نَبِیَّ بَعْدِی وَ أُعْلِمُکَ أَنَّ مَوْتَکَ وَ حَیَاتَکَ مَعِی وَ عَلَى سُنَّتِی فَوَ اللهِ مَا کَذِبْتُ وَ لا کُذِبْتُ وَ لا ضَلَلْتُ وَ لا ضُلَّ بِی وَ لا نَسِیتُ مَا عَهِدَ إِلَیَّ رَبِّی وَ إِنِّی لَعَلَى بَیِّنَةٍ مِنْ رَبِّی بَیَّنَهَا لِنَبِیِّهِ وَ بَیَّنَهَا النَّبِیُّ لِی وَ إِنِّی لَعَلَى الطَّرِیقِ الْوَاضِحِ أَلْفِظُهُ لَفْظا صَدَقْتَ وَ اللهِ وَ قُلْتَ الْحَقَّ فَلَعَنَ اللهُ مَنْ سَاوَاکَ بِمَنْ نَاوَاکَ وَ اللهُ جَلَّ اسْمُهُ یَقُولُ,لعنت خدا بر حلال شمارندگان حرمتت، و دفع‏کنندگان حقّت، و شهادت مى‏دهم که آنان از زیانکار‌ترین مردمى هستند که آتش چهره آنان را مى‏سوزاند، و در میان دوزخ زشت و عبوس هستند، و شهادت مى‏دهم که اقدام نکردى، و قدم به عقب نگذاشتى، و سخن نگفیتى و باز نایستادى مگر به فرمان خدا و رسولش. خود فرمودى: سوگند به آن‏که جانم در دست اوست، رسول خدا (درود خدا بر او و خاندانش باد) به من نظر کرد، درحالى‏که پیش‏قدمانه شمشیر مى‏زدم، ایشان به من فرمود: اى على تو نسبت به من به منزله هارونى نسبت به موسى، جز اینکه‏ بعد از من پیغمبرى نیست، و من تو را خبر مى‏دهم که مرگ و زندگى تو با من و براساس راه و رسم من است، به خدا سوگند دروغ‏ نگفتم، و به من دروغ گفته نشد، و گمراه نشدم و کسى به وسیله من گمراه نشده، و آنچه را پروردگارم با من عهد کرده فراموش نکردم، من‏ بر برهانى از سوى پروردگارم هستم که براى پیامبرش بیان نموده و پیامبر نیز براى من بیان داشته است و من به راستى بر راه روشن هستم که آن‏ را صریح مى‏گویم با صراحت تمام، اى امیر مؤمنان به خدا سوگند راست گفتى، و حق گفتى. پس خدا لعنت کند کسى را که تو را با آن‏که با تو دشمنى کرد برابر قرار داد، درحالى‏که خدا مى‏فرماید,10,1
